all_awardings,associated_award,author,author_flair_background_color,author_flair_css_class,author_flair_richtext,author_flair_template_id,author_flair_text,author_flair_text_color,author_flair_type,author_fullname,author_patreon_flair,author_premium,awarders,body,collapsed_because_crowd_control,comment_type,created_utc,gildings,id,is_submitter,link_id,locked,no_follow,parent_id,permalink,retrieved_on,score,send_replies,stickied,subreddit,subreddit_id,top_awarded_type,total_awards_received,treatment_tags,distinguished,author_cakeday
[],,racingwinner,,,[],,,,text,t2_a5uvb,False,False,[],"opel astra convertible. it was overrated by my dad and my friends. i didn't hate it, but the same people who reveered my astra basically shat on my twingo. the astra just felt heavy. it was too much of a luxury car, and too little of a sportscar. but that is the thing post 2000 cars. they feel too big.",,,1619304226,{},gvrbdvd,False,t3_mxnf10,False,True,t3_mxnf10,/r/AskReddit/comments/mxnf10/what_is_the_most_overrated_product_youve_purchased/gvrbdvd/,1619320676,1,True,False,AskReddit,t5_2qh1i,,0,[],,
[],,mackenzie_X,,,[],,,,text,t2_b7xl43ey,False,False,[],my dad is deep in conspiracy. it’s not even funny anymore. i’m just watching an old man being scared of the world and refusing to listen to reason.,,,1619304226,{},gvrbdv6,False,t3_mxu4t5,False,False,t3_mxu4t5,/r/AskReddit/comments/mxu4t5/redditors_with_tinfoil_hat_relatives_what_are/gvrbdv6/,1619320676,9,True,False,AskReddit,t5_2qh1i,,0,[],,
[],,rrrbin,,,[],,,,text,t2_g8hrq,False,False,[],Why not?,,,1619304226,{},gvrbduq,False,t3_mxnber,False,True,t3_mxnber,/r/AskReddit/comments/mxnber/why_do_you_stay_alive/gvrbduq/,1619320676,1,True,False,AskReddit,t5_2qh1i,,0,[],,
[],,Chickendinner0398,,,[],,,,text,t2_1781ur,False,False,[],Re watching it all with my 1 year old son who’s obsessed. I still say this though 😂,,,1619304225,{},gvrbdr2,False,t3_mxo3lz,False,True,t3_mxo3lz,/r/AskReddit/comments/mxo3lz/redditors_who_always_responded_with_no_he_cant/gvrbdr2/,1619320674,1,True,False,AskReddit,t5_2qh1i,,0,[],,
[],,The_Death_Dealer,,,[],,,,text,t2_e2kxs,False,False,[],"I'm not backing a side on this, but have you considered that a parallel image might not have to be a perfect copy?",,,1619304224,{},gvrbdoe,True,t3_mxnju6,False,True,t1_gvq6fu0,/r/AskReddit/comments/mxnju6/what_is_the_most_interesting_question_you_can/gvrbdoe/,1619320673,2,True,False,AskReddit,t5_2qh1i,,0,[],,
[],,precillannoying,,,[],,,,text,t2_a11w2ytc,False,False,[],"How Hinduism says it respects women but in the Mahabharata, Draupadi had to be a wife to five brothers only because Arjuna (her actual husband) told his mother he won a prize, to which she said “Share it with your brothers.” Words could apparently not be taken back and he had to do it. Poor Draupadi went through abusive relationships. I’m happy I walked away from religion because it was oppressive as hell and I was told I was abused because I’m strong. Yeah no , thanks bye.",,,1619304223,{},gvrbdly,False,t3_mxcycv,False,True,t3_mxcycv,/r/AskReddit/comments/mxcycv/what_are_some_major_plot_holes_in_any_religion/gvrbdly/,1619320672,1,True,False,AskReddit,t5_2qh1i,,0,[],,
[],,cestmoimort,,,[],,,,text,t2_5mqmg1tw,False,False,[],A large box full of cockroaches. I set them free.,,,1619304223,{},gvrbdlj,False,t3_mxuqdu,False,True,t3_mxuqdu,/r/AskReddit/comments/mxuqdu/how_would_you_ruin_a_wedding_you_can_use_only_1/gvrbdlj/,1619320672,2,True,False,AskReddit,t5_2qh1i,,0,[],,
[],,perfectswirl,,,[],,,,text,t2_9xxbl8gr,False,True,[],"hiking, biking, running, rock climbing, even nude sunbathing!",,,1619304222,{},gvrbdk7,False,t3_mdlbrp,False,True,t3_mdlbrp,/r/AskReddit/comments/mdlbrp/how_the_f_do_you_make_friends_as_an_adult_if_you/gvrbdk7/,1619320672,1,True,False,AskReddit,t5_2qh1i,,0,[],,
[],,myshityourpants,,,[],,,,text,t2_1346yj,False,False,[],Im sitting at home with a bag of tacos next to my wife. How are you doing,,,1619304222,{},gvrbdjo,False,t3_mxo3lz,False,True,t3_mxo3lz,/r/AskReddit/comments/mxo3lz/redditors_who_always_responded_with_no_he_cant/gvrbdjo/,1619320671,1,True,False,AskReddit,t5_2qh1i,,0,[],,
[],,Tardwrangler66,,,[],,,,text,t2_ack73672,False,False,[],"Say ""what"" one more time",,,1619304222,{},gvrbdjk,False,t3_mxt1mb,False,True,t1_gvr5bhu,/r/AskReddit/comments/mxt1mb/mother_looks_exceptionally_fine_today_how_do_you/gvrbdjk/,1619320671,2,True,False,AskReddit,t5_2qh1i,,0,[],,
[],,Independent_Ice_4299,,,[],,,,text,t2_alohvw5v,False,False,[],Sticking a paper clip in an outlet during class (he is alive),,,1619304221,{},gvrbdj3,False,t3_mxpfn6,False,False,t3_mxpfn6,/r/AskReddit/comments/mxpfn6/what_is_the_stupidest_thing_youve_ever_seen_a/gvrbdj3/,1619320671,5,True,False,AskReddit,t5_2qh1i,,0,[],,
[],,kagurabitch,,,[],,,,text,t2_87j6ipgu,False,False,[],"People saying “if you don't drink and don't do drugs then you're boring” probably have no personality or hobbies. Also op, almost everyone drinks, maybe it's just finding those that don't drink a lot and also have other interests? All my friends either drink or do both but their lives don't revolve around it",,,1619304221,{},gvrbdie,False,t3_mxt1b5,False,True,t3_mxt1b5,/r/AskReddit/comments/mxt1b5/how_do_you_find_people_who_you_get_along_with_who/gvrbdie/,1619320671,2,True,False,AskReddit,t5_2qh1i,,0,[],,
[],,UnconstrictedEmu,,,[],,,,text,t2_8imtfr,False,False,[],Claire Redfield,,,1619304221,{},gvrbdi6,False,t3_mxtqcv,False,True,t3_mxtqcv,/r/AskReddit/comments/mxtqcv/whos_your_favorite_female_video_game_character/gvrbdi6/,1619320671,1,True,False,AskReddit,t5_2qh1i,,0,[],,
[],,CourtlyHades296,,,[],,,,text,t2_w4c2i,False,False,[],The Mask of Dimitrios (1944). It's a film noir starring Peter Lorre and Sydney Greenstreet that very few people have seen. This film needs more recognition.,,,1619304220,{},gvrbdge,False,t3_mxusei,False,True,t3_mxusei,/r/AskReddit/comments/mxusei/what_is_the_most_underrated_product_youve/gvrbdge/,1619320670,2,True,False,AskReddit,t5_2qh1i,,0,[],,
[],,Orizammar,,,[],,,,text,t2_78gw974,False,False,[],"Pizzahut thin crust pizza.

Little Caesars thin crust tastes exactly the same and is cheaper and anyone who corrects me is wrong. I'm right.",,,1619304219,{},gvrbdex,False,t3_mxnf10,False,False,t3_mxnf10,/r/AskReddit/comments/mxnf10/what_is_the_most_overrated_product_youve_purchased/gvrbdex/,1619320668,10,True,False,AskReddit,t5_2qh1i,,0,[],,
[],,rowdypumpkin245,,,[],,,,text,t2_57r2omt6,False,False,[],A sponge on a stick with fairy liquid coming out. Who ever made that is a king,,,1619304219,{},gvrbdem,False,t3_mxuu38,False,False,t3_mxuu38,/r/AskReddit/comments/mxuu38/what_is_the_most_underrated_product_youve_ever/gvrbdem/,1619320668,4,True,False,AskReddit,t5_2qh1i,,0,[],,
[],,loogielungs,,,[],,,,text,t2_bqqtvbjb,False,False,[],An iPhone,,,1619304219,{},gvrbddj,False,t3_mxnf10,False,True,t3_mxnf10,/r/AskReddit/comments/mxnf10/what_is_the_most_overrated_product_youve_purchased/gvrbddj/,1619320668,-1,True,False,AskReddit,t5_2qh1i,,0,[],,
[],,B0nes_666,,,[],,,,text,t2_8gx149hu,False,False,[],The number of global deaths increasing,,,1619304219,{},gvrbddd,False,t3_mxrzm6,False,True,t3_mxrzm6,/r/AskReddit/comments/mxrzm6/whats_one_thing_that_makes_you_happy/gvrbddd/,1619320668,1,True,False,AskReddit,t5_2qh1i,,0,[],,
[],,PixelPervert,,,[],,,,text,t2_8di4y5wf,False,False,[],"Multiple math courses, history courses, English courses, and science courses are all commonly required to graduate from high school. Several credits from ""elective"" courses like art, band, auto tech, pre-engineering, culinary arts, or theatre are also required.",,,1619304218,{},gvrbdb3,True,t3_mxtqsh,False,True,t1_gvr6yl6,/r/AskReddit/comments/mxtqsh/for_everyone_outside_of_a_native_english_speaking/gvrbdb3/,1619320667,1,True,False,AskReddit,t5_2qh1i,,0,[],,
[],,jorsiem,,,[],,,,text,t2_3gz17,False,False,[],Non left leaning straight white male.,,,1619304218,{},gvrbdai,False,t3_mxtvgf,False,True,t3_mxtvgf,/r/AskReddit/comments/mxtvgf/what_demographic_are_you_part_of_that_the/gvrbdai/,1619320667,3,True,False,AskReddit,t5_2qh1i,,0,[],,
[],,IchMochteAllesHaben,,,[],,,,text,t2_2t5jivn7,False,False,[],"An iPhone, they're boring and overpriced",,,1619304218,{},gvrbda5,False,t3_mxnf10,False,True,t3_mxnf10,/r/AskReddit/comments/mxnf10/what_is_the_most_overrated_product_youve_purchased/gvrbda5/,1619320667,-2,True,False,AskReddit,t5_2qh1i,,0,[],,
[],,ChinUpButtercup4,,,[],,,,text,t2_auson133,False,False,[],Keep them because I’m a hoarder,,,1619304217,{},gvrbd7s,False,t3_mxutrk,False,False,t3_mxutrk,/r/AskReddit/comments/mxutrk/what_do_you_do_with_your_old_phones/gvrbd7s/,1619320666,5,True,False,AskReddit,t5_2qh1i,,0,[],,
[],,williewill19,,,[],,,,text,t2_5xave,False,False,[],"You know he’s a crack head, right?",,,1619304216,{},gvrbd5s,False,t3_mxnf10,False,False,t1_gvr8g9k,/r/AskReddit/comments/mxnf10/what_is_the_most_overrated_product_youve_purchased/gvrbd5s/,1619320665,22,True,False,AskReddit,t5_2qh1i,,0,[],,
[],,Poullafouca,,,[],,,,text,t2_9b1xz,False,True,[],I only use old.reddit.  I hate the new one. Heinous.,,,1619304216,{},gvrbd5b,False,t3_mxnf10,False,False,t1_gvr0v74,/r/AskReddit/comments/mxnf10/what_is_the_most_overrated_product_youve_purchased/gvrbd5b/,1619320665,22,True,False,AskReddit,t5_2qh1i,,0,[],,
[],,SpookyVoidCat,,,[],,,,text,t2_49zo6ey,False,False,[],"I stayed up for 36 hours while returning from a trip to the US, ended up hallucinating angry hateful faces pushing their way out of my bedroom walls at me. I knew logically that they weren’t real, but I still couldn’t shake the unease and sense of dread. Ended up pouring a salt circle around my bed just so the scared part of me would calm down enough to let the rest of me pass out.",,,1619304215,{},gvrbd3y,False,t3_mxm918,False,True,t3_mxm918,/r/AskReddit/comments/mxm918/whats_the_scariest_thing_you_heard_or_saw_at_night/gvrbd3y/,1619320665,1,True,False,AskReddit,t5_2qh1i,,0,[],,
[],,iWillNeverReplyToYou,,,[],,,,text,t2_8b7zkjke,False,False,[],"Cortana, just the right amount of sass.",,,1619304215,{},gvrbd3x,False,t3_mxtqcv,False,True,t3_mxtqcv,/r/AskReddit/comments/mxtqcv/whos_your_favorite_female_video_game_character/gvrbd3x/,1619320665,1,True,False,AskReddit,t5_2qh1i,,0,[],,
[],,Snoo_3765,,,[],,,,text,t2_6yi8rmkv,False,False,[],Damn,,,1619304213,{},gvrbd00,True,t3_mxuus4,False,True,t1_gvrbbs5,/r/AskReddit/comments/mxuus4/joshs_of_reddit_what_was_the_craziest_thing_that/gvrbd00/,1619320663,2,True,False,AskReddit,t5_2qh1i,,0,[],,
[],,Areez188,,,[],,,,text,t2_55xa3hby,False,False,[],Like giant burgers?,,,1619304213,{},gvrbczv,False,t3_mxur3g,False,True,t1_gvrb5x4,/r/AskReddit/comments/mxur3g/americans_of_reddit_why_is_your_cereal_full_of/gvrbczv/,1619320663,-2,True,False,AskReddit,t5_2qh1i,,0,[],,
[],,MintyTechJoint99,,,[],,,,text,t2_bif1g23g,False,False,[],Welcome to the Jungle - Guns n Roses  or Fade to Black - Metallica ...can't decide,,,1619304213,{},gvrbczk,False,t3_mxupck,False,True,t3_mxupck,/r/AskReddit/comments/mxupck/whats_your_favourite_song/gvrbczk/,1619320663,1,True,False,AskReddit,t5_2qh1i,,0,[],,
[],,SRKFRIES,,,[],,,,text,t2_zfnpm7q,False,False,[],"Those big Texas garlic breads, I ate them so much that one day I thought I was gonna vomit just looking at it",,,1619304213,{},gvrbczj,False,t3_mxuhnr,False,True,t3_mxuhnr,/r/AskReddit/comments/mxuhnr/what_food_did_you_love_and_ate_regularly_and_then/gvrbczj/,1619320663,3,True,False,AskReddit,t5_2qh1i,,0,[],,
[],,PrestigiousOnions,,,[],,,,text,t2_at87x228,False,False,[],Ok,,,1619304213,{},gvrbcyz,False,t3_mxtzg4,False,True,t1_gvr97zx,/r/AskReddit/comments/mxtzg4/if_god_is_so_loving_then_why_does_he_tend_to/gvrbcyz/,1619320662,0,True,False,AskReddit,t5_2qh1i,,0,[],,
[],,FaqueFaquer,,,[],,,,text,t2_5nzlnsky,False,False,[],That scene was the POINT.,,,1619304213,{},gvrbcyo,False,t3_mxmage,False,True,t1_gvqt8vc,/r/AskReddit/comments/mxmage/what_is_the_most_over_the_top_death_scene_of_a/gvrbcyo/,1619320662,2,True,False,AskReddit,t5_2qh1i,,0,[],,
[],,wickedspork,,,[],,,,text,t2_5fzzw,False,False,[],"I have a pair of first Gen Dre beats headphones. Not worth it, but I still use them 10 years later",,,1619304213,{},gvrbcxt,False,t3_mxnf10,False,True,t3_mxnf10,/r/AskReddit/comments/mxnf10/what_is_the_most_overrated_product_youve_purchased/gvrbcxt/,1619320662,1,True,False,AskReddit,t5_2qh1i,,0,[],,
[],,CedarWolf,,,[],,,,text,t2_4k7de,False,True,[],Let's talk about Rampart.,,,1619304212,{},gvrbcxl,False,t3_mxnf10,False,True,t1_gvr02we,/r/AskReddit/comments/mxnf10/what_is_the_most_overrated_product_youve_purchased/gvrbcxl/,1619320662,2,True,False,AskReddit,t5_2qh1i,,0,[],,
[],,Brat-tina,,,[],,,,text,t2_5trs2tha,False,False,[],Shut up. =p,,,1619304212,{},gvrbcwy,False,t3_mxo3lz,False,True,t3_mxo3lz,/r/AskReddit/comments/mxo3lz/redditors_who_always_responded_with_no_he_cant/gvrbcwy/,1619320662,1,True,False,AskReddit,t5_2qh1i,,0,[],,
[],,Reasonable_Jury_5620,,,[],,,,text,t2_blsvbcnr,False,False,[],I can't drive to Mexico because im Florida which would take me literally days to get there lmaooo. I've had people mention Mexico to me before but tbh I've heard Mexico is pretty dangerous to be in by yourself as a foreigner.,,,1619304212,{},gvrbcw4,True,t3_mxuelf,False,True,t1_gvraosj,/r/AskReddit/comments/mxuelf/what_does_someone_do_if_theyre_scared_to_travel/gvrbcw4/,1619320660,1,True,False,AskReddit,t5_2qh1i,,0,[],,
[],,itbespauldo,,,[],,,,text,t2_16pcid,False,False,[],Really the only 2 theories that make sense to me are either Adam and Eve had quite a good number of kids and because of the pure genetic pool incest was nothing like it is today. Or there were many other humans made at the same time but Adam and Eve were mentioned because they were chosen to be like the first high priests of the Garden/world then.,,,1619304212,{},gvrbcv0,False,t3_mxcycv,False,True,t1_gvnpbpq,/r/AskReddit/comments/mxcycv/what_are_some_major_plot_holes_in_any_religion/gvrbcv0/,1619320660,1,True,False,AskReddit,t5_2qh1i,,0,[],,
[],,Bilbo_Swaggins__,,,[],,,,text,t2_4cgz0qc3,False,False,[],A really deep kinda arooof..? Mountain dogs are gentle giants really but their barks or growls can be pretty intimidating to kids,,,1619304211,{},gvrbcur,False,t3_mxunys,False,True,t3_mxunys,/r/AskReddit/comments/mxunys/how_would_you_spell_out_your_dogs_bark/gvrbcur/,1619320660,1,True,False,AskReddit,t5_2qh1i,,0,[],,
[],,strawberryer,,,[],,,,text,t2_a17jurm9,False,False,[],i am downright terrified of moths,,,1619304211,{},gvrbcue,False,t3_mxuoa7,False,True,t3_mxuoa7,/r/AskReddit/comments/mxuoa7/what_are_your_irrational_fears_serious/gvrbcue/,1619320660,1,True,False,AskReddit,t5_2qh1i,,0,[],,
[],,Issa_vibe74,,,[],,,,text,t2_94eycgte,False,False,[],What’s wrong with you,,,1619304211,{},gvrbcto,False,t3_mxuvvh,False,False,t3_mxuvvh,/r/AskReddit/comments/mxuvvh/what_would_you_do_if_you_accidentally_sent_your/gvrbcto/,1619320660,4,True,False,AskReddit,t5_2qh1i,,0,[],,
[],,edinborough,,,[],,,,text,t2_ou8ct,False,False,[],"no way, I think Coach had a dip over the last decade but I have seen a LOT of fashion bloggers wearing the Coach Tabby shoulder bag lately. I think they are having a bit of a resurgence. I agree with you on Michael Kors though",,,1619304211,{},gvrbcss,False,t3_mxnf10,False,False,t1_gvr8d08,/r/AskReddit/comments/mxnf10/what_is_the_most_overrated_product_youve_purchased/gvrbcss/,1619320660,7,True,False,AskReddit,t5_2qh1i,,0,[],,
[],,Tbnrcactus02,,,[],,,,text,t2_55hip2l1,False,False,[], that’s kinda funny that he stole it and you saw it,,,1619304210,{},gvrbcs4,False,t3_mxuud1,False,True,t1_gvrb7s4,/r/AskReddit/comments/mxuud1/what_really_obvious_thing_have_you_only_just/gvrbcs4/,1619320658,3,True,False,AskReddit,t5_2qh1i,,0,[],,
[],,ThanatosTheSaviour,,,[],,,,text,t2_9nr76cme,False,False,[],"Somewhere I Belong - Linkin Park

Boulevard Of Broken Dreams - Green Day",,,1619304209,{},gvrbcpj,False,t3_mxupck,False,True,t3_mxupck,/r/AskReddit/comments/mxupck/whats_your_favourite_song/gvrbcpj/,1619320658,2,True,False,AskReddit,t5_2qh1i,,0,[],,
[],,JayTheMemester2002,,,[],,,,text,t2_5p03c4di,False,True,[],Dragon ball xenoverse 2,,,1619304209,{},gvrbcow,False,t3_mxt9sr,False,True,t3_mxt9sr,/r/AskReddit/comments/mxt9sr/what_game_do_you_still_open_up_play_even_after/gvrbcow/,1619320658,1,True,False,AskReddit,t5_2qh1i,,0,[],,
[],,SwoleBeard92,,,[],,,,text,t2_1nulaof3,False,False,[],Go to the gym,,,1619304208,{},gvrbcl6,False,t3_mxuf5u,False,True,t3_mxuf5u,/r/AskReddit/comments/mxuf5u/everything_is_boring_what_do_you_do/gvrbcl6/,1619320657,2,True,False,AskReddit,t5_2qh1i,,0,[],,
[],,Vulture12,,,[],,,,text,t2_11odsd,False,False,[],Never use the campus bookstore,,,1619304208,{},gvrbckm,False,t3_mxuo9s,False,True,t3_mxuo9s,/r/AskReddit/comments/mxuo9s/what_are_some_good_ways_to_save_money_in_college/gvrbckm/,1619320656,1,True,False,AskReddit,t5_2qh1i,,0,[],,
[],,Street_Tacos__,,,[],,,,text,t2_6evn5zym,False,False,[],"Does Star Wars count?


If not Back to the Future 100%",,,1619304207,{},gvrbcjj,False,t3_mxtril,False,True,t3_mxtril,/r/AskReddit/comments/mxtril/what_are_your_favorite_nonsuperhero_movie/gvrbcjj/,1619320656,2,True,False,AskReddit,t5_2qh1i,,0,[],,
[],,IHaveMamasPhone,,,[],,,,text,t2_bor2s2b3,False,False,[],The earth is flat,,,1619304207,{},gvrbcil,False,t3_mtciy1,False,True,t3_mtciy1,/r/AskReddit/comments/mtciy1/what_is_a_common_myth_that_has_been_debunked_but/gvrbcil/,1619320655,1,True,False,AskReddit,t5_2qh1i,,0,[],,
[],,CanadianClassicss,,,[],,,,text,t2_ypk9t,False,False,[],You gotta give us the play by play,,,1619304206,{},gvrbchm,True,t3_mxuuhu,False,False,t1_gvrb650,/r/AskReddit/comments/mxuuhu/what_is_the_most_depressing_situation_youve/gvrbchm/,1619320655,4,True,False,AskReddit,t5_2qh1i,,0,[],,
[],,ShitJadeSays,,,[],,,,text,t2_230kn50b,False,False,[],Have you found any good alternatives? I need one of those for a dress I'm wearing to a wedding next month but that's exactly what I was worried about with them.,,,1619304206,{},gvrbcgt,False,t3_mxnf10,False,False,t1_gvr7laz,/r/AskReddit/comments/mxnf10/what_is_the_most_overrated_product_youve_purchased/gvrbcgt/,1619320655,30,True,False,AskReddit,t5_2qh1i,,0,[],,
[],,Vprbite,,,[],,,,text,t2_17bugf,False,True,[],Just say fuck the Lemons and bail,,,1619304206,{},gvrbcfv,False,t3_mxc8es,False,True,t1_gvnvetc,/r/AskReddit/comments/mxc8es/what_is_the_most_porn_logic_thing_youve_witnessed/gvrbcfv/,1619320654,1,True,False,AskReddit,t5_2qh1i,,0,[],,
[],,bipolarcyclops,,,[],,,,text,t2_32uhpno,False,False,[],The Dead.,,,1619304205,{},gvrbceg,False,t3_mxrg0c,False,True,t3_mxrg0c,/r/AskReddit/comments/mxrg0c/what_are_you_grateful_for/gvrbceg/,1619320654,1,True,False,AskReddit,t5_2qh1i,,0,[],,
[],,do_mika,,,[],,,,text,t2_2fubojfk,False,True,[],I agree about the vacuums and everything else but you can pry my Airwrap out of my cold dead hands.,,,1619304205,{},gvrbce1,False,t3_mxnf10,False,True,t1_gvql4nz,/r/AskReddit/comments/mxnf10/what_is_the_most_overrated_product_youve_purchased/gvrbce1/,1619320653,2,True,False,AskReddit,t5_2qh1i,,0,[],,
[],,Torn_Droxion,,,[],,,,text,t2_8e7qz0r0,False,False,[],Taking pics of public transport and I still do that since I was little,,,1619304205,{},gvrbcdf,False,t3_mxuv9a,False,True,t3_mxuv9a,/r/AskReddit/comments/mxuv9a/whats_something_youve_achieved_over_lockdown_that/gvrbcdf/,1619320653,1,True,False,AskReddit,t5_2qh1i,,0,[],,
[],,HalfAPickle,,,[],,,,text,t2_z50d3,False,False,[],"B.A. in History and PoliSci here, in a rural area, with no route to grad school. I really wish somebody had taken me aside during those four years of college and kindly explained to me that you aren't allowed to study the humanities and succeed unless you're rich and/or well connected, because I'm really struggling now.",,,1619304204,{},gvrbcct,False,t3_mxnf10,False,False,t1_gvr351g,/r/AskReddit/comments/mxnf10/what_is_the_most_overrated_product_youve_purchased/gvrbcct/,1619320653,9,True,False,AskReddit,t5_2qh1i,,0,[],,
[],,Suspicious_Victory_1,,,[],,,,text,t2_8dynczx1,False,False,[],Okapi has to be up there,,,1619304204,{},gvrbcch,False,t3_mxuvtu,False,True,t3_mxuvtu,/r/AskReddit/comments/mxuvtu/what_are_some_of_the_weirdest_looking_animals_on/gvrbcch/,1619320653,2,True,False,AskReddit,t5_2qh1i,,0,[],,
[],,djmikewatt,,,[],,,,text,t2_igcoh,False,True,[],Anything from Apple.,,,1619304204,{},gvrbcar,False,t3_mxnf10,False,False,t3_mxnf10,/r/AskReddit/comments/mxnf10/what_is_the_most_overrated_product_youve_purchased/gvrbcar/,1619320652,-3,True,False,AskReddit,t5_2qh1i,,0,[],,
[],,No_Improvement_7884,,,[],,,,text,t2_9g7bct0i,False,False,[],Indie,,,1619304203,{},gvrbca9,False,t3_mxuh34,False,False,t3_mxuh34,/r/AskReddit/comments/mxuh34/what_genre_of_music_do_you_listen_to_the_most/gvrbca9/,1619320652,3,True,False,AskReddit,t5_2qh1i,,0,[],,
[],,Swingin-it-swooty,,,[],,,,text,t2_2vf802fn,False,False,[],No broken bones after getting beaten to a pulp by a giant mutant,,,1619304203,{},gvrbc9d,False,t3_mxub1z,False,True,t3_mxub1z,/r/AskReddit/comments/mxub1z/what_is_something_incredibly_unrealistic_in/gvrbc9d/,1619320651,2,True,False,AskReddit,t5_2qh1i,,0,[],,
[],,canarchist,,,[],,,,text,t2_47v3v,False,False,[],"Congratulations, I'll have a grande bold with an extra shot of espresso and a sausage breakfast sandwich.",,,1619304203,{},gvrbc8l,False,t3_mxnf10,False,True,t1_gvqtbpf,/r/AskReddit/comments/mxnf10/what_is_the_most_overrated_product_youve_purchased/gvrbc8l/,1619320651,-2,True,False,AskReddit,t5_2qh1i,,0,[],,
[],,Sweet_Persimmon6375,,,[],,,,text,t2_blr0rttv,False,False,[],Destroyed him for killing Ratchet,,,1619304202,{},gvrbc6f,False,t3_mxuv9a,False,True,t3_mxuv9a,/r/AskReddit/comments/mxuv9a/whats_something_youve_achieved_over_lockdown_that/gvrbc6f/,1619320650,1,True,False,AskReddit,t5_2qh1i,,0,[],,
[],,OrganMeat,,,[],,,,text,t2_d0nkl,False,False,[],I kinda like that about robot vacuums. I have it run every day while I'm at work and it motivates me to keep things tidy and off the floors.,,,1619304202,{},gvrbc5t,False,t3_mxnf10,False,False,t1_gvqzlsn,/r/AskReddit/comments/mxnf10/what_is_the_most_overrated_product_youve_purchased/gvrbc5t/,1619320650,382,True,False,AskReddit,t5_2qh1i,,0,[],,
[],,SaysTheGamerWord,,,[],,,,text,t2_6m571dhn,False,False,[],Travel and eat like crazy.,,,1619304202,{},gvrbc5s,False,t3_mxuv7l,False,True,t3_mxuv7l,/r/AskReddit/comments/mxuv7l/if_you_knew_you_were_going_to_die_in_exactly_one/gvrbc5s/,1619320650,3,True,False,AskReddit,t5_2qh1i,,0,[],,
[],,beancounter2trucker,,,[],,,,text,t2_55o55cd4,False,False,[],Health insurance,,,1619304201,{},gvrbc3p,False,t3_mxugle,False,True,t3_mxugle,/r/AskReddit/comments/mxugle/what_it_worth_the_money/gvrbc3p/,1619320649,1,True,False,AskReddit,t5_2qh1i,,0,[],,
[],,zigzagfilters,,,[],,,,text,t2_6304z3vx,False,False,[],You can always make more money 🤷‍♀️,,,1619304200,{},gvrbc2n,False,t3_mxsv8c,False,True,t3_mxsv8c,/r/AskReddit/comments/mxsv8c/how_do_you_reconcile_accidentally_spending_a_lot/gvrbc2n/,1619320649,1,True,False,AskReddit,t5_2qh1i,,0,[],,
[],,kaiju_dream,,,[],,,,text,t2_adw3gvzp,False,False,[],Hey man don't say that about yourself,,,1619304199,{},gvrbc0u,True,t3_mxsjpm,False,True,t1_gvqzue3,/r/AskReddit/comments/mxsjpm/what_would_most_consider_a_gigachad/gvrbc0u/,1619320648,2,True,False,AskReddit,t5_2qh1i,,0,[],,
[],,Missus_Aitch_99,,,[],,,,text,t2_4tqvcqvn,False,True,[],"Some small businesses still want to get paid with a paper check.  The guy who mows our lawn is one.  Also, if you should be mailing someone money, like in a birthday card, it’s safer to include a check rather than cash, in case someone steals the envelope.  Also with a check you have proof that the recipient got the money; the check, once cashed, is its own receipt.  Also some recipients make you pay extra if using plastic to cover the fee they are charged to process it.  My husband belongs to a golf club that does this, as does my daughter’s private school.",,,1619304198,{},gvrbbxs,False,t3_mxufhg,False,True,t3_mxufhg,/r/AskReddit/comments/mxufhg/what_are_the_2_events_you_go_to_the_bank_with/gvrbbxs/,1619320646,2,True,False,AskReddit,t5_2qh1i,,0,[],,
[],,[deleted],,,,,,dark,,,,,[],[deleted],,,1619304198,{},gvrbbx4,False,t3_mxu3um,False,True,t3_mxu3um,/r/AskReddit/comments/mxu3um/youre_a_pull_string_toy_someone_pulls_your_string/gvrbbx4/,1619320646,1,True,False,AskReddit,t5_2qh1i,,0,[],,
[],,AutoModerator,,,[],,,,text,t2_6l4z3,False,True,[],"This submission has been automatically removed because you did not include a question mark (""?"") in your title. Reddit does not allow post titles to be edited, so if you would like, you can post the question again.  Please write your title in proper question format, and include a question mark, thank you.

*I am a bot, and this action was performed automatically. Please [contact the moderators of this subreddit](/message/compose/?to=/r/AskReddit) if you have any questions or concerns.*",,,1619304197,{},gvrbbw5,False,t3_mxuw18,False,True,t3_mxuw18,/r/AskReddit/comments/mxuw18/to_woman_do_you_like_it_when_man_touch_your_boobs/gvrbbw5/,1619320646,1,False,False,AskReddit,t5_2qh1i,,0,[],moderator,
[],,donttrademe,,,[],,,,text,t2_6h72e5v9,False,False,[],"One thing that's work for me is dirt bike hand brake/ clutch. Teenagers want to go fast and crash a lot, you'll save a ton of money on broken ones with an unbreakable set.",,,1619304197,{},gvrbbw4,False,t3_mxnf10,False,True,t1_gvqz12g,/r/AskReddit/comments/mxnf10/what_is_the_most_overrated_product_youve_purchased/gvrbbw4/,1619320646,1,True,False,AskReddit,t5_2qh1i,,0,[],,
[],,rr777,,,[],,,,text,t2_61rdy,False,False,[],Some silly dog sees owner again after three years video.,,,1619304197,{},gvrbbvd,False,t3_mxundj,False,True,t3_mxundj,/r/AskReddit/comments/mxundj/what_was_the_last_thing_that_made_you_cry/gvrbbvd/,1619320645,1,True,False,AskReddit,t5_2qh1i,,0,[],,
