all_awardings,associated_award,author,author_flair_background_color,author_flair_css_class,author_flair_richtext,author_flair_template_id,author_flair_text,author_flair_text_color,author_flair_type,author_fullname,author_patreon_flair,author_premium,awarders,body,collapsed_because_crowd_control,comment_type,created_utc,gildings,id,is_submitter,link_id,locked,no_follow,parent_id,permalink,retrieved_on,score,send_replies,stickied,subreddit,subreddit_id,top_awarded_type,total_awards_received,treatment_tags,distinguished
[],,elfarmie,,,[],,,,text,t2_4dxtj7ph,False,False,[],Would you/have you ever called out coworkers for being “dirty” cops? Or if you ever saw someone using excessive force?,,,1619296089,{},gvqvo3y,False,t3_mxnfsk,False,True,t3_mxnfsk,/r/AMA/comments/mxnfsk/im_a_cop_ama/gvqvo3y/,1619312176,1,True,False,AMA,t5_2r4eo,,0,[],
[],,Throwaway18737337,,,[],,,,text,t2_bbasdxl4,False,False,[],"That was when i started watching baseball, yes. I was a server and i watched baseball on the down time",,,1619296083,{},gvqvnqb,True,t3_mxs112,False,True,t1_gvqv8ag,/r/AMA/comments/mxs112/i_think_i_watched_more_than_200_baseball_games_in/gvqvnqb/,1619312170,2,True,False,AMA,t5_2r4eo,,0,[],
[],,Tobias783,,,[],,,,text,t2_31u7xfog,False,False,[],"What do you and your colleagues do at lunch break when you don’t really need this serious persona? Do you discuss your weekend, play cards or what do you guys do?",,,1619296069,{},gvqvmpj,False,t3_mxnfsk,False,True,t3_mxnfsk,/r/AMA/comments/mxnfsk/im_a_cop_ama/gvqvmpj/,1619312156,2,True,False,AMA,t5_2r4eo,,0,[],
[],,cnnispoison,,,[],,,,text,t2_a2s93r0p,False,False,[],"I'm curious. I heard the employees have trouble making it to the bathrooms and back so they pee in containers.

Is this true?",,,1619296037,{},gvqvkis,False,t3_mxrlrp,False,False,t3_mxrlrp,/r/AMA/comments/mxrlrp/hello_ive_worked_at_warehouses_my_entire_adult/gvqvkis/,1619312125,1,True,False,AMA,t5_2r4eo,,0,[],
[],,gal_pal_kal,,,[],,,,text,t2_2o0q5m8t,False,False,[],"Are you suggesting holding only the department accountable, or do you think the individual should take accountability as well? 

How do you propose officers are held accountable for wrong doing if not by eliminating or at least reducing the protections of qualified immunity?",,,1619295968,{},gvqvfr9,False,t3_mxnfsk,False,False,t1_gvq9j9w,/r/AMA/comments/mxnfsk/im_a_cop_ama/gvqvfr9/,1619312053,15,True,False,AMA,t5_2r4eo,,0,[],
[],,Goolajones,,,[],,,,text,t2_11vdfy,False,False,[],"You can also find a reason to postpone. The cop who have the ticket it less likely to come to the new date as they are the original date. Then you win by default, at least here in Canada.",,,1619295954,{},gvqvesp,False,t3_mxnfsk,False,False,t1_gvqggnv,/r/AMA/comments/mxnfsk/im_a_cop_ama/gvqvesp/,1619312040,10,True,False,AMA,t5_2r4eo,,0,[],
[],,kzg0015,,,[],,,,text,t2_7l9n3sfl,False,False,[],Is the g spot real?,,,1619295949,{},gvqvef1,False,t3_mxan9q,False,True,t3_mxan9q,/r/AMA/comments/mxan9q/im_a_sex_education_teacher_and_i_know_you_all/gvqvef1/,1619312035,1,True,False,AMA,t5_2r4eo,,0,[],
[],,cnnispoison,,,[],,,,text,t2_a2s93r0p,False,False,[],"Wow, I never even thought of this.",,,1619295939,{},gvqvdqp,False,t3_mxrlrp,False,True,t1_gvqsxcu,/r/AMA/comments/mxrlrp/hello_ive_worked_at_warehouses_my_entire_adult/gvqvdqp/,1619312025,0,True,False,AMA,t5_2r4eo,,0,[],
[],,cnnispoison,,,[],,,,text,t2_a2s93r0p,False,False,[],What do you do? Work at a bar?,,,1619295859,{},gvqv8ag,False,t3_mxs112,False,True,t1_gvqv5jv,/r/AMA/comments/mxs112/i_think_i_watched_more_than_200_baseball_games_in/gvqv8ag/,1619311942,1,True,False,AMA,t5_2r4eo,,0,[],
[],,Neel_LifeCoach,,,[],,,,text,t2_aatxzc51,False,False,[],"In the US, it makes around $ 60 K . Much less elsewhere. As per ICF, Life Coaching would become the fastest growing industry by 2022, reaching $ 20 billion from the current around $ 3 billion and Corporate Training is already a $ 370 Billion (2019 figures) industry. I hope that helps. Cheers Neel.",,,1619295839,{},gvqv6yh,True,t3_mxkl13,False,False,t1_gvqliep,/r/AMA/comments/mxkl13/i_am_wellness_coach_ama_about_being_better_in/gvqv6yh/,1619311923,1,True,False,AMA,t5_2r4eo,,0,[],
[],,Threeminusme,,,[],,,,text,t2_633skne2,False,False,[],"I am not an OP but I will chime in to give you an answer if that’s okay. It depends on how difficult a patient you are. I mean how difficult your diagnosis is. I was allowed to have my phone, my laptop, my tablet with me. We had free wifi in certain zone and because my room was very close to that zone I could use my devices in my room. I just couldn’t have chargers in my room (also nowhere to charge things in a room anyways). I was allowed to take walks in hospital’s territory too. But I’ve heard of people who were kept in horrible conditions: no devices, no internet, not able to call their loved ones, not allowed to take walks and being watched 24/7, no privacy, nothing. But they were for major part severe schizophrenics or suicidal and they were a danger to themselves and everybody around them.",,,1619295822,{},gvqv5ql,False,t3_mxjjs0,False,True,t1_gvp2a21,/r/AMA/comments/mxjjs0/i_currently_have_free_time_in_my_hospital_ama/gvqv5ql/,1619311906,2,True,False,AMA,t5_2r4eo,,0,[],
[],,Throwaway18737337,,,[],,,,text,t2_bbasdxl4,False,False,[],"it doesn’t pay very well but it gets me through college. So boss makes a dollar, i make a dime, that’s why i watch the league on company time.",,,1619295819,{},gvqv5jv,True,t3_mxs112,False,True,t1_gvquzya,/r/AMA/comments/mxs112/i_think_i_watched_more_than_200_baseball_games_in/gvqv5jv/,1619311903,1,True,False,AMA,t5_2r4eo,,0,[],
[],,WagyuBeefCubes,,,[],,,,text,t2_1s1y7gdq,False,False,[],"Come visit Hong Kong lmao. We have pineapples with chicken and other various combinations (seafood, veggies, beef, etc) on pizza. I have no idea why people like it tbh. Our pizza hut menu is ....probably questionable.",,,1619295808,{},gvqv4qv,False,t3_mxr8n6,False,True,t1_gvqsjvj,/r/AMA/comments/mxr8n6/im_trilingual_from_birth_and_can_speak_many_more/gvqv4qv/,1619311890,2,True,False,AMA,t5_2r4eo,,0,[],
[],,A-A-Ron1867,,,[],,,,text,t2_2qyytn7,False,False,[],"When someone is new of the force, are they excited to get their first arrest? (I'm thinking like the scene in 21 jump street after the bust the biker drug dealer)",,,1619295778,{},gvqv2o1,False,t3_mxnfsk,False,True,t3_mxnfsk,/r/AMA/comments/mxnfsk/im_a_cop_ama/gvqv2o1/,1619311860,1,True,False,AMA,t5_2r4eo,,0,[],
[],,cnnispoison,,,[],,,,text,t2_a2s93r0p,False,False,[],"What kind of job do you have where you can watch TV?

Are they hiring?",,,1619295740,{},gvquzya,False,t3_mxs112,False,True,t1_gvquwdi,/r/AMA/comments/mxs112/i_think_i_watched_more_than_200_baseball_games_in/gvquzya/,1619311821,1,True,False,AMA,t5_2r4eo,,0,[],
[],,KimJongUnsDoctor,,,[],,,,text,t2_6atpoe11,False,False,[],"I plan on becoming a detective when I grow up (I’m a sophomore in high school currently) because I really want to help people and I would like to know if you know what it takes and what I need to do to get there. Would I need to become a cop first and then become a detective? What is a good academic path to take in order to achieve my goal? Is it worth it? How did your friends/family react? 

I’m sorry if this is a lot but I get worried about these things because i don’t know if I’m going to enjoy it even though I love to help people or if I might become a corrupt cop. I’m also reluctant becuase I know my parents would not want me to join law enforcement and my friends know that I can get a much better job, financially that is, if I wanted to due to my grades so everything makes me worried about pursuing this path.",,,1619295735,{},gvquzlg,False,t3_mxnfsk,False,True,t3_mxnfsk,/r/AMA/comments/mxnfsk/im_a_cop_ama/gvquzlg/,1619311817,3,True,False,AMA,t5_2r4eo,,0,[],
[],,pommemiles,,,[],,,,text,t2_7wuy7aea,False,False,[],"It's not my only favourite but it's one of them. Of course there's a sexual aspect because it's my genitals, but mostly just because of how it looks now. The appearance of a little penis alleviated a lot of dysphoria around my genitals.",,,1619295725,{},gvquywh,True,t3_mxotst,False,True,t1_gvqu77l,/r/AMA/comments/mxotst/im_a_transgender_man_female_to_male_ama/gvquywh/,1619311807,1,True,False,AMA,t5_2r4eo,,0,[],
[],,Throwaway18737337,,,[],,,,text,t2_bbasdxl4,False,False,[],It’s no hockey tho,,,1619295701,{},gvqux4g,True,t3_mxs112,False,True,t1_gvqujbo,/r/AMA/comments/mxs112/i_think_i_watched_more_than_200_baseball_games_in/gvqux4g/,1619311782,1,True,False,AMA,t5_2r4eo,,0,[],
[],,k2kyo,,,[],,,,text,t2_azss9,False,False,[],What about the protests where the violence was committed by the police against peaceful protestors? How should people respond to that?,,,1619295692,{},gvquwg5,False,t3_mxnfsk,False,False,t1_gvq3wbd,/r/AMA/comments/mxnfsk/im_a_cop_ama/gvquwg5/,1619311771,4,True,False,AMA,t5_2r4eo,,0,[],
[],,Throwaway18737337,,,[],,,,text,t2_bbasdxl4,False,False,[],At first i used to go to the stadium because tickets were like 15 dollars and i could eat peanuts and drinks and enjoy myself with the fam. Now i put it on at work every single day so ive watched more than 200 games in their entirety,,,1619295691,{},gvquwdi,True,t3_mxs112,False,False,t1_gvqum8w,/r/AMA/comments/mxs112/i_think_i_watched_more_than_200_baseball_games_in/gvquwdi/,1619311770,1,True,False,AMA,t5_2r4eo,,0,[],
[],,cnnispoison,,,[],,,,text,t2_a2s93r0p,False,False,[],"The left is the worst. They are the most racist. They feel minorities are beneath them and they're the great hope to saving them to make themselves feel better. 

They live in their rich ivory towers and want to rule the little people.

They use their woke virtue signaling to shut any dialogue down. 

It's pathetic.",,,1619295675,{},gvquv85,False,t3_mxhl69,False,True,t1_gvqulx5,/r/AMA/comments/mxhl69/i_resigned_from_lapd_this_week_after_11_years_of/gvquv85/,1619311752,0,True,False,AMA,t5_2r4eo,,0,[],
[],,Dee-tective,,,[],,,,text,t2_4te7pp88,False,False,[],"How's Ramadan going for you so far?

Happy Ramadan! ❤️",,,1619295664,{},gvquufy,False,t3_mxqaq2,False,True,t3_mxqaq2,/r/AMA/comments/mxqaq2/i_am_a_muslim_living_in_the_middle_east_ama/gvquufy/,1619311740,2,True,False,AMA,t5_2r4eo,,0,[],
[],,MesWantooth,,,[],,,,text,t2_30h0j54n,False,False,[],"There should be a specific $300 ticket for anyone who utters ""I will have your badge""/""I will get you fired"" - when it is followed by ""Do you know who I am?"" (as opposed to a complaint about the Officer's conduct).",,,1619295629,{},gvquryf,False,t3_mxnfsk,False,False,t1_gvqeutw,/r/AMA/comments/mxnfsk/im_a_cop_ama/gvquryf/,1619311703,52,True,False,AMA,t5_2r4eo,,0,[],
[],,Throwaway18737337,,,[],,,,text,t2_bbasdxl4,False,False,[],I love it,,,1619295612,{},gvquqp6,True,t3_mxs112,False,True,t1_gvqujbo,/r/AMA/comments/mxs112/i_think_i_watched_more_than_200_baseball_games_in/gvquqp6/,1619311684,1,True,False,AMA,t5_2r4eo,,0,[],
[],,WagyuBeefCubes,,,[],,,,text,t2_1s1y7gdq,False,False,[],"&gt;Taiwan (only place that uses traditional script, and kanji in japanese) 

*coughs in Hong Kong*

Hong Kong, Macau, and some Chinatowns in various countries use traditional ones as well. But yeah, I agree with what you said about the Chinese Gov. A lot of Chinese living in mainland China still dont believe what's happening in XinJiang is real, from what I heard.

&gt;I decided to start learning dutch instead &amp; french when I’m good enough at that

Good luck!",,,1619295604,{},gvquq4p,False,t3_mxr8n6,False,True,t1_gvqsgji,/r/AMA/comments/mxr8n6/im_trilingual_from_birth_and_can_speak_many_more/gvquq4p/,1619311677,2,True,False,AMA,t5_2r4eo,,0,[],
[],,Gnostic_Mind,,,[],,,,text,t2_6hihc,False,False,[],"Heh  


You won't do that again.",,,1619295582,{},gvquoiq,False,t3_mxp97z,False,True,t3_mxp97z,/r/AMA/comments/mxp97z/i_just_took_1500_mg_of_edibles_thinking_they/gvquoiq/,1619311654,2,True,False,AMA,t5_2r4eo,,0,[],
[],,R0XG4MER,,,[],,,,text,t2_1j3fmcvw,False,False,[],Could you elaborate please? I don't understand what exactly you're talking about,,,1619295581,{},gvquodr,True,t3_mxi5at,False,False,t1_gvq4ms8,/r/AMA/comments/mxi5at/im_a_muslim_with_pretty_good_knowledge_of_my/gvquodr/,1619311652,1,True,False,AMA,t5_2r4eo,,0,[],
[],,cnnispoison,,,[],,,,text,t2_a2s93r0p,False,False,[],"Cause it's once, twice, thrice, four strikes you're out at the old ball game!",,,1619295552,{},gvqum8w,False,t3_mxs112,False,True,t3_mxs112,/r/AMA/comments/mxs112/i_think_i_watched_more_than_200_baseball_games_in/gvqum8w/,1619311622,1,True,False,AMA,t5_2r4eo,,0,[],
[],,MDrok6172,,,[],,,,text,t2_7mjdoy1w,False,False,[],"Bezos does nothing for humanity, he's a poser with too much money and power that should be used to help others.

Trump used his money to gain more followers not help the country, as president he only had his interests at heart. Proof, his reaction to the pandemic.

I know Cruz, Carlson, or Greene aren't billionaires but they are part of the right that only use their positions for influence instead of helping people. When Texas blacked out what did Cruz do? Nothing. He tucked tail and ran to Mexico, where all the ""rapists and murderers are from""

And of course Gates only does stuff for himself but he still does more for others than Republicans and the other people you mentioned combined. At least the left attempts to help people but the right is so ingrained in itself to do anything and only blame its own failures on the left.

The right is openly and horribly racist, they won't acknowledge it because they know their party is rife with it. The right has done nothing for racial issues recently, won't hold police accountable and will keep spreading misinformation to keep the country divided because pride is more important than unity.",,,1619295548,{},gvqulx5,False,t3_mxhl69,False,True,t1_gvqtize,/r/AMA/comments/mxhl69/i_resigned_from_lapd_this_week_after_11_years_of/gvqulx5/,1619311617,1,True,False,AMA,t5_2r4eo,,0,[],
[],,Argyrus777,,,[],,,,text,t2_5dkaa6j4,False,False,[],How do you assure the customer there’s no cheating?,,,1619295547,{},gvqulwf,False,t3_mxre7g,False,True,t3_mxre7g,/r/AMA/comments/mxre7g/im_a_online_casino_dealer_croupier_ama/gvqulwf/,1619311617,1,True,False,AMA,t5_2r4eo,,0,[],
[],,R0XG4MER,,,[],,,,text,t2_1j3fmcvw,False,False,[],"There's no solid proof of her age anywhere, but either way, whether that marriage is acceptable or not shouldn't be measured based on today's standards as it was a different time and their traditions are completely different than today's",,,1619295534,{},gvqukyp,True,t3_mxi5at,False,True,t1_gvpylm2,/r/AMA/comments/mxi5at/im_a_muslim_with_pretty_good_knowledge_of_my/gvqukyp/,1619311603,1,True,False,AMA,t5_2r4eo,,0,[],
[],,metdarkgamer,,,[],,,,text,t2_9djcysbo,False,False,[],Is baseball as boring as i believe it is?,,,1619295513,{},gvqujbo,False,t3_mxs112,False,True,t3_mxs112,/r/AMA/comments/mxs112/i_think_i_watched_more_than_200_baseball_games_in/gvqujbo/,1619311580,1,True,False,AMA,t5_2r4eo,,0,[],
[],,nz_nba_fan,,,[],,,,text,t2_fcbr7,False,False,[],How much training do you receive a year in physical altercations / physically restraining suspects for arrest? Do you think it’s adequate?,,,1619295512,{},gvqujar,False,t3_mxnfsk,False,True,t3_mxnfsk,/r/AMA/comments/mxnfsk/im_a_cop_ama/gvqujar/,1619311580,1,True,False,AMA,t5_2r4eo,,0,[],
[],,Argyrus777,,,[],,,,text,t2_5dkaa6j4,False,False,[],I agree union protects the employees too much sometimes so bad apples end up sticking around longer than needed. The pay is usually higher to cover all the union dues and at least it’s set in stone how much you’ll be making vs non union. And yes union usually works at a slower pace and sometimes production feels like half the staff.,,,1619295484,{},gvquh5q,False,t3_mxrlrp,False,False,t3_mxrlrp,/r/AMA/comments/mxrlrp/hello_ive_worked_at_warehouses_my_entire_adult/gvquh5q/,1619311550,1,True,False,AMA,t5_2r4eo,,0,[],
[],,DemonAscended,,,[],,,,text,t2_3d5yhm5s,False,False,[],"Do you teach about lgbt+ sex ed as well? 

If so, do you think it helps others both inside and outside of the lgbt+?

If not are you
a. Allowed to, but don’t know/aren’t educated on lgbt+ sex ed/health?
b. Not allowed to, but wish you could?

What’s the ‘weirdest’ question you’ve been asked?

And what grade(s) do you teach to?",,,1619295477,{},gvquglx,False,t3_mxan9q,False,True,t3_mxan9q,/r/AMA/comments/mxan9q/im_a_sex_education_teacher_and_i_know_you_all/gvquglx/,1619311542,1,True,False,AMA,t5_2r4eo,,0,[],
[],,AirForceWeirdo,,,[],,,,text,t2_14vqyq,False,False,[],Ahahahahahahahaha wtf.,,,1619295382,{},gvqu9hl,False,t3_mxnfsk,False,True,t1_gvqu1fv,/r/AMA/comments/mxnfsk/im_a_cop_ama/gvqu9hl/,1619311440,1,True,False,AMA,t5_2r4eo,,0,[],
[],,dankyfied,,,[],,,,text,t2_3wt33oxl,False,False,[],"have you ever been forced to shoot someone? if so, under what circumstances?",,,1619295380,{},gvqu9bv,False,t3_mxnfsk,False,True,t3_mxnfsk,/r/AMA/comments/mxnfsk/im_a_cop_ama/gvqu9bv/,1619311438,2,True,False,AMA,t5_2r4eo,,0,[],
[],,pellium6,,,[],,,,text,t2_88d8zcef,False,False,[],You mentioned in another post that growing the 'T dick' has been your favourite part of your transformation. Is this from a sexual point of view or from a progress part of view?,,,1619295352,{},gvqu77l,False,t3_mxotst,False,True,t1_gvqs97e,/r/AMA/comments/mxotst/im_a_transgender_man_female_to_male_ama/gvqu77l/,1619311407,1,True,False,AMA,t5_2r4eo,,0,[],
[],,Blue-Corn,,,[],,,,text,t2_37jima4f,False,False,[],End of Watch is great for that partner love. It’s Hollywood and all but the love is there. Hot Fuzz is probably the most realistic. The guy brings down criminals with tactics and paperwork.,,,1619295337,{},gvqu63n,True,t3_mxnfsk,False,True,t1_gvqsyqh,/r/AMA/comments/mxnfsk/im_a_cop_ama/gvqu63n/,1619311390,2,True,False,AMA,t5_2r4eo,,0,[],
[],,Golemfrost,,,[],,,,text,t2_70soe,False,False,[],A cop in which state?,,,1619295333,{},gvqu5se,False,t3_mxnfsk,False,True,t3_mxnfsk,/r/AMA/comments/mxnfsk/im_a_cop_ama/gvqu5se/,1619311385,0,True,False,AMA,t5_2r4eo,,0,[],
[],,HorusGaming_YT,,,[],,,,text,t2_76f2g5c2,False,False,[],What’s the craziest thing you’ve been called for. Sorry if this has been asked,,,1619295292,{},gvqu2q6,False,t3_mxnfsk,False,True,t3_mxnfsk,/r/AMA/comments/mxnfsk/im_a_cop_ama/gvqu2q6/,1619311340,2,True,False,AMA,t5_2r4eo,,0,[],
[],,theprizeidiot,,,[],,,,text,t2_i07d4l8,False,False,[],https://www.raindance.org/wp-content/uploads/Kung-fury-COP-300x294.jpg,,,1619295275,{},gvqu1fv,False,t3_mxnfsk,False,True,t1_gvqqvqj,/r/AMA/comments/mxnfsk/im_a_cop_ama/gvqu1fv/,1619311321,3,True,False,AMA,t5_2r4eo,,0,[],
[],,flareblitz91,,,[],,,,text,t2_dgu20,False,False,[],"What European country do you live in? Because from what I’ve seen in my travels, European police roll harder than Americans, depending on city, role, etc",,,1619295264,{},gvqu0jh,False,t3_mxhl69,False,True,t1_gvqqewz,/r/AMA/comments/mxhl69/i_resigned_from_lapd_this_week_after_11_years_of/gvqu0jh/,1619311307,1,True,False,AMA,t5_2r4eo,,0,[],
[],,Blue-Corn,,,[],,,,text,t2_37jima4f,False,False,[],Meh. I just take it in stride. I’m still going to get up tomorrow and do the same job. I sleep just fine at night.,,,1619295250,{},gvqtzk5,True,t3_mxnfsk,False,True,t1_gvqqwcc,/r/AMA/comments/mxnfsk/im_a_cop_ama/gvqtzk5/,1619311294,3,True,False,AMA,t5_2r4eo,,0,[],
[],,chunkymonkey160,,,[],,,,text,t2_a3imzk6v,False,False,[],"I'm a teenager who's thinking about becoming a cop when I grow up, but I'm not completely sure. Is there any advice you can give me to figure out if this is the right job for me? Pros and cons of the job? Any general advice you can give someone who's looking to become a law enforcement officer?",,,1619295210,{},gvqtwky,False,t3_mxnfsk,False,True,t3_mxnfsk,/r/AMA/comments/mxnfsk/im_a_cop_ama/gvqtwky/,1619311249,1,True,False,AMA,t5_2r4eo,,0,[],
[],,R0XG4MER,,,[],,,,text,t2_1j3fmcvw,False,False,[],"They were always an enemy of muslims and what happened was basically war, if you have a specific thing to ask about then please do",,,1619295208,{},gvqtwdq,True,t3_mxi5at,False,True,t1_gvpysr8,/r/AMA/comments/mxi5at/im_a_muslim_with_pretty_good_knowledge_of_my/gvqtwdq/,1619311246,1,True,False,AMA,t5_2r4eo,,0,[],
[],,ForgettableUsername,,,[],,,,text,t2_485gd,False,False,[],"It's kind of a different story when it's fecal bacteria, though.",,,1619295162,{},gvqtsy4,False,t3_mxan9q,False,True,t1_gvoc1mu,/r/AMA/comments/mxan9q/im_a_sex_education_teacher_and_i_know_you_all/gvqtsy4/,1619311197,1,True,False,AMA,t5_2r4eo,,0,[],
[],,HorusGaming_YT,,,[],,,,text,t2_76f2g5c2,False,False,[],Ummm... any1 in this thread wanna play apex?,,,1619295159,{},gvqtssf,False,t3_mxnfsk,False,False,t1_gvqrrdn,/r/AMA/comments/mxnfsk/im_a_cop_ama/gvqtssf/,1619311194,5,True,False,AMA,t5_2r4eo,,0,[],
[],,Tonysaiz,,,[],,,,text,t2_oqh2j,False,False,[],"Hey, want to say that have a whole lot of love and respect for you guys and gals. I think most people don’t realize the enormous level of pressure that you guys go through on a daily basis. I also think that MOST younger folks (both major races) live in a bubble where they don’t respect authority- parents, teachers or police- and, in some cases, become subject to justified police action.That being said, it seems that police “first response” training now seems to be unduly harsh,aggressive and militaristic.Do you agree that police responses are more aggressive now than how police were trained to respond say 10 years ago?",,,1619295135,{},gvqtqya,False,t3_mxnfsk,False,True,t3_mxnfsk,/r/AMA/comments/mxnfsk/im_a_cop_ama/gvqtqya/,1619311168,2,True,False,AMA,t5_2r4eo,,0,[],
[],,theprizeidiot,,,[],,,,text,t2_i07d4l8,False,False,[],Have you ever fired two guns whilst flying through the air?,,,1619295105,{},gvqtonz,False,t3_mxnfsk,False,False,t1_gvqoefj,/r/AMA/comments/mxnfsk/im_a_cop_ama/gvqtonz/,1619311135,20,True,False,AMA,t5_2r4eo,,0,[],
[],,MissingRemusLupin,,,[],,,,text,t2_8xzajuw9,False,False,[],"Hello. I am not from USA, but I have read several times on Reddit that according to some research done in the early 1990s, at least 40% of police families experience domestic violence (self reported), presumably propagated by the police officer who is further presumably male (this is the vibe I get here, I don't know what the demographics are like in your police departments, ours are heavily male dominated). Those sane stats said that at the time the research was released, non police families had  domestic violence rates of 10%. 

What do you think about these stats, and is it still the same?

Thanks.",,,1619295099,{},gvqto6v,False,t3_mxnfsk,False,False,t3_mxnfsk,/r/AMA/comments/mxnfsk/im_a_cop_ama/gvqto6v/,1619311129,5,True,False,AMA,t5_2r4eo,,0,[],
[],,R0XG4MER,,,[],,,,text,t2_1j3fmcvw,False,False,[],"I personally don't know to be completely honest with you, but if it's prohibited then there's a good reason for that",,,1619295085,{},gvqtn31,True,t3_mxi5at,False,True,t1_gvq624o,/r/AMA/comments/mxi5at/im_a_muslim_with_pretty_good_knowledge_of_my/gvqtn31/,1619311113,1,True,False,AMA,t5_2r4eo,,0,[],
[],,n0t_autistic,,,[],,,,text,t2_bilspalb,False,False,[],Was poor doesnt mean still is,,,1619295068,{},gvqtltk,False,t3_mxprz0,False,True,t1_gvqqzk4,/r/AMA/comments/mxprz0/my_mom_was_the_classic_cliche_of_a_rich_girl_who/gvqtltk/,1619311094,1,True,False,AMA,t5_2r4eo,,0,[],
[],,adityasheth,,,[],,,,text,t2_15t3d9p5,False,False,[],"Yeah apex is probably the best battle royale nowadays, never tried r6s but it looks fun.",,,1619295031,{},gvqtj74,False,t3_mxnfsk,False,False,t1_gvqrrdn,/r/AMA/comments/mxnfsk/im_a_cop_ama/gvqtj74/,1619311056,5,True,False,AMA,t5_2r4eo,,0,[],
[],,TaroLive6501,,,[],,,,text,t2_a4ad907o,False,False,[],I have the contact info of the search angel I used and would be happy to send you her name if you’d like,,,1619295028,{},gvqtizk,True,t3_mwmd57,False,True,t1_gvpy1ob,/r/AMA/comments/mwmd57/i_am_an_adult_adoptee_ama/gvqtizk/,1619311054,1,True,False,AMA,t5_2r4eo,,0,[],
[],,cnnispoison,,,[],,,,text,t2_a2s93r0p,False,False,[],"What does Bezos do for humanity? 


Trump lost billions while he was a president because he wanted to fix the country. 

Cruz, Carlson and Greene are not billionaires like the ones I mentioned.

Gates does stuff for himself. He thinks the little people need him. 

The left is the party of rhetoric when they're the true racists. They stand for nothing except hating the US and wanting to ruin it so they stay in power.",,,1619295028,{},gvqtize,False,t3_mxhl69,False,True,t1_gvqt734,/r/AMA/comments/mxhl69/i_resigned_from_lapd_this_week_after_11_years_of/gvqtize/,1619311054,0,True,False,AMA,t5_2r4eo,,0,[],
[],,Threeminusme,,,[],,,,text,t2_633skne2,False,False,[],Thank you.,,,1619295019,{},gvqtifg,False,t3_mxocfp,False,False,t1_gvqssk0,/r/AMA/comments/mxocfp/have_been_to_prisonjuvie_multiple_times_ama/gvqtifg/,1619311046,1,True,False,AMA,t5_2r4eo,,0,[],
[],,choke_my_chocobo,,,[],,,,text,t2_c20xs,False,False,[],How have you never testified in court? I was a cop for 5 years and I testified numerous times. We even got on call pay for court dates.,,,1619294999,{},gvqtgz5,False,t3_mxnfsk,False,True,t1_gvq3l5r,/r/AMA/comments/mxnfsk/im_a_cop_ama/gvqtgz5/,1619311025,1,True,False,AMA,t5_2r4eo,,0,[],
[],,converter-bot,,,[],,,,text,t2_zds627j,False,True,[],85 mph is 136.79 km/h,,,1619294980,{},gvqtfny,False,t3_mxnfsk,False,True,t1_gvqtenu,/r/AMA/comments/mxnfsk/im_a_cop_ama/gvqtfny/,1619311006,3,True,False,AMA,t5_2r4eo,,0,[],
[],,DeenaDeals,,,[],,,,text,t2_39hk4yo1,False,False,[],"Right! He didn't get charged, because he didn't distribute  it, which he told them and me he didn't. The whole thing was nuts.",,,1619294980,{},gvqtfn3,False,t3_mxan9q,False,True,t1_gvql7dw,/r/AMA/comments/mxan9q/im_a_sex_education_teacher_and_i_know_you_all/gvqtfn3/,1619311006,2,True,False,AMA,t5_2r4eo,,0,[],
