all_awardings,associated_award,author,author_flair_background_color,author_flair_css_class,author_flair_richtext,author_flair_template_id,author_flair_text,author_flair_text_color,author_flair_type,author_fullname,author_patreon_flair,author_premium,awarders,body,collapsed_because_crowd_control,comment_type,created_utc,gildings,id,is_submitter,link_id,locked,no_follow,parent_id,permalink,retrieved_on,score,send_replies,stickied,subreddit,subreddit_id,top_awarded_type,total_awards_received,treatment_tags,author_cakeday,distinguished
[],,pantshole,,,[],,,,text,t2_40l0jxzz,False,False,[],"Thank you so, so much for your response. Part of why I reached out is because of how kind, informed and encouraging you’ve been to everyone. It’s wonderful that you’ve been taking so much time to respond to everyone. The world could use more sex educators like you!
It’s sad because I was raised by traditional and religious parents. Despite not being a believer myself, when my mother told me the hormones in birth control were actually bad for you and not to be trusted I totally believed her. By the time I was old enough to think and act for myself I’d become a pack-a-day smoker and was discouraged by my doctor from the pill due to the risk of clotting. Now that I no longer smoke cigarettes hopefully I can find a means of BC that works for me. Thank you again. It really took reading your response to understand how helpful BC can be in regulating these symptoms and that I don’t necessarily have to live with the embarrassment of turning into a hot mess every three weeks.",,,1619279011,{},gvpuprt,False,t3_mxan9q,False,True,t1_gvpq88p,/r/AMA/comments/mxan9q/im_a_sex_education_teacher_and_i_know_you_all/gvpuprt/,1619292462,2,True,False,AMA,t5_2r4eo,,0,[],,
[],,Lilllers,,,[],,,,text,t2_1nun1mtt,False,False,[],"A friend of mine's foreskin was too tight-ish and he talked about having to cut off a bit of it (if I understood him correctly). Not sure if he did though.
Another friend had issues when he was younger pulling the foreskin back due to pain. But he got some salve that supposedly helped with it.

Personally I'd suggest pulling it back a little bit on a regular basis to get used to it/ease up the foreskin, practice. But I'm not an expert of any sort so I'm just going off experience.

The foreskin will kind of automatically get pulled back during penetration/putting a condom on so just make sure it feels alright for you when putting on a condom before inserting to avoid hurting yourself.",,,1619279004,{},gvpup04,False,t3_mxan9q,False,False,t1_gvnqatn,/r/AMA/comments/mxan9q/im_a_sex_education_teacher_and_i_know_you_all/gvpup04/,1619292452,3,True,False,AMA,t5_2r4eo,,0,[],,
[],,pretzler92,,,[],,,,text,t2_9bd053yn,False,False,[],Don’t do it. There’s absolutely no payoff at the end.,,,1619278940,{},gvpuiut,False,t3_mxjjs0,False,True,t1_gvoxppz,/r/AMA/comments/mxjjs0/i_currently_have_free_time_in_my_hospital_ama/gvpuiut/,1619292369,2,True,False,AMA,t5_2r4eo,,0,[],,
[],,Disastrous_Reality_4,,,[],,,,text,t2_7wutrc4q,False,False,[],"As I mentioned in another comment, my 18yo stepson thought that he could get a girl pregnant via oral sex until his dad and I corrected him after a comment he made. It’s not just you! American public schooling fails so many people in so many ways - one of the worst being sex education. 

It would be helpful if there was a national standard for sex ed, and education in generally, honestly, for schools to adhere to. Currently they all vary by state, which seems silly to me.",,,1619278928,{},gvpuhzp,False,t3_mxan9q,False,True,t1_gvnp9v0,/r/AMA/comments/mxan9q/im_a_sex_education_teacher_and_i_know_you_all/gvpuhzp/,1619292356,2,True,False,AMA,t5_2r4eo,,0,[],,
[],,arrowfuckinghead,,,[],,,,text,t2_a7t99yu2,False,True,[],I see students ages 12-30. It depends on where Im hired to go!,,,1619278919,{},gvpuhc2,True,t3_mxan9q,False,False,t1_gvojdfm,/r/AMA/comments/mxan9q/im_a_sex_education_teacher_and_i_know_you_all/gvpuhc2/,1619292346,6,True,False,AMA,t5_2r4eo,,0,[],,
[],,arrowfuckinghead,,,[],,,,text,t2_a7t99yu2,False,True,[],"Generally, no. Anal penetration, potentially more painful.",,,1619278886,{},gvpueyi,True,t3_mxan9q,False,True,t1_gvoitnz,/r/AMA/comments/mxan9q/im_a_sex_education_teacher_and_i_know_you_all/gvpueyi/,1619292308,2,True,False,AMA,t5_2r4eo,,0,[],,
[],,LordNazRen,,,[],,,,text,t2_bjkob8w1,False,False,[],Fuck. Women go through so damn much,,,1619278878,{},gvpuedx,False,t3_mxan9q,False,False,t1_gvntyfj,/r/AMA/comments/mxan9q/im_a_sex_education_teacher_and_i_know_you_all/gvpuedx/,1619292297,5,True,False,AMA,t5_2r4eo,,0,[],,
[],,arrowfuckinghead,,,[],,,,text,t2_a7t99yu2,False,True,[],"Hi! This is really normal. You might be demisexual — which means that you don’t feel hyper sexual or desire sex all the time. Your hormones change in your 20s and shift in your 30s too. If you want to increase your sex drive, workout for 20-30 minutes with lifting weights. Working your muscles will increase your sex drive (this is everyone, not just men).

You are normal and if you are communicating with your partner and working through it, that’s the best thing I would hope for you!",,,1619278855,{},gvpucmt,True,t3_mxan9q,False,False,t1_gvoias8,/r/AMA/comments/mxan9q/im_a_sex_education_teacher_and_i_know_you_all/gvpucmt/,1619292269,4,True,False,AMA,t5_2r4eo,,0,[],,
[],,Neolord9000,,,[],,,,text,t2_41iamgkt,False,False,[],"Dumb question but whenever I see images or videos of peoples penises its always like bent up, mine doesn't do that tho, it like bends kinda down. Like it'll start normal but the end kinda dips down? Idk how else to explain it but if you do get it, is this normal?",,,1619278825,{},gvpuaej,False,t3_mxan9q,False,True,t3_mxan9q,/r/AMA/comments/mxan9q/im_a_sex_education_teacher_and_i_know_you_all/gvpuaej/,1619292232,1,True,False,AMA,t5_2r4eo,,0,[],,
[],,Skills__IAmS,,,[],,,,text,t2_89azzd3r,False,False,[],"Do you teach about anything to do with transgender people? And if you do, what do you teach? If not, do you think it would be good to?",,,1619278781,{},gvpu77s,False,t3_mxan9q,False,True,t3_mxan9q,/r/AMA/comments/mxan9q/im_a_sex_education_teacher_and_i_know_you_all/gvpu77s/,1619292181,1,True,False,AMA,t5_2r4eo,,0,[],,
[],,pretzler92,,,[],,,,text,t2_9bd053yn,False,False,[],"No one fucking cares, Joel. Go get a job.",,,1619278756,{},gvpu56s,False,t3_mxjxdh,False,True,t3_mxjxdh,/r/AMA/comments/mxjxdh/i_just_turned_18_usd_into_1369_usd_in_2_months_76x/gvpu56s/,1619292150,2,True,False,AMA,t5_2r4eo,,0,[],,
[],,LoganLuqman,,,[],,,,text,t2_asempy7s,False,False,[],"Very well said, I agree with you 100%. 

I always say there's a difference between knowledge and wisdom. People are encouraged to gain all kinds of knowledge in Islam but aren't learning the wisdom behind things. Like we memorize verses and teach kids to memorize them but sometimes fail to understand the meaning and the purpose behind these ayat, so we're essentially becoming parrots who just repeat.

And like what you mentioned things about manners. There tends to be people who even though they are praying 5 times, fasting and doing whatever we should be doing, but still have rude attitudes and our character is not matching Islam and doesn't resemble the character of the prophets. Since the prophet muhammad. alayhi salaat wa salaam, said ""whoever is better in manners is better in religion"", it seems to be a big issue that we need to address more.

I think when there are muslims who are only muslim by name see the muslim who does practice certain things but is rude or judgemental it can be very discouraging for them to want to have Islam in their lives more. We are not The Most Just of Judges, and if we were given other peoples lives we may have made worse decisions with them.

I really like your point on discussions with peoples concerns or fears in religion especially young people. We should be more open to controversial subjects, that's the only way we'll understand how to get through them. Also certain subjects in Islam that seem controversial when you are uninformed, but once you do become informed are not controversial at all. Let's talk about the hard things and not shy away from them. 

I think the way we educate people on things in deen could be better. Like I said before we sometimes have knowledge but lack wisdom. We need to teach people to use their minds, and like the Quran says so many times, PONDER, CONTEMPLATE.",,,1619278745,{},gvpu473,False,t3_mx9hdk,False,True,t1_gvp9v8p,/r/AMA/comments/mx9hdk/im_a_religious_muslim_female_and_an_arab_ama/gvpu473/,1619292135,2,True,False,AMA,t5_2r4eo,,0,[],,
[],,arrowfuckinghead,,,[],,,,text,t2_a7t99yu2,False,True,[],"Yes it does! Remember that all people don’t have the same spots and locations for pleasure. Also, the vagina muscle or rectum will slightly align the penis when inserted. 

You can think about sex positions that best suit your penis too! If you curve to one side, then having sex somewhat sideways would be the best sex your partners ever had!",,,1619278714,{},gvpu0x1,True,t3_mxan9q,False,False,t1_gvoi82d,/r/AMA/comments/mxan9q/im_a_sex_education_teacher_and_i_know_you_all/gvpu0x1/,1619292089,3,True,False,AMA,t5_2r4eo,,0,[],,
[],,Disastrous_Reality_4,,,[],,,,text,t2_7wutrc4q,False,False,[],"Yep, and it’s obnoxious! Add in the horrible cramps we get from our uterus shrinking back down to its normal size after being stretched to the size of the baby and you can see why a lot of new moms are crabby even outside of the lack of sleep you get with a newborn lol.",,,1619278618,{},gvptpv6,False,t3_mxan9q,False,True,t1_gvnqyjx,/r/AMA/comments/mxan9q/im_a_sex_education_teacher_and_i_know_you_all/gvptpv6/,1619291941,1,True,False,AMA,t5_2r4eo,,0,[],,
[],,arrowfuckinghead,,,[],,,,text,t2_a7t99yu2,False,True,[],"Hey! I’m here! I just had to sleep.

Circumcision is highly cultural and religious. It is not necessary for the health or life of an infant. It is largely Western — male circumcision is really normal in lots of places worldwide! 

People do it for cultural and religious reasons along with a controversial idea that circumcised penises are easier for keeping clean as kids. Well, they require more attention to cleaning, but then we should teach kids hygiene and not cut their genitals without their consent.",,,1619278612,{},gvptp6k,True,t3_mxan9q,False,True,t1_gvogyb4,/r/AMA/comments/mxan9q/im_a_sex_education_teacher_and_i_know_you_all/gvptp6k/,1619291932,2,True,False,AMA,t5_2r4eo,,0,[],,
[],,Lazy-Guidance1910,,,[],,,,text,t2_a5jmk0fp,False,False,[],It is so likely that we don't have any guard.,,,1619278518,{},gvptebr,True,t3_mx2ljw,False,True,t1_gvpk8iy,/r/AMA/comments/mx2ljw/i_work_in_a_bank_in_rural_india_ama/gvptebr/,1619291787,2,True,False,AMA,t5_2r4eo,,0,[],,
[],,arrowfuckinghead,,,[],,,,text,t2_a7t99yu2,False,True,[],Thank you! 🥰,,,1619278447,{},gvpt61c,True,t3_mxan9q,False,True,t1_gvogrh3,/r/AMA/comments/mxan9q/im_a_sex_education_teacher_and_i_know_you_all/gvpt61c/,1619291677,1,True,False,AMA,t5_2r4eo,,0,[],,
[],,arrowfuckinghead,,,[],,,,text,t2_a7t99yu2,False,True,[],"Fetishes and kinks are more or less acceptable to talk about than others at different times in social life a d location. 

Foot fetishes are just common for men. There are so so many images out there that just show women’s legs and feet. But it is not genital or a “regular arousal zone” so people will always have their ideas and attitudes about things.",,,1619278428,{},gvpt3ss,True,t3_mxan9q,False,True,t1_gvofixt,/r/AMA/comments/mxan9q/im_a_sex_education_teacher_and_i_know_you_all/gvpt3ss/,1619291649,1,True,False,AMA,t5_2r4eo,,0,[],,
[],,Disastrous_Reality_4,,,[],,,,text,t2_7wutrc4q,False,False,[],"That’s so sad! I assumed I lived in one that did, but it apparently changed a lot by the time my kids were in school. At 18, one of my stepsons who had been through more than one sex ed class in school made a comment one day to his dad and I that made us realize that he thought he could get a girl pregnant with oral sex. We both kind of looked at each other a bit flabbergasted and explained to him that that’s not the case...but it really makes me wonder what the hell they were (or more likely, were not) teaching him at school in those classes.",,,1619278418,{},gvpt2nm,False,t3_mxan9q,False,False,t1_gvnf9aj,/r/AMA/comments/mxan9q/im_a_sex_education_teacher_and_i_know_you_all/gvpt2nm/,1619291633,5,True,False,AMA,t5_2r4eo,,0,[],,
[],,Survivor_08,,,[],,,,text,t2_6clf2s9k,False,False,[],"Thank you for sharing these stories. It’s difficult sometimes to find stories about resistance in other, less obvious ways. Really appreciate you bringing his stories new life.",,,1619278405,{},gvpt16z,False,t3_mxeokv,False,True,t3_mxeokv,/r/AMA/comments/mxeokv/my_greatgrandpa_was_a_teacher_during_nazi_germany/gvpt16z/,1619291613,2,True,False,AMA,t5_2r4eo,,0,[],,
[],,arrowfuckinghead,,,[],,,,text,t2_a7t99yu2,False,True,[],I have yet to see Texas do anything to improve reproductive health in any way.,,,1619278308,{},gvpspzb,True,t3_mxan9q,False,True,t1_gvoc9n5,/r/AMA/comments/mxan9q/im_a_sex_education_teacher_and_i_know_you_all/gvpspzb/,1619291466,1,True,False,AMA,t5_2r4eo,,0,[],,
[],,arrowfuckinghead,,,[],,,,text,t2_a7t99yu2,False,True,[],"When you say engage in it...do you mean become porn actors? Or avoid porn watching? Avoid sex?

Either way, people who watch porn in excess will be unhappy with their sexual relationships for different reasons. Mainstream porn makes men think their partners are less sexually satisfying and make women insecure about their bodies and performances.

People don’t realize this, but it’s like watching the NFL and then expecting everyone to play like Peyton Manning.",,,1619278276,{},gvpsmfc,True,t3_mxan9q,False,False,t1_gvob5i7,/r/AMA/comments/mxan9q/im_a_sex_education_teacher_and_i_know_you_all/gvpsmfc/,1619291420,1,True,False,AMA,t5_2r4eo,,0,[],,
[],,Cme4ever,,,[],,,,text,t2_3uikkno0,False,True,[],"Not OP, but may be able to give some insight. Here's a few different things:
1) Circumsitsons were once fully covered by basic medical insurance. (At least in the US, Cali) it is no longer, as it is now seen as cosmetic. This has caused a decrease in the procedure.
2) Uncircumcised may mean you feel more pleasure, the forskin containing many nerve endings. 

 *You are not weird

Keep in mind it is extremely important for both Circumsitsons and uncircumsises men to jave good hygiene. Being uncircumcised you must be more vigilant, you are more likely to develop infections and bad oders otherwise. 

As a female i never have had a preference as far as choosing in a partner, honestly didn't really notice. 
As a mother i chose Uncircumcised for my son.",,,1619278183,{},gvpsbl7,False,t3_mxan9q,False,True,t1_gvogyb4,/r/AMA/comments/mxan9q/im_a_sex_education_teacher_and_i_know_you_all/gvpsbl7/,1619291281,3,True,False,AMA,t5_2r4eo,,0,[],,
[],,Melohdy,,,[],,,,text,t2_2fi0gc2x,False,False,[],You don't need to put up with the hostility and the finger in your face.,,,1619278151,{},gvps7ub,False,t3_mxhl69,False,True,t3_mxhl69,/r/AMA/comments/mxhl69/i_resigned_from_lapd_this_week_after_11_years_of/gvps7ub/,1619291233,-1,True,False,AMA,t5_2r4eo,,0,[],,
[],,arrowfuckinghead,,,[],,,,text,t2_a7t99yu2,False,True,[],"This made me smile — thank you. I have heard this with all kinds of female athletes and celebrities, but figure skating is somehow the most romantic and pretty version of this I’ve heard",,,1619278058,{},gvprx7y,True,t3_mxan9q,False,True,t1_gvok2qy,/r/AMA/comments/mxan9q/im_a_sex_education_teacher_and_i_know_you_all/gvprx7y/,1619291093,3,True,False,AMA,t5_2r4eo,,0,[],,
[],,Withered_One,,,[],,,,text,t2_4v7sn78z,False,False,[],"Honestly no, although I wish I did connect with other kids my age while growing up",,,1619278033,{},gvprucn,True,t3_mxm3wy,False,True,t1_gvprpoi,/r/AMA/comments/mxm3wy/ive_never_set_a_foot_inside_a_school_in_my_whole/gvprucn/,1619291053,3,True,False,AMA,t5_2r4eo,,0,[],,
[],,mrmonster459,,,[],,,,text,t2_4posj0u6,False,False,[],Do you ever wish you did?,,,1619277993,{},gvprpoi,False,t3_mxm3wy,False,True,t3_mxm3wy,/r/AMA/comments/mxm3wy/ive_never_set_a_foot_inside_a_school_in_my_whole/gvprpoi/,1619290994,3,True,False,AMA,t5_2r4eo,,0,[],,
[],,dayanaraxiv,,,[],,,,text,t2_4y5dl5dq,False,False,[],ones from california and ones from michigan. im in california lol,,,1619277990,{},gvprpbg,True,t3_mxdb7g,False,False,t1_gvoa20c,/r/AMA/comments/mxdb7g/i_just_turned_16_ama/gvprpbg/,1619290989,1,True,False,AMA,t5_2r4eo,,0,[],,
[],,Kingofchaos1999,,,[],,,,text,t2_7uwy500s,False,False,[],"I might be, I might be but that isn’t the point the point is the post is still here, and it’s all about me Jeremy Corbell, and 14d later people are still looking and leaving questions which means I won’t fade into nothingness, and that my friends is fucking awesome, like really awesome like talking over Joe Rogan awesome",,,1619277984,{},gvproot,True,t3_mmlk85,False,True,t1_gvjdgmt,/r/AMA/comments/mmlk85/ama_and_il_answer_as_jeremy_corbell/gvproot/,1619290981,1,True,False,AMA,t5_2r4eo,,0,[],,
[],,arrowfuckinghead,,,[],,,,text,t2_a7t99yu2,False,True,[],"Hello! You do need condoms (anyone with a penis needs condoms when having sex with new partners). If you are planning to penetrate or be penetrated, I assume you want information on anal sex?

Some people like to use an anal enema to rinse, although this is not necessary. I recommend people have regular bowel movements (fiber it up!), and then have a bowel movement 2-3 hours or so before sex if possible. 

People know that butts are butts. If they don’t, then don’t have sex with them LOL. People who think anal sex is just clean and doesn’t involve poop sometimes are daft.",,,1619277977,{},gvprns7,True,t3_mxan9q,False,True,t1_gvoahj9,/r/AMA/comments/mxan9q/im_a_sex_education_teacher_and_i_know_you_all/gvprns7/,1619290970,1,True,False,AMA,t5_2r4eo,,0,[],,
[],,Meta_Galactic,,,[],,,,text,t2_1oggh41m,False,False,[],"What do you mean by ""fraction childbirth""?  I looked it up, but don't know if any results are what you were referring to.",,,1619277961,{},gvprlxa,False,t3_mxan9q,False,True,t1_gvn2d9c,/r/AMA/comments/mxan9q/im_a_sex_education_teacher_and_i_know_you_all/gvprlxa/,1619290944,2,True,False,AMA,t5_2r4eo,,0,[],,
[],,dayanaraxiv,,,[],,,,text,t2_4y5dl5dq,False,False,[],idk... college is pretty much a scam 78% of the time but i do wanna have a big house so maybe ill go. in always thought of college as something that ill figure out when i get there,,,1619277946,{},gvprk9x,True,t3_mxdb7g,False,True,t1_gvnzgqf,/r/AMA/comments/mxdb7g/i_just_turned_16_ama/gvprk9x/,1619290923,1,True,False,AMA,t5_2r4eo,,0,[],,
[],,dayanaraxiv,,,[],,,,text,t2_4y5dl5dq,False,False,[],bad but good. at least we have yummy food lol,,,1619277871,{},gvprbjm,True,t3_mxdb7g,False,True,t1_gvns4fh,/r/AMA/comments/mxdb7g/i_just_turned_16_ama/gvprbjm/,1619290807,1,True,False,AMA,t5_2r4eo,,0,[],,
[],,arrowfuckinghead,,,[],,,,text,t2_a7t99yu2,False,True,[],"GREAT question. This isn’t asked enough.

Girls should pee after sex. This helps push anything that may have been squished near the urethra to come out and be sterilized, avoiding a urinary tract infection. Then cleaning with a baby wipe or a wet washcloth is a good idea.

I do not recommend using “vaginal hygiene” products for vaginas. They can mess with someone’s ph balance and vaginas are self-cleaning anyway.",,,1619277815,{},gvpr533,True,t3_mxan9q,False,False,t1_gvo9had,/r/AMA/comments/mxan9q/im_a_sex_education_teacher_and_i_know_you_all/gvpr533/,1619290725,1,True,False,AMA,t5_2r4eo,,0,[],,
[],,ChildSupportistheft,,,[],,,,text,t2_a5lcmc1g,False,False,[],"I never knew there was so many different types of tics like that and they sound like they would tire anyone out. 

Thank you for the education.",,,1619277802,{},gvpr3je,False,t3_mxlkko,False,False,t1_gvppza4,/r/AMA/comments/mxlkko/i_have_tourettes_syndrome_tics_ama/gvpr3je/,1619290705,2,True,False,AMA,t5_2r4eo,,0,[],,
[],,crisvehe,,,[],,,,text,t2_118d0t,False,False,[],Is anal sex without condom dangerous? How can we have safe bareback anal sex?,,,1619277762,{},gvpqz2i,False,t3_mxan9q,False,False,t3_mxan9q,/r/AMA/comments/mxan9q/im_a_sex_education_teacher_and_i_know_you_all/gvpqz2i/,1619290647,1,True,False,AMA,t5_2r4eo,,0,[],,
[],,CruelRegulatorSmokin,,,[],,,,text,t2_3bejo2h4,False,False,[],I (f) have only received information about male-female sex. How about in same-sex relationships? Do f-f sex have protections as well?,,,1619277758,{},gvpqyly,False,t3_mxan9q,False,True,t3_mxan9q,/r/AMA/comments/mxan9q/im_a_sex_education_teacher_and_i_know_you_all/gvpqyly/,1619290641,1,True,False,AMA,t5_2r4eo,,0,[],,
[],,arrowfuckinghead,,,[],,,,text,t2_a7t99yu2,False,True,[],"Hello! I recommend using cock rings (silicon ones) which are placed at the base of the penis. Also, some condoms and lubricants can help guys last longer through very minor desensitization. 

Also during sex if guys take breaks or switch up their stimulation with just touching their partner without penetration, then overall the sex will last longer.",,,1619277699,{},gvpqrj2,True,t3_mxan9q,False,False,t1_gvo76rc,/r/AMA/comments/mxan9q/im_a_sex_education_teacher_and_i_know_you_all/gvpqrj2/,1619290550,1,True,False,AMA,t5_2r4eo,,0,[],,
[],,WackyDawg778,,,[],,,,text,t2_4pod5lyb,False,False,[],Thank you,,,1619277655,{},gvpqm7z,False,t3_mxan9q,False,False,t1_gvpgdof,/r/AMA/comments/mxan9q/im_a_sex_education_teacher_and_i_know_you_all/gvpqm7z/,1619290483,2,True,False,AMA,t5_2r4eo,,0,[],,
[],,arrowfuckinghead,,,[],,,,text,t2_a7t99yu2,False,True,[],"I am not. Virginity is not a real thing anyway — the first time someone has sex doesn’t change their value. 

I have been asked this question many times during sex ed 🌻",,,1619277604,{},gvpqg8t,True,t3_mxan9q,False,True,t1_gvo8lm9,/r/AMA/comments/mxan9q/im_a_sex_education_teacher_and_i_know_you_all/gvpqg8t/,1619290407,2,True,False,AMA,t5_2r4eo,,0,[],,
[],,timascus,,,[],,,,text,t2_dxcneyf,False,False,[],"That’s wrong.  It’s urine.  Tell me, where is the “ejaculate” stored?",,,1619277575,{},gvpqcsv,False,t3_mxan9q,False,True,t1_gvn5qpz,/r/AMA/comments/mxan9q/im_a_sex_education_teacher_and_i_know_you_all/gvpqcsv/,1619290364,-5,True,False,AMA,t5_2r4eo,,0,[],,
[],,Neverendingfarce,,,[],,,,text,t2_4ey0i2jb,False,False,[],Has the curriculum changed in a way that makes encourages teens/adults to reach out in the event they contracted an std instead of making a big scary deal out of it and something to be ashamed of?,,,1619277560,{},gvpqb1g,False,t3_mxan9q,False,False,t3_mxan9q,/r/AMA/comments/mxan9q/im_a_sex_education_teacher_and_i_know_you_all/gvpqb1g/,1619290343,2,True,False,AMA,t5_2r4eo,,0,[],,
[],,arrowfuckinghead,,,[],,,,text,t2_a7t99yu2,False,True,[],Hahaha thank you!!,,,1619277547,{},gvpq9k1,True,t3_mxan9q,False,True,t1_gvo70nh,/r/AMA/comments/mxan9q/im_a_sex_education_teacher_and_i_know_you_all/gvpq9k1/,1619290324,2,True,False,AMA,t5_2r4eo,,0,[],,
[],,arrowfuckinghead,,,[],,,,text,t2_a7t99yu2,False,True,[],"This is a great question! PMS and hormonal brain changes are intense and should not be discounted. You are not crazy and anyone who tells you it’s not real is uninformed and gaslighting you.

Vitamins are a great start, but hormone regulation through birth control is likely your best option. You can visit a clinic like Planned Parenthood for a birth control consultation and have low cost BC, even the pill will help, so don’t be afraid to take it after consulting with a doctor. 

Brain fog due to hormones is real. Vitamins help, yes! I would recommend working with a clinic to get on a form of BC that works best for your body and lifestyle. 

An OBGYN would be helpful in potentially diagnosing you with PMS disorders. Some women have more debilitating symptoms of the body and brain. This is not your fault and it is real!",,,1619277536,{},gvpq88p,True,t3_mxan9q,False,True,t1_gvo6k0b,/r/AMA/comments/mxan9q/im_a_sex_education_teacher_and_i_know_you_all/gvpq88p/,1619290306,2,True,False,AMA,t5_2r4eo,,0,[],,
[],,_ExistentiaI_Crisis_,,,[],,,,text,t2_an6o8qul,False,False,[],"I would have to say 

The affects from tic attacks or “consequences” from certain tics. 

Like After I have a tic attack I’m super tired and sore. But what sucks the most is when I have to get sedated because of me punching myself in my face. it’s almost like I’m extremely tired but I cannot sleep. No matter how much I tried I couldn’t sleep but I was way to tired to do anything so I just had to lay there for what felt like days because I was so out of it. Anytime  someone tried to talk to me I was confused and disoriented. But then when I finally got to sleep I slept for 21 hours straight. But for the next two days I’m was still extremely tired but able to make it through the day. 

Another consequence is I throw up, which I hate. 
I have a tic that stops me from breathing for a period of time and after it was over I threw up so much. It was terrible.

When I have a paralysis tic my body is constantly going limp, then I get back up, then I’m back down. So my head is moving quite fast in a short period of time which makes me extremely sick. 

I have a laughing tic (which happens to be my favourite tic) but a side effect of that is I throw up. For some strange reason, because I can’t have one good thing.

Thank you for the question!",,,1619277461,{},gvppza4,True,t3_mxlkko,False,False,t1_gvpnuxw,/r/AMA/comments/mxlkko/i_have_tourettes_syndrome_tics_ama/gvppza4/,1619290193,3,True,False,AMA,t5_2r4eo,,0,[],,
[],,lunarmunayam,,,[],,,,text,t2_8b8cwzy4,False,False,[],Are you against BLM?,,,1619277454,{},gvppyc0,False,t3_mxhl69,False,False,t3_mxhl69,/r/AMA/comments/mxhl69/i_resigned_from_lapd_this_week_after_11_years_of/gvppyc0/,1619290182,0,True,False,AMA,t5_2r4eo,,0,[],,
