all_awardings,associated_award,author,author_flair_background_color,author_flair_css_class,author_flair_richtext,author_flair_template_id,author_flair_text,author_flair_text_color,author_flair_type,author_fullname,author_patreon_flair,author_premium,awarders,body,collapsed_because_crowd_control,comment_type,created_utc,gildings,id,is_submitter,link_id,locked,no_follow,parent_id,permalink,retrieved_on,score,send_replies,stickied,subreddit,subreddit_id,top_awarded_type,total_awards_received,treatment_tags,author_cakeday,distinguished
[],,cutiegirl88,,,[],,,,text,t2_1ofakmnr,False,False,[],How is that stuff in the shrooms supposed to help? What does it do?,,,1619288825,{},gvqh7dp,False,t3_mwsfw8,False,True,t3_mwsfw8,/r/AMA/comments/mwsfw8/in_30_minutes_i_will_have_my_spinal_fluid/gvqh7dp/,1619304354,1,True,False,AMA,t5_2r4eo,,0,[],,
[],,nrnshl,,,[],,,,text,t2_4ke5oyvh,False,False,[],how tight are the pants,,,1619288810,{},gvqh6d6,False,t3_mxnfsk,False,False,t3_mxnfsk,/r/AMA/comments/mxnfsk/im_a_cop_ama/gvqh6d6/,1619304340,9,True,False,AMA,t5_2r4eo,,0,[],,
[],,marti924,,,[],,,,text,t2_7ffnlodp,False,False,[],We are getting funding thru NYS. The plan is afforded based on need and my kiddo is 12 so we are.respite heavy with our plan but I also push for a higher pay rate. I insist on it actually so with everything plus an 18 dollar an hour pay rate we're looking at around 33k a year,,,1619288808,{},gvqh67d,True,t3_ltdfip,False,False,t1_gthnl9l,/r/AMA/comments/ltdfip/im_a_special_needs_parent_in_nys_with_experience/gvqh67d/,1619304337,1,True,False,AMA,t5_2r4eo,,0,[],,
[],,ShahilKhan_88,,,[],,,,text,t2_bne5ltjq,False,False,[],Thanks! I’ll be sure to check those places out Forsure. In terms of transportation do you recommend renting out a car while I’m in Santo Domingo?,,,1619288764,{},gvqh328,False,t3_mpvkak,False,True,t1_gvqg4a4,/r/AMA/comments/mpvkak/i_was_born_and_raised_in_santo_domingo_dominican/gvqh328/,1619304288,1,True,False,AMA,t5_2r4eo,,0,[],,
[],,Zootrainer,,,[],,,,text,t2_ct68d,False,False,[],"This seems like a very ""out of character"" comment from a sex educator. Billions of people perform and receive oral sex on the regular, without health issues (assuming neither person has an STI). And what's up with making kissing sound awful too? There's a difference between making a joke about swapping spit and actually making your comment read like you think that it's unhealthy and the people shouldn't do it.",,,1619288717,{},gvqgzk7,False,t3_mxan9q,False,True,t1_gvn0uj5,/r/AMA/comments/mxan9q/im_a_sex_education_teacher_and_i_know_you_all/gvqgzk7/,1619304235,2,True,False,AMA,t5_2r4eo,,0,[],,
[],,pommemiles,,,[],,,,text,t2_7wuy7aea,False,False,[],What did you do?,,,1619288711,{},gvqgz58,False,t3_mxocfp,False,True,t3_mxocfp,/r/AMA/comments/mxocfp/have_been_to_prisonjuvie_multiple_times_ama/gvqgz58/,1619304229,1,True,False,AMA,t5_2r4eo,,0,[],,
[],,marti924,,,[],,,,text,t2_7ffnlodp,False,False,[],Not always. Sometimes you can hire an agency that supports you with the hiring process,,,1619288710,{},gvqgz38,True,t3_ltdfip,False,True,t1_gvqgrx0,/r/AMA/comments/ltdfip/im_a_special_needs_parent_in_nys_with_experience/gvqgz38/,1619304228,1,True,False,AMA,t5_2r4eo,,0,[],,
[],,Practical-Remove-165,,,[],,,,text,t2_bqlmz7s7,False,False,[],"I'm agitated because you're so fucking stupid. 

Just go get sterilized. End the nightmare now.",,,1619288640,{},gvqgtxm,True,t3_mxpaep,False,True,t1_gvqg2tk,/r/AMA/comments/mxpaep/i_know_all_about_science_and_ill_tell_you_right/gvqgtxm/,1619304152,-1,True,False,AMA,t5_2r4eo,,0,[],,
[],,Sayasam,,,[],,,,text,t2_afiho8lt,False,False,[],Being male sucks. I wish I could sell underwear and make big money.,,,1619288626,{},gvqgsvc,False,t3_mxmetg,False,False,t3_mxmetg,/r/AMA/comments/mxmetg/i_saved_up_5_figures_selling_underwear_in_college/gvqgsvc/,1619304136,5,True,False,AMA,t5_2r4eo,,0,[],,
[],,Previous-Gas,,,[],,,,text,t2_5w7bokaw,False,False,[],I heard self direction is hard because you have to find staff yourself.,,,1619288613,{},gvqgrx0,False,t3_ltdfip,False,True,t3_ltdfip,/r/AMA/comments/ltdfip/im_a_special_needs_parent_in_nys_with_experience/gvqgrx0/,1619304122,2,True,False,AMA,t5_2r4eo,,0,[],,
[],,cutiegirl88,,,[],,,,text,t2_1ofakmnr,False,False,[],"Where do fetishes come from? How do they form? Does everyone have a fetish?

And a very controversial one just to educate myself on the subject. Are pedophiles and zoophiles recoverable with something like intense therapy or something? I've heard many different answers but none from any professional",,,1619288597,{},gvqgqrj,False,t3_mxan9q,False,True,t3_mxan9q,/r/AMA/comments/mxan9q/im_a_sex_education_teacher_and_i_know_you_all/gvqgqrj/,1619304105,2,True,False,AMA,t5_2r4eo,,0,[],,
[],,pommemiles,,,[],,,,text,t2_7wuy7aea,False,False,[],How did he treat you? Any red flags you noticed?,,,1619288561,{},gvqgo2m,False,t3_mxpdo0,False,True,t3_mxpdo0,/r/AMA/comments/mxpdo0/i_dated_an_incel_ama/gvqgo2m/,1619304064,2,True,False,AMA,t5_2r4eo,,0,[],,
[],,Nefenze,,,[],,,,text,t2_66la3fwh,False,False,[],well considering my parents started dating when my mom was 18 and my dad was 25 its not that bad.,,,1619288557,{},gvqgnqk,False,t3_mxhqu0,False,True,t3_mxhqu0,/r/AMA/comments/mxhqu0/is_this_age_gap_weird/gvqgnqk/,1619304059,1,True,False,AMA,t5_2r4eo,,0,[],,
[],,The4leafclover1966,,,[],,,,text,t2_7g96kmmd,False,False,[],"Not a question but I just want to thank you for your invaluable service.

Stay well and be safe out there.

Sending you and your fellow officers love and light.",,,1619288532,{},gvqglyn,False,t3_mxnfsk,False,False,t3_mxnfsk,/r/AMA/comments/mxnfsk/im_a_cop_ama/gvqglyn/,1619304033,27,True,False,AMA,t5_2r4eo,,0,[],,
[],,TheZorro1909,,,[],,,,text,t2_8692peo7,False,False,[],That definitely checks out,,,1619288529,{},gvqglq9,False,t3_mxg2il,False,True,t1_gvoj83u,/r/AMA/comments/mxg2il/korean_soldier_ama/gvqglq9/,1619304029,1,True,False,AMA,t5_2r4eo,,0,[],,
[],,Sayasam,,,[],,,,text,t2_afiho8lt,False,False,[],The night is still young,,,1619288505,{},gvqgjxs,False,t3_mxmetg,False,True,t1_gvq4vqc,/r/AMA/comments/mxmetg/i_saved_up_5_figures_selling_underwear_in_college/gvqgjxs/,1619304002,1,True,False,AMA,t5_2r4eo,,0,[],,
[],,LeaguePuzzleheaded51,,,[],,,,text,t2_9yeoyns8,False,False,[],Thanks for the tips,,,1619288461,{},gvqggnv,False,t3_mxnfsk,False,False,t1_gvqg1sh,/r/AMA/comments/mxnfsk/im_a_cop_ama/gvqggnv/,1619303952,16,True,False,AMA,t5_2r4eo,,0,[],,
[],,_ExistentiaI_Crisis_,,,[],,,,text,t2_an6o8qul,False,False,[],"Yes I have.

Obviously not on purpose. But there’s been a few instances were things haven’t gone right.

I threw a clock at my sister while having a tic attack, it was a big metal clock so it left a big bruise.

I’ve kicked my mom and she fell to the ground 

I’ve scratched my friends face, and while we were just realizing what happened I punched her in the face. (I love you kaaaaal)

I punched a teacher in her face 

I punched my sister in the mouth (different sister)

I had a really bad tic attack one day at my friends house and one of my friends was trying to protect everyone while also trying to protect me. 
He got punched and hit so many times and was having to stop me from pulling peoples hair and kicking them. And then having to turn around and stop me from banging my head.

I kicked my sister into a wall and she fell through it (it was a wall divider so not a actual wall)

I repeatedly banged my chin onto my friends shoulder while she was “holding me down” to stop me from bashing myself in the face 

I’ve kicked and hit my EA’s a bunch of times 

I’ve slapped people in the face.

I full Throttled my water bottle at my mom and broke it.

There’s probably more but those are the “highlights”. These were all involuntary actions that I could not control. I did not want to do any of this nor was it my intention to hurt these people.",,,1619288420,{},gvqgdm7,True,t3_mxlkko,False,True,t1_gvqegs9,/r/AMA/comments/mxlkko/i_have_tourettes_syndrome_tics_ama/gvqgdm7/,1619303904,1,True,False,AMA,t5_2r4eo,,0,[],,
[],,TheZorro1909,,,[],,,,text,t2_8692peo7,False,False,[],"My wife is 30 and I'm 25. Doesn't really matter.

Also you shouldn't give a fuck about people's opinions...and your friends aren't your friends if they make a big deal out of this absolutely irrelevant age gap. It's that easy.",,,1619288417,{},gvqgdg5,False,t3_mxhqu0,False,True,t3_mxhqu0,/r/AMA/comments/mxhqu0/is_this_age_gap_weird/gvqgdg5/,1619303902,1,True,False,AMA,t5_2r4eo,,0,[],,
[],,LeaguePuzzleheaded51,,,[],,,,text,t2_9yeoyns8,False,False,[],I’ve seen worse subjects,,,1619288408,{},gvqgcr2,True,t3_mxogj3,False,False,t1_gvqfqrj,/r/AMA/comments/mxogj3/im_not_getting_the_vaccine_ama/gvqgcr2/,1619303892,6,True,False,AMA,t5_2r4eo,,0,[],,
[],,Lover_boi4,,,[],,,,text,t2_av43mft7,False,False,[],Whats your dream job?,,,1619288388,{},gvqgb9u,False,t3_mxjiwb,False,True,t3_mxjiwb,/r/AMA/comments/mxjiwb/hey_im_nobody_never_accomplished_anything_in_life/gvqgb9u/,1619303870,1,True,False,AMA,t5_2r4eo,,0,[],,
[],,kingd137,,,[],,,,text,t2_4gj3ufuw,False,False,[],"Lol yeah weed is like a recreational thing here, people with 4.0 all the way to the special need kid a lot of people use it",,,1619288363,{},gvqg9e5,True,t3_mxnqsl,False,True,t1_gvqdhyv,/r/AMA/comments/mxnqsl/im_a_college_student_athlete_who_have_never_smoke/gvqg9e5/,1619303844,1,True,False,AMA,t5_2r4eo,,0,[],,
[],,Blue-Corn,,,[],,,,text,t2_37jima4f,False,False,[],"They do, but you can only learn so much at a time. Hire good people and keep a good house and they will make good decisions. Hire shitheads or put good people in a bad environment and you’re going to get a poor product.",,,1619288339,{},gvqg7nl,True,t3_mxnfsk,False,False,t1_gvqfmq1,/r/AMA/comments/mxnfsk/im_a_cop_ama/gvqg7nl/,1619303817,4,True,False,AMA,t5_2r4eo,,0,[],,
[],,LeaguePuzzleheaded51,,,[],,,,text,t2_9yeoyns8,False,False,[],Anyone who has asked me if I’ve gotten the vaccine,,,1619288330,{},gvqg70m,True,t3_mxogj3,False,True,t1_gvqflj6,/r/AMA/comments/mxogj3/im_not_getting_the_vaccine_ama/gvqg70m/,1619303808,2,True,False,AMA,t5_2r4eo,,0,[],,
[],,pommemiles,,,[],,,,text,t2_7wuy7aea,False,False,[],"Yes, mine is pretty shit and patchy but it's there haha",,,1619288320,{},gvqg6aw,True,t3_mxotst,False,True,t1_gvqfr3z,/r/AMA/comments/mxotst/im_a_transgender_man_female_to_male_ama/gvqg6aw/,1619303797,1,True,False,AMA,t5_2r4eo,,0,[],,
[],,conefucker,,,[],,,,text,t2_a9oi1z5s,False,False,[],I was planning on hanging out with a friend in an hour. I’m progressively getting higher. May need to listen to your advice.,,,1619288293,{},gvqg4bg,True,t3_mxp97z,False,True,t1_gvqelhd,/r/AMA/comments/mxp97z/i_just_took_1500_mg_of_edibles_thinking_they/gvqg4bg/,1619303767,3,True,False,AMA,t5_2r4eo,,0,[],,
[],,castrobundles,,,[],,,,text,t2_2ghfhl1y,False,False,[],"zona colonial, basically a breif history of DR and what its like in the 1900s, alot of old buildings, good tourist attraction. maximo playa, its a beach with a good vibe where you can eat some fresh fried fish with tostones. any place in a neighborhood called piantini in santo domingo, best restaurants with outdoor space. malecon in santo domingo, good area to walk around and get some food. i also highly recommend going to this beach called playa san rafael in barahona its a beach with two pools with natural water flowing straight to the beach, they have food, music and overall good vibe. its kind of far from santo domingo like 2 hours but well worth the trip. in my experience i enjoy DR better in the country side although the city is good too. all these places mention are in santo domingo i haven't been to puerto plata or punta cana to give you any recommendations. carry a fresh cold water bottle everywhere cause there's mad traffic and its hot as fuck",,,1619288292,{},gvqg4a4,True,t3_mpvkak,False,True,t1_gvq8509,/r/AMA/comments/mpvkak/i_was_born_and_raised_in_santo_domingo_dominican/gvqg4a4/,1619303767,1,True,False,AMA,t5_2r4eo,,0,[],,
[],,a_melon_of_rubber,,,[],,,,text,t2_4d8rva90,False,False,[],That is an unexpectedly aggressive language. Is there a reason why you are so agitated?,,,1619288272,{},gvqg2tk,False,t3_mxpaep,False,True,t1_gvqf4r2,/r/AMA/comments/mxpaep/i_know_all_about_science_and_ill_tell_you_right/gvqg2tk/,1619303744,2,True,False,AMA,t5_2r4eo,,0,[],,
[],,7th_Spectrum,,,[],,,,text,t2_1k5nitg,False,True,[],"In the balls, obviously",,,1619288261,{},gvqg1zx,False,t3_mxan9q,False,True,t1_gvpqcsv,/r/AMA/comments/mxan9q/im_a_sex_education_teacher_and_i_know_you_all/gvqg1zx/,1619303731,1,True,False,AMA,t5_2r4eo,,0,[],,
[],,Practical-Remove-165,,,[],,,,text,t2_bqlmz7s7,False,False,[],"np, derptard.",,,1619288259,{},gvqg1vp,True,t3_mxpaep,False,True,t1_gvqfle8,/r/AMA/comments/mxpaep/i_know_all_about_science_and_ill_tell_you_right/gvqg1vp/,1619303729,2,True,False,AMA,t5_2r4eo,,0,[],,
[],,Blue-Corn,,,[],,,,text,t2_37jima4f,False,False,[],Go to the court date. Wear a collared shirt and a clean pair of pants. Apologize to the judge and say you’ll accept whatever fine. If you have a long list of past tickets you’re probably not going to get out of it but sometimes just showing up is enough to get a judge to toss it out.,,,1619288258,{},gvqg1sh,True,t3_mxnfsk,False,False,t1_gvqf8rj,/r/AMA/comments/mxnfsk/im_a_cop_ama/gvqg1sh/,1619303728,71,True,False,AMA,t5_2r4eo,,0,[],,
[],,Lover_boi4,,,[],,,,text,t2_av43mft7,False,False,[],Are aliens real,,,1619288241,{},gvqg0l8,False,t3_mxo218,False,True,t3_mxo218,/r/AMA/comments/mxo218/i_will_answer_all_your_questions_100_honestly_ama/gvqg0l8/,1619303709,1,True,False,AMA,t5_2r4eo,,0,[],,
[],,xE1NSTE1Nx2049,,,[],,,,text,t2_3ob9s9yd,False,False,[],5 figures seems like a lot. Could you ball park how many pair you've sold? Or tell what the average price would be?,,,1619288233,{},gvqfzyd,False,t3_mxmetg,False,True,t3_mxmetg,/r/AMA/comments/mxmetg/i_saved_up_5_figures_selling_underwear_in_college/gvqfzyd/,1619303699,1,True,False,AMA,t5_2r4eo,,0,[],,
[],,sangomaofstyle,,,[],,,,text,t2_6z7z7dc2,False,False,[],You gotta take a minimum of 5000mg 😏,,,1619288215,{},gvqfypr,False,t3_mxp97z,False,True,t3_mxp97z,/r/AMA/comments/mxp97z/i_just_took_1500_mg_of_edibles_thinking_they/gvqfypr/,1619303681,-1,True,False,AMA,t5_2r4eo,,0,[],,
[],,7th_Spectrum,,,[],,,,text,t2_1k5nitg,False,True,[],"&gt;We don't know enough about the female orgasm

I didn't even know it existed",,,1619288192,{},gvqfx1r,False,t3_mxan9q,False,True,t1_gvn5qpz,/r/AMA/comments/mxan9q/im_a_sex_education_teacher_and_i_know_you_all/gvqfx1r/,1619303655,1,True,False,AMA,t5_2r4eo,,0,[],,
[],,FeelingDesigner,,,[],,,,text,t2_3ezuz67u,False,False,[],What would be the best way to monetise my hobby of breeding small-fruit and expanding my collection?,,,1619288163,{},gvqfuw0,False,t3_mxbyi2,False,True,t3_mxbyi2,/r/AMA/comments/mxbyi2/im_an_mba_give_me_your_business_problem_and_ill/gvqfuw0/,1619303623,1,True,False,AMA,t5_2r4eo,,0,[],,
[],,Lover_boi4,,,[],,,,text,t2_av43mft7,False,False,[],Can you grow a beard?,,,1619288110,{},gvqfr3z,False,t3_mxotst,False,True,t3_mxotst,/r/AMA/comments/mxotst/im_a_transgender_man_female_to_male_ama/gvqfr3z/,1619303567,1,True,False,AMA,t5_2r4eo,,0,[],,
[],,GunbladeShinobi,,,[],,,,text,t2_3xhz7equ,False,False,[],Why do you believe that not getting vaccinated is a subject worthy of an AMA?😁,,,1619288105,{},gvqfqrj,False,t3_mxogj3,False,True,t3_mxogj3,/r/AMA/comments/mxogj3/im_not_getting_the_vaccine_ama/gvqfqrj/,1619303563,3,True,False,AMA,t5_2r4eo,,0,[],,
[],,Ichiko45,,,[],,,,text,t2_4im1qqvz,False,False,[],"A question that my friends always have, but too afraid to google it. How does one who is uncircumsied have sex? Like pulling back the foreskin and it won't go back to being normal or the skin might be pulled back while doing.  Are there anythings that should be done before doing it (sex)?",,,1619288092,{},gvqfprh,False,t3_mxan9q,False,True,t3_mxan9q,/r/AMA/comments/mxan9q/im_a_sex_education_teacher_and_i_know_you_all/gvqfprh/,1619303547,1,True,False,AMA,t5_2r4eo,,0,[],,
[],,Blue-Corn,,,[],,,,text,t2_37jima4f,False,False,[],"A lot. I usually phrase things to be as friendly as I can though. 
“Sir, why don’t you come out here and talk to me for a second.” 
I very rarely use “big scary cop voice”.",,,1619288068,{},gvqfo2h,True,t3_mxnfsk,False,False,t1_gvqf5le,/r/AMA/comments/mxnfsk/im_a_cop_ama/gvqfo2h/,1619303521,86,True,False,AMA,t5_2r4eo,,0,[],,
[],,Sayasam,,,[],,,,text,t2_afiho8lt,False,False,[],"Do you think the training to be a cop is sufficient ? Do they teach you about ethics, communication, psychology, stuff like that ?",,,1619288050,{},gvqfmq1,False,t3_mxnfsk,False,True,t3_mxnfsk,/r/AMA/comments/mxnfsk/im_a_cop_ama/gvqfmq1/,1619303501,2,True,False,AMA,t5_2r4eo,,0,[],,
[],,GunbladeShinobi,,,[],,,,text,t2_3xhz7equ,False,False,[],Exactly how many people in your day to day life do you believe actually care that you're not vaccinated?😁🤔,,,1619288034,{},gvqflj6,False,t3_mxogj3,False,False,t3_mxogj3,/r/AMA/comments/mxogj3/im_not_getting_the_vaccine_ama/gvqflj6/,1619303483,1,True,False,AMA,t5_2r4eo,,0,[],,
[],,ddmcmlxxxiii,,,[],,,,text,t2_12ghpc,False,False,[],Huh.,,,1619288033,{},gvqfle8,False,t3_mxpaep,False,True,t3_mxpaep,/r/AMA/comments/mxpaep/i_know_all_about_science_and_ill_tell_you_right/gvqfle8/,1619303481,1,True,False,AMA,t5_2r4eo,,0,[],,
[],,AmbitiousCowboy,,,[],,,,text,t2_b8hyacxt,False,False,[],That's a very mature thing to say in these especially turbulent times. You're a pretty remarkable person,,,1619287981,{},gvqfhlz,False,t3_mf9u4v,False,True,t1_gvqf4bq,/r/AMA/comments/mf9u4v/i_24f_am_a_sexually_promiscuous_young_woman_im/gvqfhlz/,1619303424,1,True,False,AMA,t5_2r4eo,,0,[],,
[],,GunbladeShinobi,,,[],,,,text,t2_3xhz7equ,False,False,[],Where did you exactly???🤔,,,1619287962,{},gvqfg9y,False,t3_mxogj3,False,True,t1_gvqbdfc,/r/AMA/comments/mxogj3/im_not_getting_the_vaccine_ama/gvqfg9y/,1619303405,1,True,False,AMA,t5_2r4eo,,0,[],,
[],,CStarling4,,,[],,,,text,t2_av0tk4n,False,False,[],So this may be a dumb question but what’s it called when you get the top part of your ear pierced? I want to get it done but I don’t want to sound dumb. I heard someone say cartilage piercing but idk.,,,1619287952,{},gvqffhv,False,t3_mxo263,False,True,t3_mxo263,/r/AMA/comments/mxo263/im_a_piercer_who_gets_lots_of_questions_ama/gvqffhv/,1619303393,1,True,False,AMA,t5_2r4eo,,0,[],,
[],,FeelingDesigner,,,[],,,,text,t2_3ezuz67u,False,False,[],People say that?,,,1619287914,{},gvqfcm0,False,t3_mxe82h,False,False,t1_gvo6w1s,/r/AMA/comments/mxe82h/im_autistic_ama/gvqfcm0/,1619303349,1,True,False,AMA,t5_2r4eo,,0,[],,
[],,[deleted],,,,,,dark,,,,,[],[removed],,,1619287897,{},gvqfbd6,False,t3_mxpaep,False,True,t1_gvqezfp,/r/AMA/comments/mxpaep/i_know_all_about_science_and_ill_tell_you_right/gvqfbd6/,1619303332,1,True,False,AMA,t5_2r4eo,,0,[],,
[],,FakeAsFakeCanBe,,,[],,,,text,t2_c0tpu,False,False,[],"I have been thinking about this a lot lately. I always wanted to be a cop but these days? No way. Damned if you do, damned if you don't these days. Good cops like you must be very frustrated.",,,1619287896,{},gvqfbar,False,t3_mxhl69,False,False,t3_mxhl69,/r/AMA/comments/mxhl69/i_resigned_from_lapd_this_week_after_11_years_of/gvqfbar/,1619303331,-1,True,False,AMA,t5_2r4eo,,0,[],,
[],,LeaguePuzzleheaded51,,,[],,,,text,t2_9yeoyns8,False,False,[],I’m not anti vax,,,1619287890,{},gvqfas1,True,t3_mxogj3,False,True,t1_gvqaemh,/r/AMA/comments/mxogj3/im_not_getting_the_vaccine_ama/gvqfas1/,1619303324,0,True,False,AMA,t5_2r4eo,,0,[],,
[],,good_testing_bad,,,[],,,,text,t2_duoi3,False,False,[],Well then imma post something liberal. We should have some sort of program to help with wealth redistribution.,,,1619287883,{},gvqfa8j,False,t3_mxnkzd,False,True,t3_mxnkzd,/r/AMA/comments/mxnkzd/i_think_reddit_is_a_hive_mind/gvqfa8j/,1619303315,1,True,False,AMA,t5_2r4eo,,0,[],,
[],,Blue-Corn,,,[],,,,text,t2_37jima4f,False,False,[],Triceratops,,,1619287874,{},gvqf9kn,True,t3_mxnfsk,False,False,t1_gvqe6ig,/r/AMA/comments/mxnfsk/im_a_cop_ama/gvqf9kn/,1619303306,23,True,False,AMA,t5_2r4eo,,0,[],,
[],,LeaguePuzzleheaded51,,,[],,,,text,t2_9yeoyns8,False,False,[],"Nah I already got the ticket, just need to know how to get out of it now, any tips?",,,1619287864,{},gvqf8rj,False,t3_mxnfsk,False,False,t1_gvqevx2,/r/AMA/comments/mxnfsk/im_a_cop_ama/gvqf8rj/,1619303293,16,True,False,AMA,t5_2r4eo,,0,[],,
[],,IrisIridos,,,[],,,,text,t2_68dd1oxf,False,False,[],How did you find out?,,,1619287856,{},gvqf86c,False,t3_mxpdo0,False,True,t3_mxpdo0,/r/AMA/comments/mxpdo0/i_dated_an_incel_ama/gvqf86c/,1619303284,2,True,False,AMA,t5_2r4eo,,0,[],,
[],,pommemiles,,,[],,,,text,t2_7wuy7aea,False,False,[],Do you think you've come to terms with the childhood trauma that induced your disorder now?,,,1619287856,{},gvqf85b,False,t3_mxcsg3,False,True,t3_mxcsg3,/r/AMA/comments/mxcsg3/i_have_dissociative_identity_disorder_did_ama/gvqf85b/,1619303283,1,True,False,AMA,t5_2r4eo,,0,[],,
[],,Chattermeup9,,,[],,,,text,t2_39ahmetm,False,False,[],What a messed-up place.  Get the hell out and let the shitbags eat each other.,,,1619287836,{},gvqf6pi,False,t3_mxhl69,False,True,t3_mxhl69,/r/AMA/comments/mxhl69/i_resigned_from_lapd_this_week_after_11_years_of/gvqf6pi/,1619303262,0,True,False,AMA,t5_2r4eo,,0,[],,
[],,fartyhardy,,,[],,,,text,t2_80kvysqj,False,False,[],"Nope, just the first thing I thought when I read the headline.",,,1619287821,{},gvqf5le,False,t3_mxnfsk,False,False,t1_gvqc6pv,/r/AMA/comments/mxnfsk/im_a_cop_ama/gvqf5le/,1619303246,27,True,False,AMA,t5_2r4eo,,0,[],,
[],,Practical-Remove-165,,,[],,,,text,t2_bqlmz7s7,False,False,[],what the fuck are you talking about? You're obviously a left wing dupe. Please don't vote or have children.,,,1619287809,{},gvqf4r2,True,t3_mxpaep,False,True,t1_gvqeib0,/r/AMA/comments/mxpaep/i_know_all_about_science_and_ill_tell_you_right/gvqf4r2/,1619303234,-2,True,False,AMA,t5_2r4eo,,0,[],,
[],,Lady__Mai,,,[],,,,text,t2_5utjke16,False,False,[],"Well, most people aren’t aware of the fact. I have a pretty normal life- I go to uni, study for exams, work, socialize,  work out, etc. The fact that I sleep with a lot of men isn’t something I have the need to regularly share with people in my life (apart from a select few). 

I have been judged before but I’ve also received support for being so honest about sex and my own sexuality as a woman. It doesn’t really bother me what other people think because it’s my life and not theirs. I can only control what I say or do, not what others say or do. If someone wants to judge me, it’s their right, but I really don’t care at the end of the day.",,,1619287804,{},gvqf4bq,True,t3_mf9u4v,False,True,t1_gvqefp5,/r/AMA/comments/mf9u4v/i_24f_am_a_sexually_promiscuous_young_woman_im/gvqf4bq/,1619303227,1,True,False,AMA,t5_2r4eo,,0,[],,
[],,Blue-Corn,,,[],,,,text,t2_37jima4f,False,False,[],Highest charges I’ve filed were probably aggravated domestic assault. Detectives bumped it way up and added a bunch of charges to it. Guy nearly beat his kid to death. Road cops don’t charge major crimes very often. That’s all investigators and lawyers.,,,1619287803,{},gvqf4ad,True,t3_mxnfsk,False,False,t1_gvqcdar,/r/AMA/comments/mxnfsk/im_a_cop_ama/gvqf4ad/,1619303227,59,True,False,AMA,t5_2r4eo,,0,[],,
[],,ibeeneatingmanybeans,,,[],,,,text,t2_77no86kb,False,False,[],Fuck no,,,1619287802,{},gvqf468,True,t3_mwman1,False,False,t1_gvqdgj6,/r/AMA/comments/mwman1/i_am_a_13_year_old_boy_that_skateboards_plays/gvqf468/,1619303225,1,True,False,AMA,t5_2r4eo,,0,[],,
[],,thelimpgimpsdelight,,,[],,,,text,t2_46z16ub,False,False,[],But what if I have a hideous face that’s unpalatable to the rest of society?,,,1619287739,{},gvqezfp,False,t3_mxpaep,False,True,t3_mxpaep,/r/AMA/comments/mxpaep/i_know_all_about_science_and_ill_tell_you_right/gvqezfp/,1619303154,3,True,False,AMA,t5_2r4eo,,0,[],,
[],,expretDOTorg,,,[],,,,text,t2_3zdgb8qw,False,False,[],"The blue wall of silence may be more in big cities like NYC, LA etc. Maybe? But when a conviction is THAT rare, there must be a silence, covering for each other. I remember the Rodney King trial, even video evidence didn't help in the first trial. 

[**https://youtu.be/Tvacddx3PqY?t=32**](https://youtu.be/Tvacddx3PqY?t=32)",,,1619287731,{},gvqeytd,False,t3_mxnfsk,False,False,t1_gvq3l5r,/r/AMA/comments/mxnfsk/im_a_cop_ama/gvqeytd/,1619303145,7,True,False,AMA,t5_2r4eo,,0,[],,
