all_awardings,associated_award,author,author_flair_background_color,author_flair_css_class,author_flair_richtext,author_flair_template_id,author_flair_text,author_flair_text_color,author_flair_type,author_fullname,author_patreon_flair,author_premium,awarders,body,collapsed_because_crowd_control,comment_type,created_utc,gildings,id,is_submitter,link_id,locked,no_follow,parent_id,permalink,retrieved_on,score,send_replies,stickied,subreddit,subreddit_id,top_awarded_type,total_awards_received,treatment_tags,distinguished
[],,Additional_Radio5350,,,[],,,,text,t2_9oezf9c8,False,False,[],Mad alert!,,,1619300893,{},gvr511w,False,t3_mxnfsk,False,False,t1_gvqqsk0,/r/AMA/comments/mxnfsk/im_a_cop_ama/gvr511w/,1619317267,5,True,False,AMA,t5_2r4eo,,0,[],
[],,[deleted],,,,,,dark,,,,,[],[deleted],,,1619300879,{},gvr5063,False,t3_mxnfsk,False,True,t3_mxnfsk,/r/AMA/comments/mxnfsk/im_a_cop_ama/gvr5063/,1619317254,1,True,False,AMA,t5_2r4eo,,0,[],
[],,Additional_Radio5350,,,[],,,,text,t2_9oezf9c8,False,False,[],I think you need to read the instructions of the post again bud,,,1619300835,{},gvr4x65,False,t3_mxnfsk,False,False,t1_gvqw3ts,/r/AMA/comments/mxnfsk/im_a_cop_ama/gvr4x65/,1619317208,3,True,False,AMA,t5_2r4eo,,0,[],
[],,Inamedmydognoodz,,,[],,,,text,t2_587337m2,False,False,[],"I would make sure you have one of these fidget toys with you at all times. When I was in therapy they suggested snapping myself on the wrist with a hair tie or rubber band that I kept around there, not enough to hurt or be noticeable but enough to somewhat shock myself and help remain grounded. I would think maybe trying one of these techniques or something similar. I hope you're ok now",,,1619300823,{},gvr4wcu,False,t3_mx95tt,False,True,t1_gvmxw9j,/r/AMA/comments/mx95tt/im_a_teen_with_a_dissociative_disorder_and_i_just/gvr4wcu/,1619317195,2,True,False,AMA,t5_2r4eo,,0,[],
[],,P3runaama,,,[],,,,text,t2_pcuwjbd,False,False,[],How do you see other northern counties around the world? Do you think the culture there is more similar to northern EU countries or USA?,,,1619300758,{},gvr4rx2,False,t3_mxtexd,False,True,t3_mxtexd,/r/AMA/comments/mxtexd/im_a_random_ass_teenager_from_canada_ama/gvr4rx2/,1619317128,1,True,False,AMA,t5_2r4eo,,0,[],
[],,aapaul,,,[],,,,text,t2_4qjq3ww,False,False,[],Did you watch the George Floyd trials?,,,1619300746,{},gvr4r0t,False,t3_mxnfsk,False,True,t3_mxnfsk,/r/AMA/comments/mxnfsk/im_a_cop_ama/gvr4r0t/,1619317114,1,True,False,AMA,t5_2r4eo,,0,[],
[],,MiroWiggin,,,[],,,,text,t2_8oeljk8i,False,False,[],"1. ***Have you ever had to arrest someone against your own conscience?*** For example, if I was a cop I would feel terrible about arresting people for drug possession or prostitution since I don't think those should be crimes.
2. ***Is there anything that isn't a crime that you think should be?***
3. ***Have you spent time trying to evaluate your own racial biases?*** To be completely clear, I'm not asking ""Are you racist?"" I think it's essentially impossible for any person to not hold any racial biases, so I think it's healthy to be introspective in that regard.
4. ***Is there anything you (or other cops you know) are doing to try make people of color feel safer?*** I think this AMA would probably be one example. Another example might be showing support for Black Lives Matter or perhaps offering your badge number or reminding someone they have a right to record your interaction.
5. ***How do you feel about body cams?*** Personally, I'm a big fan of them, I think they would improve police accountability, and I can see why a lot of cops would also want them, but I've never discussed the issue with a police officer before.

My apologies if you've already gotten any of those, feel free to just answer whichever you're willing to. Thanks!",,,1619300729,{},gvr4pvm,False,t3_mxnfsk,False,True,t3_mxnfsk,/r/AMA/comments/mxnfsk/im_a_cop_ama/gvr4pvm/,1619317098,2,True,False,AMA,t5_2r4eo,,0,[],
[],,Threeminusme,,,[],,,,text,t2_633skne2,False,False,[],"Not OP, but tbh nobody can know this. Nobody can predict how your brain will react to such thing. Some people think they will react one way but react exactly opposite when situation presents itself.",,,1619300713,{},gvr4oqw,False,t3_mxsy99,False,True,t1_gvr3fl8,/r/AMA/comments/mxsy99/i_score_highly_for_both_primary_and_secondary/gvr4oqw/,1619317080,2,True,False,AMA,t5_2r4eo,,0,[],
[],,DaisyChained23,,,[],,,,text,t2_a1zp2204,False,True,[],"In a nutshell, a friend of mine is getting together with someone new. He's not good enough for her.",,,1619300712,{},gvr4opb,True,t3_mxsy99,False,True,t1_gvr31z6,/r/AMA/comments/mxsy99/i_score_highly_for_both_primary_and_secondary/gvr4opb/,1619317079,1,True,False,AMA,t5_2r4eo,,0,[],
[],,DaDankFox,,,[],,,,text,t2_81ic66m,False,False,[],Milk in the bowl before or after your cereal? This will truly be a judgment of character.,,,1619300707,{},gvr4oae,False,t3_mxnfsk,False,False,t3_mxnfsk,/r/AMA/comments/mxnfsk/im_a_cop_ama/gvr4oae/,1619317073,4,True,False,AMA,t5_2r4eo,,0,[],
[],,DrRedditMemes,,,[],,,,text,t2_4e43qexg,False,False,[],Can you tell the story?,,,1619300703,{},gvr4o1t,False,t3_mxt25f,False,True,t3_mxt25f,/r/AMA/comments/mxt25f/i_was_groomed_online_by_a_27_year_old_woman_when/gvr4o1t/,1619317069,2,True,False,AMA,t5_2r4eo,,0,[],
[],,ZevLuvX-03,,,[],,,,text,t2_37jiqq3o,False,False,[],You ever told on a “bad cop”?,,,1619300647,{},gvr4k6n,False,t3_mxnfsk,False,True,t3_mxnfsk,/r/AMA/comments/mxnfsk/im_a_cop_ama/gvr4k6n/,1619317012,1,True,False,AMA,t5_2r4eo,,0,[],
[],,DaisyChained23,,,[],,,,text,t2_a1zp2204,False,True,[],"Manipulation requires you to understand how others think, what they want and how you're going to use what they want to get them to do what you want. It also comes in handy to be able to pretty much turn off emotions on demand and to not feel guilt. 

Relationships require effort to maintain. If a relationship is no longer beneficial to me I'm just going to put zero effort into maintaining it until it disintegrates. 

People often think of psychopathy as being synonymous with ""evil"", but it's not. It's just a different way that a mind can be programmed. There are good and bad psychopaths for the same reason there are good and bad people of any category.",,,1619300612,{},gvr4hnm,True,t3_mxsy99,False,True,t1_gvr3q3w,/r/AMA/comments/mxsy99/i_score_highly_for_both_primary_and_secondary/gvr4hnm/,1619316973,1,True,False,AMA,t5_2r4eo,,0,[],
[],,P3runaama,,,[],,,,text,t2_pcuwjbd,False,False,[],What do you think about the idea of expanding walmart to be a world wide company?,,,1619300571,{},gvr4ets,False,t3_mxtfx5,False,True,t3_mxtfx5,/r/AMA/comments/mxtfx5/im_doug_mcmillon_ceo_of_walmart_ask_me_anything/gvr4ets/,1619316928,1,True,False,AMA,t5_2r4eo,,0,[],
[],,Lady__Mai,,,[],,,,text,t2_5utjke16,False,False,[],"I wouldn’t necessarily call him a celebrity. He’s known among niché porn aficionados, but he isn’t a world famous actor. As for your question, I never had to pretend anything during our relationship. One perk of dating someone in that line of work is that all judgment goes out the window and you get to be yourself, as you are.",,,1619300521,{},gvr4bcw,True,t3_mxtiyc,False,True,t1_gvr41qi,/r/AMA/comments/mxtiyc/i_dated_a_male_porn_actor_for_two_years_ama/gvr4bcw/,1619316875,2,True,False,AMA,t5_2r4eo,,0,[],
[],,DrRedditMemes,,,[],,,,text,t2_4e43qexg,False,False,[],"I kinda wanna know what show, but still that’s really cool",,,1619300496,{},gvr49j7,False,t3_mxqhzo,False,True,t3_mxqhzo,/r/AMA/comments/mxqhzo/my_twin_and_i_were_baby_actors_growing_up_and/gvr49j7/,1619316846,2,True,False,AMA,t5_2r4eo,,0,[],
[],,MDrok6172,,,[],,,,text,t2_7mjdoy1w,False,False,[],"Duh, but how are his private dealings connected to the president. You think Biden made his son do ehat he did? No he did not, he's a grown man.",,,1619300429,{},gvr44uk,False,t3_mxhl69,False,True,t1_gvr1j0r,/r/AMA/comments/mxhl69/i_resigned_from_lapd_this_week_after_11_years_of/gvr44uk/,1619316772,1,True,False,AMA,t5_2r4eo,,0,[],
[],,SadSavage_,,,[],,,,text,t2_677yiuup,False,False,[],What are some tips you’d give someone pursuing a career in LE,,,1619300417,{},gvr43z7,False,t3_mxnfsk,False,True,t3_mxnfsk,/r/AMA/comments/mxnfsk/im_a_cop_ama/gvr43z7/,1619316758,1,True,False,AMA,t5_2r4eo,,0,[],
[],,P3runaama,,,[],,,,text,t2_pcuwjbd,False,False,[],"Did you ever ""preted"" to enjoy to relationship more than you did just so you'd have the bragging right of dating a celebrity? (Or other reasons for feeling the need to ""pretend"")",,,1619300385,{},gvr41qi,False,t3_mxtiyc,False,True,t3_mxtiyc,/r/AMA/comments/mxtiyc/i_dated_a_male_porn_actor_for_two_years_ama/gvr41qi/,1619316723,2,True,False,AMA,t5_2r4eo,,0,[],
[],,aofacts1020,,,[],,,,text,t2_2wmjubqp,False,False,[],i ended up doordashing 5 Guys and watching a horror movie. Slept for most of the morning tho,,,1619300367,{},gvr40k6,True,t3_mxrvja,False,True,t1_gvr3jxu,/r/AMA/comments/mxrvja/i_called_out_of_work_and_l_cancelled_2/gvr40k6/,1619316706,1,True,False,AMA,t5_2r4eo,,0,[],
[],,jasmin710,,,[],,,,text,t2_5qausfyp,False,False,[],"Oh I see, that's very interesting. Thank you for this insight :) I don't think it is talked about nearly enough.",,,1619300348,{},gvr3z6z,False,t3_mxsy99,False,True,t1_gvr3nbd,/r/AMA/comments/mxsy99/i_score_highly_for_both_primary_and_secondary/gvr3z6z/,1619316686,2,True,False,AMA,t5_2r4eo,,0,[],
[],,rinlalin,,,[],,,,text,t2_13ehrk,False,False,[],"TL;DR i stopped for my loved ones. they were (and are) the only things keeping me alive and sober.

long story:

for reference, i've been clean for nearly 2.5 years now.

honestly i don't know what clicked for me. i was self-harming on a daily basis, sometimes multiple times a day. i was in therapy with a plethora of different therapists and i often ditched them after one or two visits because they all said the same generic shit that meant nothing.

if i had to say, it's not that i wanted to stop, because it helped me feel alive.

but i was hurting the people i loved. it wasn't just me. my mom, my friends, my sister, my ex at the time. every time i relapsed and came to them and they saw my wrists or my thighs or my arms or whatever, they would have the saddest look on their face. they never blamed me, but i couldn't keep seeing that sadness in their eyes. i realized i had to stop before it went too far and i couldn't ever keep my loved ones happy.

i have an app called ""I Am Sober"" (for all sorts of addictions) where you can log your feelings, how many days you've been clean, talk with other people who are in the same milestone ballpark as you, and a bunch of other stuff. it's helped a lot.

alongside making music, drawing art, going out and enjoying time with my sister, having virtual dates with my partner who lives 400+ miles away during a pandemic. it's the little things that remind me why i'm staying alive and staying clean.

it's so hard to recover but i truly believe in my heart everyone has at least one reason. they just have to find it, and i believe they'll also do that at the right time.",,,1619300335,{},gvr3yav,True,t3_mxso5e,False,True,t1_gvr2g2e,/r/AMA/comments/mxso5e/i_attempted_suicide_7_times_during_my_teen_years/gvr3yav/,1619316671,1,True,False,AMA,t5_2r4eo,,0,[],
[],,Threeminusme,,,[],,,,text,t2_633skne2,False,False,[],I can answer this for you: because you took alprazolam. I was treated with this for a while and it turned me into a zombie. I would be sleepy for days. It never went away for as long as I was treated with it.,,,1619300326,{},gvr3xmm,False,t3_mxs6zb,False,True,t3_mxs6zb,/r/AMA/comments/mxs6zb/ive_slept_19_hours_right_now_and_i_still_feel/gvr3xmm/,1619316662,2,True,False,AMA,t5_2r4eo,,0,[],
[],,ToddABerry,,,[],,,,text,t2_7j79dt57,False,False,[],Ask for it by name.  They handed it out like candy both of my stays in rehab and all three of my stays at the mental hospital.  It's basically an anxiety pill for addicts,,,1619300281,{},gvr3ug9,False,t3_mxso5e,False,True,t1_gvr3ocg,/r/AMA/comments/mxso5e/i_attempted_suicide_7_times_during_my_teen_years/gvr3ug9/,1619316612,2,True,False,AMA,t5_2r4eo,,0,[],
[],,RealDougMcMillon,,,[],,,,text,t2_bqjrmtnf,False,False,[],Not really. I'm hoping to get some questions for a video on the Walmart channel on YouTube.,,,1619300277,{},gvr3u5p,True,t3_mxtfx5,False,True,t1_gvr2w3e,/r/AMA/comments/mxtfx5/im_doug_mcmillon_ceo_of_walmart_ask_me_anything/gvr3u5p/,1619316607,1,True,False,AMA,t5_2r4eo,,0,[],
[],,Lady__Mai,,,[],,,,text,t2_5utjke16,False,False,[],"It was fabulous. It was very passionate, experimental, wild and eye-opening in a lot of ways, especially since I was so young when we started sleeping together.",,,1619300276,{},gvr3u26,True,t3_mxtiyc,False,True,t1_gvr3ow1,/r/AMA/comments/mxtiyc/i_dated_a_male_porn_actor_for_two_years_ama/gvr3u26/,1619316606,3,True,False,AMA,t5_2r4eo,,0,[],
[],,GreaseMonkDE,,,[],,,,text,t2_8khx0vmt,False,False,[],"I guess I’m just trying to understand the key differences between yourself and the average person. Why do you believe yourself to be better at manipulating others? And why is it easier to avoid relationships. If there was something that you would want others to know about psychopathy, what would it be? Forgive my curiosity. It’s a topic of interest.",,,1619300220,{},gvr3q3w,False,t3_mxsy99,False,True,t1_gvr367u,/r/AMA/comments/mxsy99/i_score_highly_for_both_primary_and_secondary/gvr3q3w/,1619316543,1,True,False,AMA,t5_2r4eo,,0,[],
[],,pacothebattlefly,,,[],,,,text,t2_3drgv9d,False,False,[],How was your sex life?,,,1619300203,{},gvr3ow1,False,t3_mxtiyc,False,True,t3_mxtiyc,/r/AMA/comments/mxtiyc/i_dated_a_male_porn_actor_for_two_years_ama/gvr3ow1/,1619316524,2,True,False,AMA,t5_2r4eo,,0,[],
[],,Agent47isyourdad,,,[],,,,text,t2_9ycsgfvf,False,False,[],"Okay, I guess i'll go ask them to see what they can do to help me",,,1619300195,{},gvr3ocg,False,t3_mxso5e,False,True,t1_gvr3l9x,/r/AMA/comments/mxso5e/i_attempted_suicide_7_times_during_my_teen_years/gvr3ocg/,1619316516,1,True,False,AMA,t5_2r4eo,,0,[],
[],,DaisyChained23,,,[],,,,text,t2_a1zp2204,False,True,[],"That's a tough one. I feel things that in most other people would be labeled as ""fear"" or ""anxiety"" but for me they are not emotions. For me, the rush of adrenaline caused by situations which typically illicit fear is like a caffeine rush or being drunk- it's a physical experience. 

As for anxiety, I can anticipate that something will be bad for me and prepare to deal with it, so that could be considered cognitive anxiety of sorts. I also seem to have vaguely paranoid tendencies, I like to prepare for all the things that could possibly go wrong. Again, not an emotion, just a thing my brain compels me to do in much the same way it might compel me to eat or sleep.",,,1619300181,{},gvr3nbd,True,t3_mxsy99,False,True,t1_gvr32bm,/r/AMA/comments/mxsy99/i_score_highly_for_both_primary_and_secondary/gvr3nbd/,1619316501,2,True,False,AMA,t5_2r4eo,,0,[],
[],,Additional_Radio5350,,,[],,,,text,t2_9oezf9c8,False,False,[],What’s the best cop joke you’ve heard?,,,1619300170,{},gvr3mk5,False,t3_mxnfsk,False,True,t3_mxnfsk,/r/AMA/comments/mxnfsk/im_a_cop_ama/gvr3mk5/,1619316488,1,True,False,AMA,t5_2r4eo,,0,[],
[],,Desertfox1566,,,[],,,,text,t2_5s3bm0l0,False,False,[],I dont need to know all the synonyms to call a faker a faker. I've seen quite enough about you.,,,1619300168,{},gvr3mf5,False,t3_msxaph,False,True,t1_gvr3gh2,/r/AMA/comments/msxaph/were_an_osdd_system_formerly_known_as_multiple/gvr3mf5/,1619316486,1,True,False,AMA,t5_2r4eo,,0,[],
[],,ToddABerry,,,[],,,,text,t2_7j79dt57,False,False,[],It's a pill.  Kinda like benedryl on steroids.  It's usually a PRN at mental hospitals.,,,1619300152,{},gvr3l9x,False,t3_mxso5e,False,True,t1_gvr3hri,/r/AMA/comments/mxso5e/i_attempted_suicide_7_times_during_my_teen_years/gvr3l9x/,1619316469,2,True,False,AMA,t5_2r4eo,,0,[],
[],,SaavayuAdrin,,,[],,,,text,t2_643qx7ll,False,False,[],"Is not making a full stop at a stop sign illegal? By what it says in the law, not what most people do.",,,1619300152,{},gvr3l8v,False,t3_mxnfsk,False,True,t3_mxnfsk,/r/AMA/comments/mxnfsk/im_a_cop_ama/gvr3l8v/,1619316469,1,True,False,AMA,t5_2r4eo,,0,[],
[],,R0XG4MER,,,[],,,,text,t2_1j3fmcvw,False,False,[],"Let's split this into points to make it easier for both of us.

1. Do I believe in hadiths?
Yes, they are the 2nd source of shari'a after quran and a muslim who doesn't believe in them is basically neglecting a big part of his religion.

2. Aisha was 6 and Islam allows pedophilia.
No that's not true at all. There's no solid proof of her age when she got married, and even if she was, you have to consider the traditions and norms at that place and time (adulthood was defined as when someone hit puberty back then), and Islam does not allow pedophilia in any way, shape or form.

3. She was playing with her dolls which is forbidden.
There's nothing that forbids playing with dolls, if you meant something else please let me know.

4. Adulterous, blasphemers, and apostates are to be put to death.
Blasphemers and apostates are only put to death if they're dangerous to Islam and muslims, and are free to live their lives within an Islamic community otherwise.

Now those who commit adultery are to face different penalties depending on a number of things. First, if an unmarried (virgin) man commits adultery with an unmarried (virgin) woman, their penalty is a hundred lashes each and banishment for a year. And if a married (or had been married previously) man commits adultery with a married (or had been previously married) woman, their penalty is stoning to death.

5. No nation could succeed with a woman leader.
I believe that could be true to some extent, women get emotional sometimes and that might affect the decisions taken if the full lead was in a woman's hand. Although that doesn't stop a woman from being a leader today as most of the decisions are taken in some sort of parliament which has male and female members

6. How I feel about hijab.
If you have an expensive gem, you'd want to hide it from everyone and keep it safe. That's exactly what hijab is. Our women are gems and hijab is their protective cover to protect them, and taking that away from them is basically leaving them in the open",,,1619300147,{},gvr3kyl,True,t3_mxi5at,False,True,t1_gvq9arb,/r/AMA/comments/mxi5at/im_a_muslim_with_pretty_good_knowledge_of_my/gvr3kyl/,1619316464,1,True,False,AMA,t5_2r4eo,,0,[],
[],,The_Hamster98,,,[],,,,text,t2_73cg15rh,False,False,[],What do you plan to do with all this new free time?,,,1619300133,{},gvr3jxu,False,t3_mxrvja,False,True,t3_mxrvja,/r/AMA/comments/mxrvja/i_called_out_of_work_and_l_cancelled_2/gvr3jxu/,1619316449,1,True,False,AMA,t5_2r4eo,,0,[],
[],,albonymus,,,[],,,,text,t2_9hpkg1zp,False,False,[],How often does it happen that people let shit go through just because you are a cop?,,,1619300111,{},gvr3idf,False,t3_mxnfsk,False,True,t3_mxnfsk,/r/AMA/comments/mxnfsk/im_a_cop_ama/gvr3idf/,1619316424,1,True,False,AMA,t5_2r4eo,,0,[],
[],,IamSuperSapien,,,[],,,,text,t2_axbevy6j,False,False,[],No one incriminate themselves.,,,1619300108,{},gvr3i7i,False,t3_mxnfsk,False,True,t3_mxnfsk,/r/AMA/comments/mxnfsk/im_a_cop_ama/gvr3i7i/,1619316422,1,True,False,AMA,t5_2r4eo,,0,[],
[],,Agent47isyourdad,,,[],,,,text,t2_9ycsgfvf,False,False,[],"No, Is it a pill? because i hate needles and would most likely punch someone if they get to close to me with one",,,1619300102,{},gvr3hri,False,t3_mxso5e,False,True,t1_gvr3ct8,/r/AMA/comments/mxso5e/i_attempted_suicide_7_times_during_my_teen_years/gvr3hri/,1619316415,2,True,False,AMA,t5_2r4eo,,0,[],
[],,TheLightFlower,,,[],,,,text,t2_4ducwe7o,False,False,[],"If you don't know what a system is, maybe don't go fake claiming systems? Anyways we do not feel safe with her after things that she's done, including telling our abusive parents stuff we wanted to keep secret.",,,1619300083,{},gvr3gh2,True,t3_msxaph,False,True,t1_gvr2l1e,/r/AMA/comments/msxaph/were_an_osdd_system_formerly_known_as_multiple/gvr3gh2/,1619316395,2,True,False,AMA,t5_2r4eo,,0,[],
[],,The_Hamster98,,,[],,,,text,t2_73cg15rh,False,False,[],"I know psychopath doesn’t mean serial killer, and I know that most psychopaths would never kill anyone. I don’t want my question to be misunderstood because I don’t want to imply that you are a threat or a killer. 

That being said, *if* you killed someone, how do you think it would make you feel? I have a friend who had to kill in order to safe his life, it really scarred him, do you think it would have the same effect on you?",,,1619300071,{},gvr3fl8,False,t3_mxsy99,False,True,t3_mxsy99,/r/AMA/comments/mxsy99/i_score_highly_for_both_primary_and_secondary/gvr3fl8/,1619316381,1,True,False,AMA,t5_2r4eo,,0,[],
[],,Timasabi,,,[],,,,text,t2_przk1,False,False,[],ACAB,,,1619300053,{},gvr3ebo,False,t3_mxnfsk,False,True,t3_mxnfsk,/r/AMA/comments/mxnfsk/im_a_cop_ama/gvr3ebo/,1619316361,-8,True,False,AMA,t5_2r4eo,,0,[],
[],,SaavayuAdrin,,,[],,,,text,t2_643qx7ll,False,False,[],"That seems like some for of thank you, which I think is genki desu, but I don’t know since I’m only at the point of learning vocabulary and kanji",,,1619300045,{},gvr3dpd,True,t3_mxt866,False,True,t1_gvr2iwx,/r/AMA/comments/mxt866/i_am_learning_japanese_ama/gvr3dpd/,1619316352,1,True,False,AMA,t5_2r4eo,,0,[],
[],,ToddABerry,,,[],,,,text,t2_7j79dt57,False,False,[],"Have you asked the nurse for hydroxyzine (they might call it Atarax or Vistaril)?  It helps some people sleep and helps anxiety a bit, too.",,,1619300032,{},gvr3ct8,False,t3_mxso5e,False,True,t1_gvr343w,/r/AMA/comments/mxso5e/i_attempted_suicide_7_times_during_my_teen_years/gvr3ct8/,1619316338,2,True,False,AMA,t5_2r4eo,,0,[],
[],,KozyShackDeluxe,,,[],,,,text,t2_4ypt133z,False,False,[],"When you pull over a teenager do you ever let things slip because you don’t want to fuck their lives over at such a young age? Example: you pull some kid over and you smell marijuana, do you say “I smell marijuana” or go on with a regular pull over? - asking for license and registration and telling them the reason why they got pulled over in that matter.

Theoretical example: I come from a small town where pretty much everyone knows each other. My friend got pulled over, after we have been smoking weed in the car and I was surprise the officer didn’t say that he didn’t smell weed. My friend and I are friends with the officers son in high school/college and the officer also knows us because his son hangs out with us every weekend.",,,1619300011,{},gvr3bds,False,t3_mxnfsk,False,False,t3_mxnfsk,/r/AMA/comments/mxnfsk/im_a_cop_ama/gvr3bds/,1619316316,1,True,False,AMA,t5_2r4eo,,0,[],
[],,Threeminusme,,,[],,,,text,t2_633skne2,False,False,[],Reveal me your secrets. How to do that and get away with it? I’m sincerely curious and a tad bit jealous🤣,,,1619299999,{},gvr3ai4,False,t3_mx3sc4,False,True,t3_mx3sc4,/r/AMA/comments/mx3sc4/everybody_talks_about_being_the_only_kid_that/gvr3ai4/,1619316303,1,True,False,AMA,t5_2r4eo,,0,[],
[],,Rogers1977,,,[],,,,text,t2_j90g8,False,False,[],"Ah okay, so you’ll feel a pretty decent body high.  Be sure you’re in a comfy environment and with people you trust. Have a safe trip. 😊",,,1619299955,{},gvr37fd,False,t3_mxslj2,False,False,t1_gvr1qwf,/r/AMA/comments/mxslj2/trying_weed_for_the_first_time_ama/gvr37fd/,1619316255,2,True,False,AMA,t5_2r4eo,,0,[],
[],,Blue-Corn,,,[],,,,text,t2_37jima4f,False,False,[],"Call again. Road cops can’t do much to investigate ongoing things. I know it sounds crazy. Squeaky wheel and all that. Call again. If you have a tip line, call that. Report a non-emergency if you have one of those lines.",,,1619299948,{},gvr36y0,True,t3_mxnfsk,False,True,t1_gvqzrqf,/r/AMA/comments/mxnfsk/im_a_cop_ama/gvr36y0/,1619316248,3,True,False,AMA,t5_2r4eo,,0,[],
[],,Tordevil,,,[],,,,text,t2_nvlsg,False,False,[],Norway?,,,1619299943,{},gvr36le,False,t3_mxpus8,False,True,t3_mxpus8,/r/AMA/comments/mxpus8/i_have_been_to_a_shit_ton_a_countries_ama/gvr36le/,1619316242,1,True,False,AMA,t5_2r4eo,,0,[],
[],,DaisyChained23,,,[],,,,text,t2_a1zp2204,False,True,[],"Everyone manipulates others. I don't do it more than anyone else, but I do it better than most other people.

I am able to maintain relationships but often it's easier not to. 

I get violent impulses in the same way that everyone does (or at least I think everyone does?) but I am able to decide not to act on those impulses. I would only actually become violent when it is contextually appropriate e.g. in self-defence.",,,1619299938,{},gvr367u,True,t3_mxsy99,False,True,t1_gvr2jpw,/r/AMA/comments/mxsy99/i_score_highly_for_both_primary_and_secondary/gvr367u/,1619316236,1,True,False,AMA,t5_2r4eo,,0,[],
[],,RealDougMcMillon,,,[],,,,text,t2_bqjrmtnf,False,False,[],"My day is doing good.

If I were to change one thing about walmart, then I *would* change it! Walmart as it is currently is exactly what I envision it as. :)",,,1619299929,{},gvr35kr,True,t3_mxtfx5,False,True,t1_gvr2xqg,/r/AMA/comments/mxtfx5/im_doug_mcmillon_ceo_of_walmart_ask_me_anything/gvr35kr/,1619316226,1,True,False,AMA,t5_2r4eo,,0,[],
[],,Agent47isyourdad,,,[],,,,text,t2_9ycsgfvf,False,False,[],"I could really do with the sleep because i just threw up in my toilet 

The last 2 days have been very hard and emotional so sleep is what i need rn so i have energy for tomorrow",,,1619299908,{},gvr343w,False,t3_mxso5e,False,True,t1_gvr2otc,/r/AMA/comments/mxso5e/i_attempted_suicide_7_times_during_my_teen_years/gvr343w/,1619316203,2,True,False,AMA,t5_2r4eo,,0,[],
[],,billybobjoe517,,,[],,,,text,t2_3fguxsrb,False,False,[],How do people act around you? Do you notice people being more nervous or cautious when they see you?,,,1619299902,{},gvr33q9,False,t3_mxnfsk,False,True,t3_mxnfsk,/r/AMA/comments/mxnfsk/im_a_cop_ama/gvr33q9/,1619316197,1,True,False,AMA,t5_2r4eo,,0,[],
