all_awardings,associated_award,author,author_flair_background_color,author_flair_css_class,author_flair_richtext,author_flair_template_id,author_flair_text,author_flair_text_color,author_flair_type,author_fullname,author_patreon_flair,author_premium,awarders,body,collapsed_because_crowd_control,comment_type,created_utc,gildings,id,is_submitter,link_id,locked,no_follow,parent_id,permalink,retrieved_on,score,send_replies,stickied,subreddit,subreddit_id,top_awarded_type,total_awards_received,treatment_tags,distinguished,author_cakeday
[],,torio333,,,[],,,,text,t2_c3avk,False,False,[],A dirt devil broom vac. I thought it was the coolest thing when it came out.,,,1619304434,{},gvrbrs8,False,t3_mxnf10,False,True,t3_mxnf10,/r/AskReddit/comments/mxnf10/what_is_the_most_overrated_product_youve_purchased/gvrbrs8/,1619320885,1,True,False,AskReddit,t5_2qh1i,,0,[],,
[],,Germanloser2u,,,[],,,,text,t2_8h8m5b86,False,False,[],The end was a bit brutal,,,1619304434,{},gvrbrrb,False,t3_mxo8n2,False,True,t1_gvqbbfm,/r/AskReddit/comments/mxo8n2/whats_the_funniest_movie_youve_ever_seen/gvrbrrb/,1619320884,2,True,False,AskReddit,t5_2qh1i,,0,[],,
[],,12altoids34,,,[],,,,text,t2_12p7bh,False,False,[],"And the concept of ""freeing the slaves"".  They had to give up their homes at all the comforts they had ever known to wander in the desert eating nothing but manna every day until they died.not a single one ever reached the promised land.yes their children did or their children's children but none that were alive in egypt.",,,1619304434,{},gvrbrr4,False,t3_mxcycv,False,True,t1_gvqwu94,/r/AskReddit/comments/mxcycv/what_are_some_major_plot_holes_in_any_religion/gvrbrr4/,1619320884,1,True,False,AskReddit,t5_2qh1i,,0,[],,
[],,Vdavis90,,,[],,,,text,t2_36kq9jz8,False,False,[],Child molester,,,1619304433,{},gvrbrp1,False,t3_mxf4dl,False,False,t1_gvrbpyo,/r/AskReddit/comments/mxf4dl/what_is_the_most_toxic_thing_a_parent_can_say_to/gvrbrp1/,1619320884,2,True,False,AskReddit,t5_2qh1i,,0,[],,
[],,Bastard-of-the-North,,,[],,,,text,t2_2rpj3rik,False,False,[],Ginger bread man,,,1619304432,{},gvrbrmc,False,t3_mxuw99,False,False,t3_mxuw99,/r/AskReddit/comments/mxuw99/what_character_would_you_dress_up_as_at_your/gvrbrmc/,1619320882,1,True,False,AskReddit,t5_2qh1i,,0,[],,
[],,ChinUpButtercup4,,,[],,,,text,t2_auson133,False,False,[],I..confusion but also..intrigued,,,1619304431,{},gvrbrk6,False,t3_mxuxzl,False,False,t3_mxuxzl,/r/AskReddit/comments/mxuxzl/suddenly_you_get_a_pc_it_is_made_of_pulsating/gvrbrk6/,1619320882,-1,True,False,AskReddit,t5_2qh1i,,0,[],,
[],,trippystonehouse,,,[],,,,text,t2_99izsbze,False,False,[],Natural or synthetic?,,,1619304431,{},gvrbrjx,False,t3_mxpt34,False,False,t1_gvqylvn,/r/AskReddit/comments/mxpt34/what_was_the_best_way_youve_surprised_your/gvrbrjx/,1619320882,1,True,False,AskReddit,t5_2qh1i,,0,[],,
[],,ilovetopoopie,,,[],,,,text,t2_dgbq8,False,False,[],I'm with you.,,,1619304430,{},gvrbrj9,False,t3_mxtmp5,False,False,t1_gvr5hxx,/r/AskReddit/comments/mxtmp5/what_countries_do_you_recommend_for_sex_vacation/gvrbrj9/,1619320882,2,True,False,AskReddit,t5_2qh1i,,0,[],,
[],,Osolemia,,,[],,,,text,t2_bmgx60lh,False,True,[],"Complex PTSD. I got diagnosed with it recently. Because of constant childhood abuse, I can't function normally. I get depressed, can't think straight, jump at small noises, scream, and swear a lot. I'm in a constant state of rage. All because my brain was ""rewired"" from my mother's ""loving"" treatment. There is a sub here, and it's apparently an epidemic.",,,1619304430,{},gvrbri5,False,t3_mxsrb9,False,True,t3_mxsrb9,/r/AskReddit/comments/mxsrb9/what_is_not_seen_as_a_serious_chronic_disease_but/gvrbri5/,1619320881,3,True,False,AskReddit,t5_2qh1i,,0,[],,
[],,Daud_K,,,[],,,,text,t2_3y2a1yx2,False,False,[],"Ah I see, anyways good luck with your PhD!",,,1619304430,{},gvrbrh3,False,t3_mxnf10,False,True,t1_gvr54k6,/r/AskReddit/comments/mxnf10/what_is_the_most_overrated_product_youve_purchased/gvrbrh3/,1619320880,2,True,False,AskReddit,t5_2qh1i,,0,[],,
[],,El-Batidos,,,[],,,,text,t2_59f7jvnq,False,False,[],"Got jumped by dudes with machettes, that was fun.",,,1619304429,{},gvrbrfx,False,t3_mxuvzq,False,True,t3_mxuvzq,/r/AskReddit/comments/mxuvzq/what_is_the_funniest_thing_to_happen_to_you_in_a/gvrbrfx/,1619320879,1,True,False,AskReddit,t5_2qh1i,,0,[],,
[],,fadeplayer40,,,[],,,,text,t2_3vqybpjn,False,False,[],"I had the original a lifetime ago....back when people called each other.

I dabbled with many smart phones after that. Bum charging ports killed at three iphones before their time. Two Samsungs did nothing but frustrate me. I'm on my second Motorola now, and it performs better than phones 2-3 times the price.

You, my friend, are clearly not into it for the discount aspect. I hope it is everything you want.",,,1619304428,{},gvrbre7,False,t3_mxswoq,False,True,t1_gvrapy9,/r/AskReddit/comments/mxswoq/whats_the_most_underrated_product_youve_purchased/gvrbre7/,1619320879,2,True,False,AskReddit,t5_2qh1i,,0,[],,
[],,WhenDatWeedIsGone,,,[],,,,text,t2_nfs72,False,False,[],"What kind of fucked up universities are you guys going to? Here all books for a given course are used for the entirety of the course. Professors aren't selling us books either. If they wrote the book, we get the PDF for free.",,,1619304428,{},gvrbrcq,False,t3_mxnf10,False,True,t1_gvqni6m,/r/AskReddit/comments/mxnf10/what_is_the_most_overrated_product_youve_purchased/gvrbrcq/,1619320878,1,True,False,AskReddit,t5_2qh1i,,0,[],,
[],,deecro3000,,,[],,,,text,t2_1spxwjih,False,False,[],Animal crossing new horizons,,,1619304428,{},gvrbrco,False,t3_mxnf10,False,True,t3_mxnf10,/r/AskReddit/comments/mxnf10/what_is_the_most_overrated_product_youve_purchased/gvrbrco/,1619320878,0,True,False,AskReddit,t5_2qh1i,,0,[],,
[],,AutoModerator,,,[],,,,text,t2_6l4z3,False,True,[],"**PLEASE READ THIS MESSAGE IN ITS ENTIRETY BEFORE TAKING ACTION.**

Hi there, your post has been removed for one of the following reasons: 

* [Rule 3:](https://www.reddit.com/r/AskReddit/wiki/index#wiki_-rule_3-) You must phrase the question to require more of an explanation than just ""yes"" or ""no"".  You may want to try to post your question in /r/polls.

* [Rule 3:](https://www.reddit.com/r/AskReddit/wiki/index#wiki_-rule_3-) Questions with a single correct answer, that can be researched elsewhere are not allowed on AskReddit.

* [Rule 1:](http://www.reddit.com/r/AskReddit/wiki/index#wiki_-rule_1-) You must post a clear and direct question in the title.  *The question must be a full sentence*.  Try including question phrases like ""What is..."", ""What are..."".

*I am a bot, and this action was performed automatically. Please [contact the moderators of this subreddit](/message/compose/?to=/r/AskReddit) if you have any questions or concerns.*",,,1619304428,{},gvrbrce,False,t3_mxuymt,False,True,t3_mxuymt,/r/AskReddit/comments/mxuymt/is_using_a_companys_policies_against_them/gvrbrce/,1619320878,1,False,False,AskReddit,t5_2qh1i,,0,[],moderator,
[],,[deleted],,,,,,dark,,,,,[],[deleted],,,1619304427,{},gvrbrb3,False,t3_mxcycv,False,False,t1_gvrawxe,/r/AskReddit/comments/mxcycv/what_are_some_major_plot_holes_in_any_religion/gvrbrb3/,1619320878,1,False,False,AskReddit,t5_2qh1i,,0,[],,
[],,OptimisticFuture247,,,[],,,,text,t2_j8g836u,False,False,[],College.,,,1619304427,{},gvrbrav,False,t3_mxnf10,False,False,t3_mxnf10,/r/AskReddit/comments/mxnf10/what_is_the_most_overrated_product_youve_purchased/gvrbrav/,1619320878,2,True,False,AskReddit,t5_2qh1i,,0,[],,
[],,LXiles,,,[],,,,text,t2_4h7ya0yu,False,False,[],Dyson vacuum. It sucked....I mean.... cuz it DIDN'T suck,,,1619304427,{},gvrbra2,False,t3_mxnf10,False,False,t3_mxnf10,/r/AskReddit/comments/mxnf10/what_is_the_most_overrated_product_youve_purchased/gvrbra2/,1619320878,0,True,False,AskReddit,t5_2qh1i,,0,[],,
[],,serene_brutality,,,[],,,,text,t2_a0u34m8l,False,False,[],"Not saying it doesn’t have its benefits. But I’ve heard people boast that “it replaces deep frying” and “it’s superior in every way!” It clearly does and is not.

I use mine here and there but if I’m going for taste and texture I’ll but out the old artery clogger.",,,1619304427,{},gvrbr9t,False,t3_mxnf10,False,False,t1_gvrb8bb,/r/AskReddit/comments/mxnf10/what_is_the_most_overrated_product_youve_purchased/gvrbr9t/,1619320878,1,True,False,AskReddit,t5_2qh1i,,0,[],,
[],,AlwaysQuotesEinstein,,,[],,,,text,t2_12or8d,False,False,[],Are they even still a thing? I feel like I haven't seen them for a good few years now.,,,1619304427,{},gvrbr9g,False,t3_mxnf10,False,True,t1_gvqh21c,/r/AskReddit/comments/mxnf10/what_is_the_most_overrated_product_youve_purchased/gvrbr9g/,1619320877,1,True,False,AskReddit,t5_2qh1i,,0,[],,
[],,almightysmart,,,[],,,,text,t2_5eaa7,False,False,[],That's important info there. Shame it wasn't released at the time.,,,1619304426,{},gvrbr8m,False,t3_mxnf10,False,False,t1_gvr8dmo,/r/AskReddit/comments/mxnf10/what_is_the_most_overrated_product_youve_purchased/gvrbr8m/,1619320877,26,True,False,AskReddit,t5_2qh1i,,0,[],,
[],,Alcwathwen,,,[],,,,text,t2_48dz5,False,False,[],"Ah, thanks for that. There isn't much on your website yet, but I like your logo work so far :) thanks for sharing :)",,,1619304426,{},gvrbr8c,False,t3_mwqk5w,False,True,t1_gvr3qpb,/r/AskReddit/comments/mwqk5w/whats_your_most_stupid_whatever_f_it_or_yolo/gvrbr8c/,1619320877,1,True,False,AskReddit,t5_2qh1i,,0,[],,
[],,stackofbones,,,[],,,,text,t2_blujbzuk,False,False,[],This time last year I was sitting at my desk playing a computer in chess for hours on end. Anything is an improvement from that.,,,1619304425,{},gvrbr64,False,t3_mxuwlm,False,True,t3_mxuwlm,/r/AskReddit/comments/mxuwlm/comparatively_how_are_things_going_for_you_now/gvrbr64/,1619320876,1,True,False,AskReddit,t5_2qh1i,,0,[],,
[],,ThatOneShyGirl,,,[],,,,text,t2_687c2,False,False,[],"Thank you so much for the information!

Are these positions pretty few and far between though? Like, even if I were to get into this field and get a grant... Would it be difficult to make a consistent salary for 20+ years? Are research grants (which is, I assume, how people in this position are getting paid) not exactly a constant thing? Would I likely sometimes be going years without getting paid? Thank you again for your time and help!!",,,1619304425,{},gvrbr4o,False,t3_mxnf10,False,True,t1_gvrbf0c,/r/AskReddit/comments/mxnf10/what_is_the_most_overrated_product_youve_purchased/gvrbr4o/,1619320875,1,True,False,AskReddit,t5_2qh1i,,0,[],,
[],,checkoutasguest,,,[],,,,text,t2_54bqfm2t,False,False,[],"You have told this story before, I was on the edge of my seat, knot clenched, for a good 90 seconds.. thank you :)",,,1619304424,{},gvrbr3h,False,t3_mxg11m,False,True,t1_gvq9opv,/r/AskReddit/comments/mxg11m/window_cleaners_of_reddit_whats_the_weirdest/gvrbr3h/,1619320875,2,True,False,AskReddit,t5_2qh1i,,0,[],,
[],,ssigrist,,,[],,,,text,t2_bjglu,False,False,[],"Depends on their age.  First speakers to about 7 can be brutally honest about weight, looks, etc 

Teenagers can be smug and opinionated about your shortcomings. 

But the worst, in my opinion can be the grown child who wants to hurt a parent.  Things like how you failed them. 

I know from my point of view my wife and I put our hearts and years into our kiddos.  

I would hate for our grown kids to say we didn’t love them enough.",,,1619304424,{},gvrbr36,False,t3_mxthxv,False,True,t3_mxthxv,/r/AskReddit/comments/mxthxv/what_is_the_most_toxic_thing_a_child_can_say_to_a/gvrbr36/,1619320875,2,True,False,AskReddit,t5_2qh1i,,0,[],,
[],,Torn_Droxion,,,[],,,,text,t2_8e7qz0r0,False,False,[],just reply to another message instead of the lol,,,1619304424,{},gvrbr2p,False,t3_mxusy7,False,True,t3_mxusy7,/r/AskReddit/comments/mxusy7/how_do_you_respond_to_lol/gvrbr2p/,1619320874,1,True,False,AskReddit,t5_2qh1i,,0,[],,
[],,Energy_Dull,,,[],,,,text,t2_8tu1khwf,False,False,[],I've come to the conclusion that everything at popeyes is rank,,,1619304424,{},gvrbr2h,False,t3_mxnf10,False,True,t1_gvqzyng,/r/AskReddit/comments/mxnf10/what_is_the_most_overrated_product_youve_purchased/gvrbr2h/,1619320874,-1,True,False,AskReddit,t5_2qh1i,,0,[],,
[],,Braj13,,,[],,,,text,t2_3y3q7nak,False,False,[],Stop watching porn kid it warping your perception of what's normal,,,1619304423,{},gvrbr0o,False,t3_mxuvvh,False,True,t3_mxuvvh,/r/AskReddit/comments/mxuvvh/what_would_you_do_if_you_accidentally_sent_your/gvrbr0o/,1619320874,2,True,False,AskReddit,t5_2qh1i,,0,[],,
[],,FuzzyDimensions,,,[],,,,text,t2_3a3iyfxl,False,False,[],https://imgur.com/gallery/peBR3UO,,,1619304423,{},gvrbr0l,True,t3_mxuyia,False,True,t3_mxuyia,/r/AskReddit/comments/mxuyia/does_anyone_know_where_this_license_plate_is_from/gvrbr0l/,1619320874,1,True,False,AskReddit,t5_2qh1i,,0,[],,
[],,Comfortable_Storm_59,,,[],,,,text,t2_7h7eevnm,False,False,[],"In trouble is kind of understating it. After going bankrupt they're down to 31 stores left. Their are small chains you've never heard of with more than 31 stores. 

To put it in perspective, there were 300 Blockbusters in 2013.",,,1619304423,{},gvrbr02,False,t3_mxnf10,False,True,t1_gvqbdtq,/r/AskReddit/comments/mxnf10/what_is_the_most_overrated_product_youve_purchased/gvrbr02/,1619320873,1,True,False,AskReddit,t5_2qh1i,,0,[],,
[],,that_one_person1220,,,[],,,,text,t2_5uu6i4lc,False,False,[],My memories,,,1619304422,{},gvrbqyv,False,t3_mxundj,False,True,t3_mxundj,/r/AskReddit/comments/mxundj/what_was_the_last_thing_that_made_you_cry/gvrbqyv/,1619320873,1,True,False,AskReddit,t5_2qh1i,,0,[],,
[],,sonspider,,,[],,,,text,t2_8p47xdxs,False,False,[],The same way the regular checkouts work except you are doing the cashier's work and the machine monitors your activities.,,,1619304422,{},gvrbqyn,False,t3_mxuljw,False,True,t3_mxuljw,/r/AskReddit/comments/mxuljw/how_do_the_walmart_self_checkouts_work/gvrbqyn/,1619320873,3,True,False,AskReddit,t5_2qh1i,,0,[],,
[],,DJDiehl2K,,,[],,,,text,t2_re65ww7,False,False,[],Who plays it?,,,1619304422,{},gvrbqxr,False,t3_mxrk8i,False,True,t1_gvqvew1,/r/AskReddit/comments/mxrk8i/a_gamers_favorite_console_is_a_penis_what_is_your/gvrbqxr/,1619320873,1,True,False,AskReddit,t5_2qh1i,,0,[],,
[],,WokePOS1,,,[],,,,text,t2_bo117arw,False,False,[],triss or lara croft,,,1619304422,{},gvrbqxc,False,t3_mxm8q0,False,True,t3_mxm8q0,/r/AskReddit/comments/mxm8q0/if_you_could_fuck_a_video_game_character_who/gvrbqxc/,1619320872,1,True,False,AskReddit,t5_2qh1i,,0,[],,
[],,Tacodragon81,,,[],,,,text,t2_a8gzd4as,False,False,[],Asking where their phone is wile holding it,,,1619304421,{},gvrbqvj,False,t3_mxpfn6,False,False,t3_mxpfn6,/r/AskReddit/comments/mxpfn6/what_is_the_stupidest_thing_youve_ever_seen_a/gvrbqvj/,1619320872,3,True,False,AskReddit,t5_2qh1i,,0,[],,
[],,DoskyVenom,,,[],,,,text,t2_7jzy0ixb,False,False,[],Iphone 11 pro with airpods pro,,,1619304421,{},gvrbqv7,False,t3_mxnf10,False,True,t3_mxnf10,/r/AskReddit/comments/mxnf10/what_is_the_most_overrated_product_youve_purchased/gvrbqv7/,1619320871,-2,True,False,AskReddit,t5_2qh1i,,0,[],,
[],,Manmothgoose,,,[],,,,text,t2_5d45vs5f,False,False,[],Hahaha,,,1619304421,{},gvrbqum,False,t3_mxuc4f,False,True,t1_gvr8a87,/r/AskReddit/comments/mxuc4f/what_words_do_people_use_to_try_to_sound_smart/gvrbqum/,1619320871,1,True,False,AskReddit,t5_2qh1i,,0,[],,
[],,Street_Tacos__,,,[],,,,text,t2_6evn5zym,False,False,[],Cheese,,,1619304420,{},gvrbqu4,False,t3_mxtpsf,False,True,t3_mxtpsf,/r/AskReddit/comments/mxtpsf/what_food_tastes_amazing_but_smells_awful/gvrbqu4/,1619320871,1,True,False,AskReddit,t5_2qh1i,,0,[],,
[],,FrozenMic43,,,[],,,,text,t2_3ftd0bw9,False,False,[],"When you drive, make sure you also are watching what other people are doing that are driving.",,,1619304420,{},gvrbqtn,False,t3_mxla0z,False,True,t3_mxla0z,/r/AskReddit/comments/mxla0z/what_advice_do_you_have_for_an_18_year_old/gvrbqtn/,1619320871,2,True,False,AskReddit,t5_2qh1i,,0,[],,
[],,3-DMan,,,[],,,,text,t2_162vr4,False,True,[],First thing I thought a la Labyrinth.(and I know that takes tons of practice),,,1619304419,{},gvrbqrv,False,t3_mxnf10,False,False,t1_gvr82wc,/r/AskReddit/comments/mxnf10/what_is_the_most_overrated_product_youve_purchased/gvrbqrv/,1619320870,7,True,False,AskReddit,t5_2qh1i,,0,[],,
[],,CozyBlueCacaoFire,,,[],,,,text,t2_11tcny5u,False,False,[],"Google ""Robert Welsh"" and ""James Welsh"" - they're twins,  one does makeup and the other skincare.

They're honest and scientific, I like them.",,,1619304419,{},gvrbqrm,False,t3_mxnf10,False,False,t1_gvqwlt4,/r/AskReddit/comments/mxnf10/what_is_the_most_overrated_product_youve_purchased/gvrbqrm/,1619320870,4,True,False,AskReddit,t5_2qh1i,,0,[],,
[],,chumswithcum,,,[],,,,text,t2_176k3u,False,False,[],Started mining bitcoin and buying it at a quarter a piece.,,,1619304419,{},gvrbqr2,False,t3_mxlrti,False,True,t3_mxlrti,/r/AskReddit/comments/mxlrti/if_a_time_traveller_had_warned_you_about_the/gvrbqr2/,1619320870,1,True,False,AskReddit,t5_2qh1i,,0,[],,
[],,omdesai,,,[],,,,text,t2_5dh33iwz,False,False,[],Thank you,,,1619304419,{},gvrbqqy,True,t3_mxuxm0,False,True,t1_gvrboix,/r/AskReddit/comments/mxuxm0/who_is_the_worst_youtuber_of_all_time/gvrbqqy/,1619320870,1,True,False,AskReddit,t5_2qh1i,,0,[],,
[],,Revolutionary-Elk680,,,[],,,,text,t2_ahdz0gmm,False,False,[],"I had one do that to me too.  When I called he said ""I'm really busy at the moment, can we talk next week?""  Then why give me your number????",,,1619304419,{},gvrbqqu,False,t3_mxm5fn,False,True,t1_gvq2mqg,/r/AskReddit/comments/mxm5fn/what_is_the_worst_thing_that_a_therapist_has_ever/gvrbqqu/,1619320870,2,True,False,AskReddit,t5_2qh1i,,0,[],,
[],,B0nes_666,,,[],,,,text,t2_8gx149hu,False,False,[],Death by detonation,,,1619304419,{},gvrbqqq,False,t3_mxtd9p,False,True,t3_mxtd9p,/r/AskReddit/comments/mxtd9p/if_you_have_the_chance_to_choose_your_own_death/gvrbqqq/,1619320870,1,True,False,AskReddit,t5_2qh1i,,0,[],,
[],,Tgunner192,,,[],,,,text,t2_nveks,False,False,[],"I was walking through the downtown area and heard a scream. Myself and others ran to the source of the scream. An elderly lady had fallen down. Her face was severely bruised, her nose was bleeding, her glasses were broke. 

She hadn't been mugged or the victim of any crime. She just lost her footing and face planted. It was sad.",,,1619304419,{},gvrbqqm,False,t3_mxuuhu,False,False,t3_mxuuhu,/r/AskReddit/comments/mxuuhu/what_is_the_most_depressing_situation_youve/gvrbqqm/,1619320870,6,True,False,AskReddit,t5_2qh1i,,0,[],,
[],,AreYouEmployedSir,,,[],,,,text,t2_3owfziq1,False,False,[],"we bought an amazon twin mattress for our guest room and it was fine....except it was too wide for the twin bed frame we had. it would not fit and would lean up on one side. Amazon kept telling us to put it back in the box to ship it back to them and im like ""bro, its literally impossible to get these things back into the box without a massive vaccuum sealer"". after 2 hours on the phone and me refusing their ridiculous offer of $10 of Amazon credit, i finally got someone who was like ""ok, fine  well refund you. just keep the mattress"". we were like, ok....  sold it on craigslist.",,,1619304419,{},gvrbqpz,False,t3_mxnf10,False,False,t1_gvqz1r0,/r/AskReddit/comments/mxnf10/what_is_the_most_overrated_product_youve_purchased/gvrbqpz/,1619320869,5,True,False,AskReddit,t5_2qh1i,,0,[],,
[],,Russian_Terminator,,,[],,,,text,t2_4t0grw2e,False,False,[],It is... Horrifying,,,1619304419,{},gvrbqpp,False,t3_mxqjly,False,True,t1_gvqneie,/r/AskReddit/comments/mxqjly/whats_a_piece_of_information_you_wish_you_never/gvrbqpp/,1619320869,1,True,False,AskReddit,t5_2qh1i,,0,[],,
[],,DooBeeDoer207,,,[],,,,text,t2_8x7x2cig,False,False,[],"I’m surprised you still have a relationship with her, TBH.",,,1619304418,{},gvrbqo0,False,t3_mxf4dl,False,True,t1_gvoqve0,/r/AskReddit/comments/mxf4dl/what_is_the_most_toxic_thing_a_parent_can_say_to/gvrbqo0/,1619320868,1,True,False,AskReddit,t5_2qh1i,,0,[],,
[],,[deleted],,,,,,dark,,,,,[],[removed],,,1619304418,{},gvrbqnr,False,t3_mxu8cd,False,True,t3_mxu8cd,/r/AskReddit/comments/mxu8cd/what_is_the_coolest_thing_youve_seen_some_one_do/gvrbqnr/,1619320868,1,True,False,AskReddit,t5_2qh1i,,0,[],,
[],,SuperFLEB,,,[],,,,text,t2_77ziq,False,False,[],"Hearing about all the things that used to be made of good materials but aren't always makes we wonder: If everyone is making crap out of reconstituted scrap, where's all the real leather, et cetera, going? I mean, sure, there are more expensive brands and lines that do it right, but surely there had to be a market shift in the quantity of real materials needed when everything went garbage.",,,1619304417,{},gvrbqlm,False,t3_mxnf10,False,False,t1_gvr0bpi,/r/AskReddit/comments/mxnf10/what_is_the_most_overrated_product_youve_purchased/gvrbqlm/,1619320867,13,True,False,AskReddit,t5_2qh1i,,0,[],,
[],,Lui_Le_Diamond,,,[],,,,text,t2_1ufe42zz,False,False,[],Sounds to me like you never really gave mods a chance and just assumed they were all bad.,,,1619304416,{},gvrbqk3,False,t3_mxnf10,False,False,t1_gvr8cgk,/r/AskReddit/comments/mxnf10/what_is_the_most_overrated_product_youve_purchased/gvrbqk3/,1619320867,5,True,False,AskReddit,t5_2qh1i,,0,[],,
[],,BlakkoeNakker,,,[],,,,text,t2_491kb9sp,False,False,[],"Lol imagine being stuck in your car with half your body crushed after a crash and you cant reach your phone because its one inch too far and some paramedic just looks at you ""you need to call first""",,,1619304416,{},gvrbqip,False,t3_mxuwhm,False,True,t3_mxuwhm,/r/AskReddit/comments/mxuwhm/emts_if_reddit_if_you_drive_past_someone_who/gvrbqip/,1619320866,2,True,False,AskReddit,t5_2qh1i,,0,[],,
[],,adanipse,,,[],,,,text,t2_e2xfy,False,False,[],When.,,,1619304416,{},gvrbqil,False,t3_mxtlzy,False,True,t3_mxtlzy,/r/AskReddit/comments/mxtlzy/would_u_rather_know_how_u_die_or_when_u_die/gvrbqil/,1619320866,1,True,False,AskReddit,t5_2qh1i,,0,[],,
[],,[deleted],,,,,,dark,,,,,[],[removed],,,1619304415,{},gvrbqi5,False,t3_mxf4dl,False,True,t1_gvo44ry,/r/AskReddit/comments/mxf4dl/what_is_the_most_toxic_thing_a_parent_can_say_to/gvrbqi5/,1619320866,-15,True,False,AskReddit,t5_2qh1i,,0,[],,
[],,Mob_Rules1994,,,[],,,,text,t2_blnf4305,False,False,[],"""Eye"" ""mite"" have heard this one before",,,1619304415,{},gvrbqhc,False,t3_mxqjly,False,True,t1_gvqnpdl,/r/AskReddit/comments/mxqjly/whats_a_piece_of_information_you_wish_you_never/gvrbqhc/,1619320866,3,True,False,AskReddit,t5_2qh1i,,0,[],,
[],,rgatoNacho,,,[],,,,text,t2_71lhkh3r,False,False,[],"Lmao, what was going through your mind?",,,1619304415,{},gvrbqgz,True,t3_mxuvep,False,True,t1_gvrbfz2,/r/AskReddit/comments/mxuvep/whats_the_worst_thing_youve_seenexperienced_going/gvrbqgz/,1619320865,1,True,False,AskReddit,t5_2qh1i,,0,[],,
[],,SnowWhiteWave,,,[],,,,text,t2_1cw3tgwk,False,False,[],I could never bc honestly I cum in gif time then I'm over it. If its sex..yeah taking my time is fun but when it comes to my own time I pull out the ol buzzer- knock em out like a machine gun n go on my way. Much more efficient.,,,1619304414,{},gvrbqfh,False,t3_mxnf10,False,False,t1_gvr02z6,/r/AskReddit/comments/mxnf10/what_is_the_most_overrated_product_youve_purchased/gvrbqfh/,1619320865,8,True,False,AskReddit,t5_2qh1i,,0,[],,
[],,Ihatemyusername123,,,[],,,,text,t2_150k1j,False,False,[],At least in 1 and 2 the dogs don't teleport!,,,1619304414,{},gvrbqet,False,t3_mxlv0f,False,True,t1_gvqmeea,/r/AskReddit/comments/mxlv0f/gamers_of_reddit_what_are_the_most_obnoxious/gvrbqet/,1619320865,1,True,False,AskReddit,t5_2qh1i,,0,[],,
[],,Mcax22,,,[],,,,text,t2_8cjzrjss,False,False,[],Intense answer I was not ready for,,,1619304414,{},gvrbqdr,False,t3_mxu8cd,False,True,t1_gvr88ik,/r/AskReddit/comments/mxu8cd/what_is_the_coolest_thing_youve_seen_some_one_do/gvrbqdr/,1619320864,1,True,False,AskReddit,t5_2qh1i,,0,[],,
[],,RollerGirlB,,,[],,,,text,t2_b2acor1b,False,False,[],oh- well then nvm.,,,1619304414,{},gvrbqdk,True,t3_mxumih,False,True,t1_gvra6sb,/r/AskReddit/comments/mxumih/whats_the_creepiest_thing_a_person_has_ever_said/gvrbqdk/,1619320864,2,True,False,AskReddit,t5_2qh1i,,0,[],,
[],,Boston_Strong_CQB241,,,[],,,,text,t2_3r5focy8,False,False,[],Needed the routing number.,,,1619304413,{},gvrbqcy,False,t3_mxuvo9,False,True,t3_mxuvo9,/r/AskReddit/comments/mxuvo9/for_what_reason_did_you_had_to_call_the_bank/gvrbqcy/,1619320864,1,True,False,AskReddit,t5_2qh1i,,0,[],,
[],,Erdz_Shaho,,,[],,,,text,t2_2v2oub17,False,False,[],Just like how the titanic was unsinkable,,,1619304413,{},gvrbqcc,False,t3_mxnf10,False,True,t1_gvqz12g,/r/AskReddit/comments/mxnf10/what_is_the_most_overrated_product_youve_purchased/gvrbqcc/,1619320863,1,True,False,AskReddit,t5_2qh1i,,0,[],,
[],,dunkernater,,,[],,,,text,t2_7fckygt,False,False,[],Airpods (1st gen ones not the pros) they were worse that my wired ear buds and they had to be put on charge alot,,,1619304411,{},gvrbq8q,False,t3_mxnf10,False,True,t3_mxnf10,/r/AskReddit/comments/mxnf10/what_is_the_most_overrated_product_youve_purchased/gvrbq8q/,1619320862,1,True,False,AskReddit,t5_2qh1i,,0,[],,
