all_awardings,associated_award,author,author_flair_background_color,author_flair_css_class,author_flair_richtext,author_flair_template_id,author_flair_text,author_flair_text_color,author_flair_type,author_fullname,author_patreon_flair,author_premium,awarders,body,collapsed_because_crowd_control,comment_type,created_utc,gildings,id,is_submitter,link_id,locked,no_follow,parent_id,permalink,retrieved_on,score,send_replies,stickied,subreddit,subreddit_id,top_awarded_type,total_awards_received,treatment_tags,distinguished,author_cakeday
[],,Actuaryba,,,[],,,,text,t2_851qkdvt,False,False,[],"There is a saying that “Hurt people, hurt people”.  Keeping that in mind helps me when I’m being criticized or personally attacked.",,,1619304043,{},gvrb1dp,False,t3_mxtbe3,False,True,t3_mxtbe3,/r/AskReddit/comments/mxtbe3/people_who_let_personal_criticisms_roll_off_their/gvrb1dp/,1619320490,1,True,False,AskReddit,t5_2qh1i,,0,[],,
[],,IIiciclefoxII,,,[],,,,text,t2_8dueaavz,False,False,[],Ill do you one better shiny graveler,,,1619304042,{},gvrb1cz,False,t3_mxlv0f,False,True,t1_gvqpakn,/r/AskReddit/comments/mxlv0f/gamers_of_reddit_what_are_the_most_obnoxious/gvrb1cz/,1619320489,0,True,False,AskReddit,t5_2qh1i,,0,[],,
[],,VoiceofHope2021,,,[],,,,text,t2_b7o5mgir,False,False,[],ooo only $20k look and Mr 1% over here.,,,1619304042,{},gvrb1cr,False,t3_mxnf10,False,True,t1_gvqptg1,/r/AskReddit/comments/mxnf10/what_is_the_most_overrated_product_youve_purchased/gvrb1cr/,1619320489,0,True,False,AskReddit,t5_2qh1i,,0,[],,
[],,beancounter2trucker,,,[],,,,text,t2_55o55cd4,False,False,[],Always wanting the ‘good life’ without ever having to work for it.,,,1619304042,{},gvrb1ce,False,t3_mxuoz1,False,False,t3_mxuoz1,/r/AskReddit/comments/mxuoz1/weve_heard_quites_of_manchildren_what_are_some/gvrb1ce/,1619320489,4,True,False,AskReddit,t5_2qh1i,,0,[],,
[],,detray1,,,[],,,,text,t2_560wxi,False,False,[],Flex Tape,,,1619304042,{},gvrb1bk,False,t3_mxnf10,False,True,t3_mxnf10,/r/AskReddit/comments/mxnf10/what_is_the_most_overrated_product_youve_purchased/gvrb1bk/,1619320489,1,True,False,AskReddit,t5_2qh1i,,0,[],,
[],,ChinUpButtercup4,,,[],,,,text,t2_auson133,False,False,[],They’re very different things,,,1619304042,{},gvrb1bh,False,t3_mxuoz1,False,True,t1_gvrasa6,/r/AskReddit/comments/mxuoz1/weve_heard_quites_of_manchildren_what_are_some/gvrb1bh/,1619320489,1,True,False,AskReddit,t5_2qh1i,,0,[],,
[],,Vprbite,,,[],,,,text,t2_17bugf,False,True,[],"Don't worry, when you get your 40s like me, you learn a few things and get pretty darn good at accepting that you're not good with women. Trust me",,,1619304041,{},gvrb1at,False,t3_mxc8es,False,True,t1_gvqla5x,/r/AskReddit/comments/mxc8es/what_is_the_most_porn_logic_thing_youve_witnessed/gvrb1at/,1619320488,3,True,False,AskReddit,t5_2qh1i,,0,[],,
[],,12altoids34,,,[],,,,text,t2_12p7bh,False,False,[],The fact that an all powerfull diety requires blood sacrifices to forgive . And when he offered his son on the cross what changed? Sin did not disappear. People did not suddenly turn away from sin. In fact nothing noticeable changed.,,,1619304041,{},gvrb1aq,False,t3_mxcycv,False,True,t3_mxcycv,/r/AskReddit/comments/mxcycv/what_are_some_major_plot_holes_in_any_religion/gvrb1aq/,1619320488,1,True,False,AskReddit,t5_2qh1i,,0,[],,
[],,wot_studios,,,[],,,,text,t2_8siw5dsq,False,False,[],Femboys are male,,,1619304041,{},gvrb1ak,False,t3_mxr024,False,True,t1_gvqqojj,/r/AskReddit/comments/mxr024/what_does_it_mean_to_be_a_man_these_days/gvrb1ak/,1619320488,1,True,False,AskReddit,t5_2qh1i,,0,[],,
[],,CookieMelon1010,,,[],,,,text,t2_27ba37gr,False,False,[],It’s a joke. Reddit is entertainment therefore without entert-,,,1619304041,{},gvrb19g,False,t3_mwsttr,False,True,t1_gvr84h1,/r/AskReddit/comments/mwsttr/serious_americans_of_reddit_what_do_you_dislike/gvrb19g/,1619320488,1,True,False,AskReddit,t5_2qh1i,,0,[],,
[],,nmw83,,,[],,,,text,t2_2y5a5sv0,False,False,[],The Michael Kors purse I received as a gift has been through a lot with me and everyone is always surprised that it is still hanging in there.,,,1619304041,{},gvrb18e,False,t3_mxnf10,False,False,t1_gvra1na,/r/AskReddit/comments/mxnf10/what_is_the_most_overrated_product_youve_purchased/gvrb18e/,1619320487,6,True,False,AskReddit,t5_2qh1i,,0,[],,
[],,AllyMerigold,,,[],,,,text,t2_7g8v82gx,False,False,[],Alternative,,,1619304040,{},gvrb180,False,t3_mxuh34,False,True,t3_mxuh34,/r/AskReddit/comments/mxuh34/what_genre_of_music_do_you_listen_to_the_most/gvrb180/,1619320487,2,True,False,AskReddit,t5_2qh1i,,0,[],,
[],,SLCbrunch,,,[],,,,text,t2_pub97ns,False,False,[],"""You're a waste of sperm"" fuck you too pops",,,1619304040,{},gvrb16t,False,t3_mxf4dl,False,True,t3_mxf4dl,/r/AskReddit/comments/mxf4dl/what_is_the_most_toxic_thing_a_parent_can_say_to/gvrb16t/,1619320487,1,True,False,AskReddit,t5_2qh1i,,0,[],,
[],,blessings_to_you,,,[],,,,text,t2_bggyy9i0,False,False,[],Watching TV,,,1619304040,{},gvrb16n,False,t3_mxtfh6,False,True,t3_mxtfh6,/r/AskReddit/comments/mxtfh6/whats_better_at_night/gvrb16n/,1619320487,1,True,False,AskReddit,t5_2qh1i,,0,[],,
[],,Sregor71,,,[],,,,text,t2_21mmw5ty,False,False,[],Network. Join volunteer groups. Make an effort to keep in touch with your friends from college. Start to save money no matter how small the amount.,,,1619304039,{},gvrb14j,False,t3_mxupax,False,True,t3_mxupax,/r/AskReddit/comments/mxupax/what_advice_do_you_have_for_a_recent_college_grad/gvrb14j/,1619320486,3,True,False,AskReddit,t5_2qh1i,,0,[],,
[],,booniebrew,,,[],,,,text,t2_ly0xv,False,False,[],Makes sense. I remember a point where I had to double check that the tools I was buying were the lifetime version.,,,1619304039,{},gvrb14i,False,t3_mxnf10,False,False,t1_gvradzb,/r/AskReddit/comments/mxnf10/what_is_the_most_overrated_product_youve_purchased/gvrb14i/,1619320486,12,True,False,AskReddit,t5_2qh1i,,0,[],,
[],,Dwoodward85,,,[],,,,text,t2_33yk2sxj,False,False,[],My heart to ya. I know how damaging it can be not just when it happens but the battle carries on the rest of your life.,,,1619304039,{},gvrb147,False,t3_mxf4dl,False,True,t1_gvr6x0q,/r/AskReddit/comments/mxf4dl/what_is_the_most_toxic_thing_a_parent_can_say_to/gvrb147/,1619320486,1,True,False,AskReddit,t5_2qh1i,,0,[],,
[],,AutoModerator,,,[],,,,text,t2_6l4z3,False,True,[],"This submission has been automatically removed because you did not include a question mark (""?"") in your title. Reddit does not allow post titles to be edited, so if you would like, you can post the question again.  Please write your title in proper question format, and include a question mark, thank you.

*I am a bot, and this action was performed automatically. Please [contact the moderators of this subreddit](/message/compose/?to=/r/AskReddit) if you have any questions or concerns.*",,,1619304038,{},gvrb134,False,t3_mxuu84,False,True,t3_mxuu84,/r/AskReddit/comments/mxuu84/joshs_of_reddit_what_were_some_of_the_craziest/gvrb134/,1619320485,1,False,False,AskReddit,t5_2qh1i,,0,[],moderator,
[],,ShackintheWood,,,[],,,,text,t2_2szzacjs,False,True,[],"""Hmmmmmmmmmmmgrrrrmmmmmm""...I don't like it...""Hrmmmmmmgrrmmm""...I don't like it at all. ( i paraphrase parts there...)

&amp;#x200B;

and then if it proves to be something he definitely does not like , he braces his four legs, bends down and then throws his head back and ""Abrow-wow-wow-wow-wow!"" to the heavens with all his soul and fiber!  it is really a beautiful thing to watch. ( he is a fifth generation,  purebred Wisconsin Farm Mutt)",,,1619304038,{},gvrb11z,False,t3_mxunys,False,True,t3_mxunys,/r/AskReddit/comments/mxunys/how_would_you_spell_out_your_dogs_bark/gvrb11z/,1619320485,0,True,False,AskReddit,t5_2qh1i,,0,[],,
[],,Iisham,,,[],,,,text,t2_f23gl,False,False,[],"Screenshot:Guy starts a group message with everyone that shares the same name. Something like ""a year from now we all gather here for a fighter, winner keeps the name""",,,1619304037,{},gvrb0zx,False,t3_mxupfj,False,True,t1_gvranp2,/r/AskReddit/comments/mxupfj/what_is_the_whole_josh_fight_event_about/gvrb0zx/,1619320484,2,True,False,AskReddit,t5_2qh1i,,0,[],,
[],,deathandglitter,,,[],,,,text,t2_1bpz3de5,False,False,[],"I second aerie. As a busy lady, their bras are all very comfy. Best stretchy thongs too!",,,1619304037,{},gvrb0zw,False,t3_mxnf10,False,False,t1_gvr9vwg,/r/AskReddit/comments/mxnf10/what_is_the_most_overrated_product_youve_purchased/gvrb0zw/,1619320484,28,True,False,AskReddit,t5_2qh1i,,0,[],,
[],,theycallmebelle,,,[],,,,text,t2_x04b2,False,False,[],Always. Because she knows it's a really mean retort in an argument.,,,1619304037,{},gvrb0z7,False,t3_mxf4dl,False,True,t1_gvr2gyo,/r/AskReddit/comments/mxf4dl/what_is_the_most_toxic_thing_a_parent_can_say_to/gvrb0z7/,1619320483,2,True,False,AskReddit,t5_2qh1i,,0,[],,
[],,Gabadaba08,,,[],,,,text,t2_28dgxqe9,False,False,[],But are those Flex tape/ paste things as good as seen on TV tho?,,,1619304037,{},gvrb0yy,False,t3_mxnf10,False,False,t1_gvr8ndz,/r/AskReddit/comments/mxnf10/what_is_the_most_overrated_product_youve_purchased/gvrb0yy/,1619320483,5,True,False,AskReddit,t5_2qh1i,,0,[],,
[],,ekimlive,,,[],,,,text,t2_1401mn,False,False,[],"My 5th grade teacher offered me an opportunity to be in theater. I should have taken it, I didn't because I was too lazy at the time.",,,1619304036,{},gvrb0xn,False,t3_mxrt0n,False,True,t3_mxrt0n,/r/AskReddit/comments/mxrt0n/if_you_can_redo_one_event_in_your_life_what_would/gvrb0xn/,1619320483,1,True,False,AskReddit,t5_2qh1i,,0,[],,
[],,StlSityStv,,,[],,,,text,t2_5in6x9pm,False,False,[],"Sounds like my ex! I took so much shit from her for years, until I finally realized what was happening. I finally told her we were better to move on separately.  Best decision I ever made, still haven't found the next one that'll make me believe in love again, but happy to have her and her bullshit out of my life!",,,1619304035,{},gvrb0v9,False,t3_mxc8es,False,False,t1_gvopi4j,/r/AskReddit/comments/mxc8es/what_is_the_most_porn_logic_thing_youve_witnessed/gvrb0v9/,1619320482,2,True,False,AskReddit,t5_2qh1i,,0,[],,
[],,duchessbune,,,[],,,,text,t2_761vdzw1,False,True,[],haha love it! 🤗,,,1619304035,{},gvrb0uk,True,t3_mxpkbl,False,False,t1_gvqkkgh,/r/AskReddit/comments/mxpkbl/punctual_ones_what_do_you_think_of_tardy_people/gvrb0uk/,1619320482,1,True,False,AskReddit,t5_2qh1i,,0,[],,
[],,6twoRaptor,,,[],,,,text,t2_b4hqlqyh,False,False,[],I made some money day trading and lost about 3 pounds. That’s about it.,,,1619304035,{},gvrb0ty,False,t3_mxut4r,False,False,t3_mxut4r,/r/AskReddit/comments/mxut4r/whats_the_most_exciting_thing_that_happened_to/gvrb0ty/,1619320481,2,True,False,AskReddit,t5_2qh1i,,0,[],,
[],,Jack_4316,,,[],,,,text,t2_76nt2ev1,False,False,[],Many friends have told me that I'm the smartest person they know (I dont even know why they would say that) but for me it's my best friend. He's the person whose brain I admire the most.,,,1619304034,{},gvrb0sd,False,t3_mxunvn,False,False,t3_mxunvn,/r/AskReddit/comments/mxunvn/whos_the_undiscovered_genius_in_your_life/gvrb0sd/,1619320481,1,True,False,AskReddit,t5_2qh1i,,0,[],,
[],,Lumbergod,,,[],,,,text,t2_11m3ey,False,False,[],"Always, always, slways do what you say you are going to do. Don't be a flake.",,,1619304034,{},gvrb0s9,False,t3_mxla0z,False,False,t3_mxla0z,/r/AskReddit/comments/mxla0z/what_advice_do_you_have_for_an_18_year_old/gvrb0s9/,1619320481,2,True,False,AskReddit,t5_2qh1i,,0,[],,
[],,HybridMomentsAtx,,,[],,,,text,t2_cogtrjt,False,True,[],"Well, I respectfully disagree with you. When I started my digital library, I already knew that there is no assumption of ownership of the movies themselves.  I knew I was getting a license for me, myself, and I. I do not own the 200 movies I have on my digital library. I own the physical DVDs, CDs, and albums I have of bands/movies....those are mine and fully transferable because they are my property.  The digital license is not my property, I’ve merely purchased the right to view the movie when I am logged in as myself to a platform. So therefor, I cannot transfer something that is not my property.",,,1619304034,{},gvrb0r9,False,t3_mxpdi9,False,True,t1_gvr6mns,/r/AskReddit/comments/mxpdi9/what_do_you_think_should_happen_to_online/gvrb0r9/,1619320481,1,True,False,AskReddit,t5_2qh1i,,0,[],,
[],,tujoc,,,[],,,,text,t2_3zn7ljgo,False,False,[],Skin a lamb so that it could be tied onto a different lamb to encourage the dead lamb's mother to feed her.,,,1619304034,{},gvrb0qu,False,t3_mxunqy,False,True,t3_mxunqy,/r/AskReddit/comments/mxunqy/whats_the_most_morbid_thing_youve_ever_had_to_do/gvrb0qu/,1619320481,1,True,False,AskReddit,t5_2qh1i,,0,[],,
[],,Beserked2,,,[],,,,text,t2_ho6mp,False,False,[],A stubborn one? eyelid? or...?,,,1619304033,{},gvrb0pz,False,t3_mxnf10,False,True,t1_gvr2nyi,/r/AskReddit/comments/mxnf10/what_is_the_most_overrated_product_youve_purchased/gvrb0pz/,1619320481,1,True,False,AskReddit,t5_2qh1i,,0,[],,
[],,Alex09464367,,,[],,,,text,t2_8chiqso,False,False,[],I don't care what people I don't know things about me. Or that is what I tell myself.,,,1619304033,{},gvrb0pi,False,t3_mxtbe3,False,True,t3_mxtbe3,/r/AskReddit/comments/mxtbe3/people_who_let_personal_criticisms_roll_off_their/gvrb0pi/,1619320480,1,True,False,AskReddit,t5_2qh1i,,0,[],,
"[{'award_sub_type': 'GLOBAL', 'award_type': 'global', 'awardings_required_to_grant_benefits': None, 'coin_price': 125, 'coin_reward': 0, 'count': 1, 'days_of_drip_extension': 0, 'days_of_premium': 0, 'description': 'When you come across a feel-good thing.', 'end_date': None, 'giver_coin_reward': None, 'icon_format': None, 'icon_height': 2048, 'icon_url': 'https://i.redd.it/award_images/t5_22cerq/5izbv4fn0md41_Wholesome.png', 'icon_width': 2048, 'id': 'award_5f123e3d-4f48-42f4-9c11-e98b566d5897', 'is_enabled': True, 'is_new': False, 'name': 'Wholesome', 'penny_donate': None, 'penny_price': None, 'resized_icons': [{'height': 16, 'url': 'https://preview.redd.it/award_images/t5_22cerq/5izbv4fn0md41_Wholesome.png?width=16&amp;height=16&amp;auto=webp&amp;s=92932f465d58e4c16b12b6eac4ca07d27e3d11c0', 'width': 16}, {'height': 32, 'url': 'https://preview.redd.it/award_images/t5_22cerq/5izbv4fn0md41_Wholesome.png?width=32&amp;height=32&amp;auto=webp&amp;s=d11484a208d68a318bf9d4fcf371171a1cb6a7ef', 'width': 32}, {'height': 48, 'url': 'https://preview.redd.it/award_images/t5_22cerq/5izbv4fn0md41_Wholesome.png?width=48&amp;height=48&amp;auto=webp&amp;s=febdf28b6f39f7da7eb1365325b85e0bb49a9f63', 'width': 48}, {'height': 64, 'url': 'https://preview.redd.it/award_images/t5_22cerq/5izbv4fn0md41_Wholesome.png?width=64&amp;height=64&amp;auto=webp&amp;s=b4406a2d88bf86fa3dc8a45aacf7e0c7bdccc4fb', 'width': 64}, {'height': 128, 'url': 'https://preview.redd.it/award_images/t5_22cerq/5izbv4fn0md41_Wholesome.png?width=128&amp;height=128&amp;auto=webp&amp;s=19555b13e3e196b62eeb9160d1ac1d1b372dcb0b', 'width': 128}], 'resized_static_icons': [{'height': 16, 'url': 'https://preview.redd.it/award_images/t5_22cerq/5izbv4fn0md41_Wholesome.png?width=16&amp;height=16&amp;auto=webp&amp;s=92932f465d58e4c16b12b6eac4ca07d27e3d11c0', 'width': 16}, {'height': 32, 'url': 'https://preview.redd.it/award_images/t5_22cerq/5izbv4fn0md41_Wholesome.png?width=32&amp;height=32&amp;auto=webp&amp;s=d11484a208d68a318bf9d4fcf371171a1cb6a7ef', 'width': 32}, {'height': 48, 'url': 'https://preview.redd.it/award_images/t5_22cerq/5izbv4fn0md41_Wholesome.png?width=48&amp;height=48&amp;auto=webp&amp;s=febdf28b6f39f7da7eb1365325b85e0bb49a9f63', 'width': 48}, {'height': 64, 'url': 'https://preview.redd.it/award_images/t5_22cerq/5izbv4fn0md41_Wholesome.png?width=64&amp;height=64&amp;auto=webp&amp;s=b4406a2d88bf86fa3dc8a45aacf7e0c7bdccc4fb', 'width': 64}, {'height': 128, 'url': 'https://preview.redd.it/award_images/t5_22cerq/5izbv4fn0md41_Wholesome.png?width=128&amp;height=128&amp;auto=webp&amp;s=19555b13e3e196b62eeb9160d1ac1d1b372dcb0b', 'width': 128}], 'start_date': None, 'static_icon_height': 2048, 'static_icon_url': 'https://i.redd.it/award_images/t5_22cerq/5izbv4fn0md41_Wholesome.png', 'static_icon_width': 2048, 'subreddit_coin_reward': 0, 'subreddit_id': None, 'tiers_by_required_awardings': None}]",,maltymawma,,,[],,,,text,t2_4pi4lqj1,False,False,[],Oh god I wore them once for an event and I threw those bitches away immediately after. It was a huge waste of money. I would have been better off just not wearing any kind of bra.,,,1619304033,{},gvrb0pc,False,t3_mxnf10,False,False,t1_gvr7laz,/r/AskReddit/comments/mxnf10/what_is_the_most_overrated_product_youve_purchased/gvrb0pc/,1619320480,1890,True,False,AskReddit,t5_2qh1i,,1,[],,
[],,Shadow_strife,,,[],,,,text,t2_4pzkkesg,False,False,[],"Plastic Warhammer products, for the pile of shame.",,,1619304033,{},gvrb0p9,False,t3_mxnf10,False,True,t3_mxnf10,/r/AskReddit/comments/mxnf10/what_is_the_most_overrated_product_youve_purchased/gvrb0p9/,1619320480,1,True,False,AskReddit,t5_2qh1i,,0,[],,
[],,bigbluebridge,,,[],,,,text,t2_7ahbxajj,False,False,[],"""I only got pregnant with you to spite your father.  It took me until you were about 3 for me to realize that I didn't hate you.""

(context: my sister was a frequently extremely ill baby, and my mom was certain I would be too)",,,1619304033,{},gvrb0o8,False,t3_mxf4dl,False,True,t3_mxf4dl,/r/AskReddit/comments/mxf4dl/what_is_the_most_toxic_thing_a_parent_can_say_to/gvrb0o8/,1619320480,1,True,False,AskReddit,t5_2qh1i,,0,[],,
[],,abcdeezntz123,,,[],,,,text,t2_nswsuv6,False,False,[],"Which schools. Since middle school I have done critical thinking in class, especially in history and english",,,1619304032,{},gvrb0ng,False,t3_mxk1u8,False,False,t1_gvr4u6u,/r/AskReddit/comments/mxk1u8/what_skill_is_definitely_worth_learning/gvrb0ng/,1619320479,4,True,False,AskReddit,t5_2qh1i,,0,[],,
[],,JohnOnWheels,,,[],,,,text,t2_p9kddfz,False,False,[],"Nothing really, parties always act silly.",,,1619304032,{},gvrb0na,False,t3_mxurhg,False,True,t3_mxurhg,/r/AskReddit/comments/mxurhg/republicans_of_reddit_what_is_your_thoughts_on/gvrb0na/,1619320479,-2,True,False,AskReddit,t5_2qh1i,,0,[],,
[],,iamfrank75,,,[],,,,text,t2_lnyiz79,False,False,[],"I’m a conservative and disagreed with most of her opinions, but I respected the hell out of her.",,,1619304032,{},gvrb0mf,False,t3_mxnf10,False,True,t1_gvqz95w,/r/AskReddit/comments/mxnf10/what_is_the_most_overrated_product_youve_purchased/gvrb0mf/,1619320479,3,True,False,AskReddit,t5_2qh1i,,0,[],,
[],,Stan87,,,[],,,,text,t2_ldwq0,False,True,[],At 10 am,,,1619304032,{},gvrb0m1,False,t3_mxussn,False,True,t3_mxussn,/r/AskReddit/comments/mxussn/when_did_you_peak/gvrb0m1/,1619320479,2,True,False,AskReddit,t5_2qh1i,,0,[],,
[],,pineapple_calzone,,,[],,,,text,t2_74jpgt3h,False,False,[],"Well whatever you do, don't buy a shark robot. The bumpers are held out with these god awful leaf springs, genuinely just a piece of stamped 15 thou mild steel. Not spring steel. After a couple months it'll just start backing up in circles and giving up. Had to take the bumper off and rebend the leaves, next time I'm just going to forge a better spring out of some old belt tensioner spring steel. Other than that it's a pretty good robot. Sure loves to hump my scale though.",,,1619304031,{},gvrb0lp,False,t3_mxnf10,False,True,t1_gvqoxes,/r/AskReddit/comments/mxnf10/what_is_the_most_overrated_product_youve_purchased/gvrb0lp/,1619320479,1,True,False,AskReddit,t5_2qh1i,,0,[],,
[],,[deleted],,,,,,dark,,,,,[],[deleted],,,1619304031,{},gvrb0ln,False,t3_mxnf10,False,True,t1_gvr33wd,/r/AskReddit/comments/mxnf10/what_is_the_most_overrated_product_youve_purchased/gvrb0ln/,1619320479,1,True,False,AskReddit,t5_2qh1i,,0,[],,
[],,AmericanScream,,,[],,,,text,t2_4nes4,False,False,[],"&gt; You can't seem to wheigh out booth sides of the topic. You're all negative.

What are you saying?  That just because I am not saying something positive about crypto that means I'm not being honest or truthful? 

If anything I've said is technically wrong, and you have evidence to prove it, please do so.  But just because I'm critical **and I'm willing to back up my arguments with evidence** does not mean I'm a ""hater.""

&gt;A lot of cryptos are backed by projects like Chiliz for example, that makes them similar stocks in terms of predictability just not for companies but like said, for projects

I don't see where that has any bearing in anything I've said.  You seem to be arguing something different from what I am saying.",,,1619304031,{},gvrb0li,False,t3_mw2api,False,True,t1_gvr2rif,/r/AskReddit/comments/mw2api/what_do_you_genuinely_not_understand/gvrb0li/,1619320479,-1,True,False,AskReddit,t5_2qh1i,,0,[],,
[],,Squishys_Girl,,,[],,,,text,t2_9ijcmukt,False,False,[],"""THE SHERIFF IS A N- *BONG*""",,,1619304031,{},gvrb0jy,False,t3_mxo8n2,False,False,t1_gvq8noj,/r/AskReddit/comments/mxo8n2/whats_the_funniest_movie_youve_ever_seen/gvrb0jy/,1619320478,9,True,False,AskReddit,t5_2qh1i,,0,[],,
[],,mooooddude,,,[],,,,text,t2_45gdhj37,False,False,[],Windows 10,,,1619304030,{},gvrb0hw,False,t3_mxnf10,False,True,t3_mxnf10,/r/AskReddit/comments/mxnf10/what_is_the_most_overrated_product_youve_purchased/gvrb0hw/,1619320477,2,True,False,AskReddit,t5_2qh1i,,0,[],,
[],,Fafnir13,,,[],,,,text,t2_10z09r,False,False,[],"I’m imagining the can opener being used like a hammer, just bashing the can until it’s been broken enough for food to pour out.",,,1619304030,{},gvrb0hv,False,t3_mxnf10,False,True,t1_gvr280m,/r/AskReddit/comments/mxnf10/what_is_the_most_overrated_product_youve_purchased/gvrb0hv/,1619320477,2,True,False,AskReddit,t5_2qh1i,,0,[],,
[],,AutoModerator,,,[],,,,text,t2_6l4z3,False,True,[],"**PLEASE READ THIS MESSAGE IN ITS ENTIRETY BEFORE TAKING ACTION.**

Hi there, your post has been removed for one of the following reasons: 

* [Rule 3:](https://www.reddit.com/r/AskReddit/wiki/index#wiki_-rule_3-) You must phrase the question to require more of an explanation than just ""yes"" or ""no"".  You may want to try to post your question in /r/polls.

* [Rule 3:](https://www.reddit.com/r/AskReddit/wiki/index#wiki_-rule_3-) Questions with a single correct answer, that can be researched elsewhere are not allowed on AskReddit.

* [Rule 1:](http://www.reddit.com/r/AskReddit/wiki/index#wiki_-rule_1-) You must post a clear and direct question in the title.  *The question must be a full sentence*.  Try including question phrases like ""What is..."", ""What are..."".

*I am a bot, and this action was performed automatically. Please [contact the moderators of this subreddit](/message/compose/?to=/r/AskReddit) if you have any questions or concerns.*",,,1619304030,{},gvrb0he,False,t3_mxuu4o,False,True,t3_mxuu4o,/r/AskReddit/comments/mxuu4o/do_you_put_your_phone_in_the_left_or_right_pocket/gvrb0he/,1619320477,1,False,False,AskReddit,t5_2qh1i,,0,[],moderator,
[],,wot_studios,,,[],,,,text,t2_8siw5dsq,False,False,[],Bruh,,,1619304029,{},gvrb0fy,False,t3_mxr024,False,True,t1_gvqqojj,/r/AskReddit/comments/mxr024/what_does_it_mean_to_be_a_man_these_days/gvrb0fy/,1619320476,1,True,False,AskReddit,t5_2qh1i,,0,[],,
[],,HawkCommercial4133,,,[],,,,text,t2_avk6bomd,False,False,[],Meatloaf....mash tatters...and some of tha' corn bread ya Mrs makes,,,1619304029,{},gvrb0fa,False,t3_mxtrxd,False,True,t3_mxtrxd,/r/AskReddit/comments/mxtrxd/40_year_from_today_after_35_years_sitting_on/gvrb0fa/,1619320476,1,True,False,AskReddit,t5_2qh1i,,0,[],,
[],,Sweet_Persimmon6375,,,[],,,,text,t2_blr0rttv,False,False,[],In COD,,,1619304029,{},gvrb0dz,False,t3_mxuszw,False,True,t3_mxuszw,/r/AskReddit/comments/mxuszw/what_is_the_worst_fight_youve_gotten_in_with_a/gvrb0dz/,1619320475,1,True,False,AskReddit,t5_2qh1i,,0,[],,
[],,wulfpacker1,,,[],,,,text,t2_15bpau,False,False,[],"Yes. That, and cooks just keep adding stuff to it. The pan can go for extended periods of time without ever being washed.",,,1619304028,{},gvrb0dv,False,t3_mxqfb1,False,True,t1_gvr0l3q,/r/AskReddit/comments/mxqfb1/fastfood_workers_of_reddit_what_menu_items_should/gvrb0dv/,1619320475,3,True,False,AskReddit,t5_2qh1i,,0,[],,
[],,forest_bark,,,[],,,,text,t2_5t2ardhq,False,False,[],My dad is a physician. He had to explain to a woman that spermicide doesn't work if you eat it. She was spreading it on toast or something and thought that would prevent pregnancy.,,,1619304028,{},gvrb0d6,False,t3_mxuslx,False,True,t3_mxuslx,/r/AskReddit/comments/mxuslx/doctors_of_reddit_whats_the_simplest_thing_youve/gvrb0d6/,1619320475,1,True,False,AskReddit,t5_2qh1i,,0,[],,
[],,Aggravating_Egg_7189,,,[],,,,text,t2_7r3q6www,False,False,[],"Well nothing, I already accomplished my goal",,,1619304028,{},gvrb0cs,False,t3_mxuizh,False,True,t3_mxuizh,/r/AskReddit/comments/mxuizh/what_to_do_if_you_make_someone_cry/gvrb0cs/,1619320475,1,True,False,AskReddit,t5_2qh1i,,0,[],,
[],,Xstone1122,,,[],,,,text,t2_998defhf,False,False,[],I don't lol is kinda of a conversation ender,,,1619304027,{},gvrb0bd,False,t3_mxusy7,False,False,t3_mxusy7,/r/AskReddit/comments/mxusy7/how_do_you_respond_to_lol/gvrb0bd/,1619320474,4,True,False,AskReddit,t5_2qh1i,,0,[],,
[],,Asap_lucky69,,,[],,,,text,t2_9bhyfypj,False,False,[],“That’s why nobody loves you”,,,1619304027,{},gvrb09s,False,t3_mxuqsi,False,True,t3_mxuqsi,/r/AskReddit/comments/mxuqsi/what_is_the_worse_thing_someone_have_ever_said_to/gvrb09s/,1619320474,3,True,False,AskReddit,t5_2qh1i,,0,[],,
[],,Realistic_South9931,,,[],,,,text,t2_5hjj5yjx,False,False,[],"no, i'm too poor",,,1619304027,{},gvrb09r,False,t3_mxnf10,False,True,t1_gvrawx1,/r/AskReddit/comments/mxnf10/what_is_the_most_overrated_product_youve_purchased/gvrb09r/,1619320474,1,True,False,AskReddit,t5_2qh1i,,0,[],,
[],,mocheese5,,,[],,,,text,t2_3bbuc0na,False,False,[],"If thats the whole message, then just don't respond. They obviously don't care enough to say anything of substance",,,1619304026,{},gvrb07s,False,t3_mxusy7,False,True,t3_mxusy7,/r/AskReddit/comments/mxusy7/how_do_you_respond_to_lol/gvrb07s/,1619320473,3,True,False,AskReddit,t5_2qh1i,,0,[],,
