all_awardings,associated_award,author,author_flair_background_color,author_flair_css_class,author_flair_richtext,author_flair_template_id,author_flair_text,author_flair_text_color,author_flair_type,author_fullname,author_patreon_flair,author_premium,awarders,body,collapsed_because_crowd_control,comment_type,created_utc,gildings,id,is_submitter,link_id,locked,no_follow,parent_id,permalink,retrieved_on,score,send_replies,stickied,subreddit,subreddit_id,top_awarded_type,total_awards_received,treatment_tags,author_cakeday,distinguished
[],,digitalwriternow,,,[],,,,text,t2_4t2cqpe4,False,False,[],What does bhk mean?,,,1619263053,{},gvoaz73,False,t3_mx2ljw,False,True,t1_gvllshy,/r/AMA/comments/mx2ljw/i_work_in_a_bank_in_rural_india_ama/gvoaz73/,1619269220,1,True,False,AMA,t5_2r4eo,,0,[],,
[],,heatedundercarriage,,,[],,,,text,t2_76t22,False,False,[],"Pornography for young men is easily captivating, and nearly ruined my drive as a young man. From 18-22, there were a couple of encounters that I couldn’t get hard for, and looking back I know it’s because I was conditioned to hardcore images, and the tight grip of my own hand.
Pornography is an epidemic for young men that not many are talking about. 
Never in history have we all this access to so many hardcore videos. 
I realized how porn was impacting my life, and how missed out on a few experiences, so reframed and was abstinent for 120 days. Reset my mind, and to this day I keep it in check",,,1619263021,{},gvoavzk,False,t3_mxan9q,False,False,t1_gvn6lq0,/r/AMA/comments/mxan9q/im_a_sex_education_teacher_and_i_know_you_all/gvoavzk/,1619269186,7,True,False,AMA,t5_2r4eo,,0,[],,
[],,rihon31042,,,[],,,,text,t2_bju1fjtq,False,False,[],"It sounds like a very reasonable decision on your end. Doesn't help the bad aftertaste and negative immediate feelings though,  I know. But it still sounds like something you will be looking back to in a few years without regret.",,,1619263013,{},gvoav49,False,t3_mxcv7c,False,False,t1_gvnirfz,/r/AMA/comments/mxcv7c/i_just_broke_up_with_my_partner_but_feel_like/gvoav49/,1619269178,2,True,False,AMA,t5_2r4eo,,0,[],,
[],,alleycatt_101,,,[],,,,text,t2_17a0yr,False,False,[],Check out r/agegaprelationship,,,1619263001,{},gvoatwy,False,t3_mxhqu0,False,False,t3_mxhqu0,/r/AMA/comments/mxhqu0/is_this_age_gap_weird/gvoatwy/,1619269166,2,True,False,AMA,t5_2r4eo,,0,[],,
[],,Analoghogdog,,,[],,,,text,t2_51mqad4i,False,False,[],"I have no starting capital and no business idea, but i love money. What can ya do for me?",,,1619262928,{},gvoamh2,False,t3_mxbyi2,False,True,t3_mxbyi2,/r/AMA/comments/mxbyi2/im_an_mba_give_me_your_business_problem_and_ill/gvoamh2/,1619269093,1,True,False,AMA,t5_2r4eo,,0,[],,
[],,peeleee,,,[],,,,text,t2_4wy0bo4e,False,False,[],"Young gay boy here; if I want to fuck, do I need condoms and what kinds of preparations are necessary?",,,1619262877,{},gvoahj9,False,t3_mxan9q,False,True,t3_mxan9q,/r/AMA/comments/mxan9q/im_a_sex_education_teacher_and_i_know_you_all/gvoahj9/,1619269042,1,True,False,AMA,t5_2r4eo,,0,[],,
[],,morifreaks,,,[],,,,text,t2_21czs3ks,False,False,[],"Woah, congrats, that must be so interesting! And thank you for your wishes~

As to what I’d prefer, I don’t think I’ll ever have enough skill to join the companies you listed, but I would want to work with a relatively small team, where everyone is passionate about what they’re doing :3",,,1619262863,{},gvoag0m,True,t3_mxg3r4,False,False,t1_gvo0jj3,/r/AMA/comments/mxg3r4/i_got_rejected_by_my_dream_college_twice_in_a_row/gvoag0m/,1619269028,2,True,False,AMA,t5_2r4eo,,0,[],,
[],,Phat-et-ic,,,[],,,,text,t2_39bwvvp2,False,False,[],"Fingers is absolutely fine for most women. Ofcourse it's not the same as a penis, but remember that's what most of us do to masturbate - it's nice. (: Also oral, but depending on where you came lol. Or you can do these things /before/ you stick your dick in. That's how my partner and I go about it a lot of the time. That's good bc it also gets you wet and sensitive (and like said it doesn't go away after you come) + you know your partner is also still aroused/getting hard/into it rather than doing it out of some duty to ""also"" give you something. At least that's something I worry about sometimes and worrying is what will particularly make you not come. 

Last resort &amp; if she's comfortable with it, you can also ask her if she wants to finish herself/masturbate after you've come and are tired. But make it a loving and safe experience. Don't just be like ok whatever you just finish yourself, but like hold her/kiss her/touch her/whisper sexy or funny things in her ear, whatever. We actually both do this sometimes. My partner can't always come from penetration or oral or anything either. And sometimes we're both just tired but horny.

And lastly I just realised I wrote about coming a lot but for some people that's an issue and that should not mean they don't like getting the time of day. It should never be the main goal. The main goal is to make them feel nice, and wherever that gets them is fine.",,,1619262831,{},gvoacft,False,t3_mxan9q,False,True,t1_gvo1rb5,/r/AMA/comments/mxan9q/im_a_sex_education_teacher_and_i_know_you_all/gvoacft/,1619268994,1,True,False,AMA,t5_2r4eo,,0,[],,
[],,bealilshellfish,,,[],,,,text,t2_4xj378mp,False,False,[],"Thank you for doing this, Ive spent some time in LA and saw how busy you guys are compared to other departments, thank you for your 11 years of service.  

What are the details behind your reason to leave?  If not comfortable sharing due to potentially doxxing yourself or unpopular political takeaways on reddit, feel free to PM me.

In a city of over 14 million, and less than 50k officers, do you feel you were adequately equipped for whatever situations occured during a shift?

In the current political climate, do you feel this has caused a decline in overly qualified applications, and resulted in the hiring of less qualified applicants?

In your experience, were new-hires with a college degree better officers?  If so, do you think it should be a requirement?

In your experience, do you feel bodycams are a hinderence to your day-to-day work, or do you feel the keep the borderline cops in line?  What is your personal opinion on civilian oversight of officer involved shootings?

In regards to training, do you feel the initial training and follow-on training prepares you for the vast situations you might encounter in such a large metropolitan city?  If inadequate, I'd be curious as to what your recommendations are.

Lastly, with regard to your personal mental health and that of your fellow officers, do you feel the work environment is supportive of seeking a therapist, and/or do they provide one?  I can only imagine the stresses of your day-to-day as a LEO, death, murder, rape, child crimes, that stuff has to get to you.

Im current military considering a career with the FBI after this tour, and while I know Federal vastly differs from local LE, I want to be able to make that transition with open eyes and as informed as possible.",,,1619262804,{},gvoa9z3,False,t3_mxhl69,False,True,t3_mxhl69,/r/AMA/comments/mxhl69/i_resigned_from_lapd_this_week_after_11_years_of/gvoa9z3/,1619268968,1,True,False,AMA,t5_2r4eo,,0,[],,
[],,Alarmed_Package8495,,,[],,,,text,t2_bqfbiyoe,False,False,[],Was on for over 10 years and the job I accepted pays very well and is behind a desk.,,,1619262793,{},gvoa93f,True,t3_mxhl69,False,True,t1_gvo9kxr,/r/AMA/comments/mxhl69/i_resigned_from_lapd_this_week_after_11_years_of/gvoa93f/,1619268959,2,True,False,AMA,t5_2r4eo,,0,[],,
[],,MissusWeaver,,,[],,,,text,t2_96fgp18n,False,False,[],"I mean, yeah she is Indian American. But, she isn't Indian in the cultural sense(nothing wrong about it).",,,1619262773,{},gvoa70d,False,t3_mv9iv6,False,False,t1_gvo9x74,/r/AMA/comments/mv9iv6/i_am_an_indian_ama/gvoa70d/,1619268939,1,True,False,AMA,t5_2r4eo,,0,[],,
[],,rihon31042,,,[],,,,text,t2_bju1fjtq,False,False,[],2 friends is ok as long as they are good friends. Veah and Meesh are interesting names. Where are you from?,,,1619262718,{},gvoa20c,False,t3_mxdb7g,False,False,t1_gvnnmsu,/r/AMA/comments/mxdb7g/i_just_turned_16_ama/gvoa20c/,1619268886,1,True,False,AMA,t5_2r4eo,,0,[],,
[],,Analoghogdog,,,[],,,,text,t2_51mqad4i,False,False,[],"
How'd you meet the hooker?",,,1619262687,{},gvo9z2f,False,t3_mxf91v,False,True,t1_gvnu918,/r/AMA/comments/mxf91v/i_paid_an_escort_100_and_she_left_and_her/gvo9z2f/,1619268854,1,True,False,AMA,t5_2r4eo,,0,[],,
[],,throwaway2991997,,,[],,,,text,t2_4i5ii6f1,False,False,[],That doesn’t take away her indian roots. Its shocking how quick indians are willing to write her off.,,,1619262667,{},gvo9x74,False,t3_mv9iv6,False,True,t1_gvngx7h,/r/AMA/comments/mv9iv6/i_am_an_indian_ama/gvo9x74/,1619268835,1,True,False,AMA,t5_2r4eo,,0,[],,
[],,theQueerExtrovert,,,[],,,,text,t2_b4pc6efz,False,False,[],"ah, then i really dont know how it works with women lmao",,,1619262571,{},gvo9nu3,True,t3_mxai2y,False,True,t1_gvo0935,/r/AMA/comments/mxai2y/i_am_a_bisexual_top_ama/gvo9nu3/,1619268742,1,True,False,AMA,t5_2r4eo,,0,[],,
[],,throwawayonumber3101,,,[],,,,text,t2_8e6tokih,False,False,[],Exactly !,,,1619262552,{},gvo9lyf,False,t3_mxan9q,False,True,t1_gvo5dam,/r/AMA/comments/mxan9q/im_a_sex_education_teacher_and_i_know_you_all/gvo9lyf/,1619268723,3,True,False,AMA,t5_2r4eo,,0,[],,
[],,digitalwriternow,,,[],,,,text,t2_4t2cqpe4,False,False,[],"And don't you think this is positive for the economy, this digital adoption?",,,1619262552,{},gvo9lx7,False,t3_mx2ljw,False,False,t1_gvo7glp,/r/AMA/comments/mx2ljw/i_work_in_a_bank_in_rural_india_ama/gvo9lx7/,1619268722,1,True,False,AMA,t5_2r4eo,,0,[],,
[],,thizzy85,,,[],,,,text,t2_4tvpf,False,False,[],"How long were you Jonny law usually it only takes 5 years to be vested?

So why not get you a real job that takes care of you? Go into the trades... union specifically, get benefits get a set wage and a skill",,,1619262542,{},gvo9kxr,False,t3_mxhl69,False,False,t1_gvo8ov1,/r/AMA/comments/mxhl69/i_resigned_from_lapd_this_week_after_11_years_of/gvo9kxr/,1619268713,1,True,False,AMA,t5_2r4eo,,0,[],,
[],,theQueerExtrovert,,,[],,,,text,t2_b4pc6efz,False,False,[],i dont really  have differing standards,,,1619262510,{},gvo9hnd,True,t3_mxai2y,False,False,t1_gvo7bwr,/r/AMA/comments/mxai2y/i_am_a_bisexual_top_ama/gvo9hnd/,1619268680,1,True,False,AMA,t5_2r4eo,,0,[],,
[],,THroWWWayNumber5,,,[],,,,text,t2_7bkhw4cz,False,False,[],How should/Should one clean themselves after sexual intercourse?,,,1619262506,{},gvo9had,False,t3_mxan9q,False,False,t3_mxan9q,/r/AMA/comments/mxan9q/im_a_sex_education_teacher_and_i_know_you_all/gvo9had/,1619268677,1,True,False,AMA,t5_2r4eo,,0,[],,
[],,Jack_Ingoff123,,,[],,,,text,t2_8terafuy,False,False,[],\*sweating prefusely\*,,,1619262471,{},gvo9dqe,True,t3_mxeokv,False,True,t1_gvnupo9,/r/AMA/comments/mxeokv/my_greatgrandpa_was_a_teacher_during_nazi_germany/gvo9dqe/,1619268640,3,True,False,AMA,t5_2r4eo,,0,[],,
[],,Jack_Ingoff123,,,[],,,,text,t2_8terafuy,False,False,[],"He taught that people with blonde hair and blue eyes were scientifically proven to be stronger and overall 'better.' I was also told that he was forced to teach maths in a really specific way, not like we're used to now. For example instead of the question 'Jimmy had 3 apples, Robert added 2, how many apples did Jimmy have?' It was '4 german tanks are calling out for backup, 6 more german tanks come, how many tanks are there now?' etc. Boys were made and built for war. Girls were built and made to make babies and care for their men. 

He was forced to make the Jewish kids sit on a separate table, before they were all moved to all an Jewish school. Some genuine Nazi teachers made some Jewish kids stand up and go to the front, just so they could point out the flaws of the 'lesser than 'race. My great-grandpa didn't do that though, thankfully.",,,1619262397,{},gvo963d,True,t3_mxeokv,False,False,t1_gvnrzsg,/r/AMA/comments/mxeokv/my_greatgrandpa_was_a_teacher_during_nazi_germany/gvo963d/,1619268561,3,True,False,AMA,t5_2r4eo,,0,[],,
[],,quddusgordon,,,[],,,,text,t2_2n4jcqzm,False,False,[],"Nah I'd say that's completely normal. You're both above 18 and if it works out you'll be 37 and he'll be 34, which really feels like nothing right?",,,1619262388,{},gvo953u,False,t3_mxhqu0,False,False,t3_mxhqu0,/r/AMA/comments/mxhqu0/is_this_age_gap_weird/gvo953u/,1619268551,2,True,False,AMA,t5_2r4eo,,0,[],,
[],,freakyman12300,,,[],,,,text,t2_a5dqfhpp,False,False,[],Mot really,,,1619262378,{},gvo942p,False,t3_mxhqu0,False,False,t3_mxhqu0,/r/AMA/comments/mxhqu0/is_this_age_gap_weird/gvo942p/,1619268540,1,True,False,AMA,t5_2r4eo,,0,[],,
[],,Problematic_Luke,,,[],,,,text,t2_7ylpi3r3,False,False,[],Can you say what you are personally more successful then introverts and ambiverts in everage?,,,1619262349,{},gvo913f,False,t3_mxh8no,False,True,t3_mxh8no,/r/AMA/comments/mxh8no/im_an_extrovert_ama/gvo913f/,1619268511,1,True,False,AMA,t5_2r4eo,,0,[],,
[],,Bigger_balls_than_u,,,[],,,,text,t2_70u22kd4,False,False,[],"This isn't the right sub for that

Btw I don't think that gap is that much of a problem",,,1619262346,{},gvo90u6,False,t3_mxhqu0,False,False,t3_mxhqu0,/r/AMA/comments/mxhqu0/is_this_age_gap_weird/gvo90u6/,1619268509,6,True,False,AMA,t5_2r4eo,,0,[],,
[],,Unfair_Shelter_5713,,,[],,,,text,t2_93c499br,False,False,[],"i got on reddit, learned piano And talked with my friends on discord everyday",,,1619262305,{},gvo8wq1,True,t3_mxh8no,False,False,t1_gvo8mlg,/r/AMA/comments/mxh8no/im_an_extrovert_ama/gvo8wq1/,1619268466,1,True,False,AMA,t5_2r4eo,,0,[],,
[],,Strueb14,,,[],,,,text,t2_8k784pp3,False,False,[],Do you analyze everyone you meet?,,,1619262239,{},gvo8q3b,False,t3_mxa6ix,False,False,t3_mxa6ix,/r/AMA/comments/mxa6ix/im_a_licensed_psychiatrist_ama/gvo8q3b/,1619268401,1,True,False,AMA,t5_2r4eo,,0,[],,
[],,Alarmed_Package8495,,,[],,,,text,t2_bqfbiyoe,False,False,[],"God no, but I'm in my late 30s.",,,1619262226,{},gvo8ov1,True,t3_mxhl69,False,False,t1_gvo8cp5,/r/AMA/comments/mxhl69/i_resigned_from_lapd_this_week_after_11_years_of/gvo8ov1/,1619268389,4,True,False,AMA,t5_2r4eo,,0,[],,
[],,Problematic_Luke,,,[],,,,text,t2_7ylpi3r3,False,False,[],What did you do to have fun during isolation instead of meeting people?,,,1619262203,{},gvo8mlg,False,t3_mxh8no,False,False,t1_gvo6k4u,/r/AMA/comments/mxh8no/im_an_extrovert_ama/gvo8mlg/,1619268368,1,True,False,AMA,t5_2r4eo,,0,[],,
[],,BabesPapes,,,[],,,,text,t2_16ahuh,False,False,[],Are you a virgin?,,,1619262193,{},gvo8lm9,False,t3_mxan9q,False,False,t3_mxan9q,/r/AMA/comments/mxan9q/im_a_sex_education_teacher_and_i_know_you_all/gvo8lm9/,1619268357,1,True,False,AMA,t5_2r4eo,,0,[],,
[],,AlternativeExcuse291,,,[],,,,text,t2_bqfhl2ic,False,False,[],"So this is kinda akward but, i'm fifteen and the back of my foreskin is attached to like the tip of my dick which prevents it from going all the way down when erected, is this normal and will i still be able to have sex? And when i look for aswers on google or something i just cant find any good answers that apply to my situation.",,,1619262150,{},gvo8h9s,False,t3_mxan9q,False,False,t3_mxan9q,/r/AMA/comments/mxan9q/im_a_sex_education_teacher_and_i_know_you_all/gvo8h9s/,1619268314,1,True,False,AMA,t5_2r4eo,,0,[],,
[],,thizzy85,,,[],,,,text,t2_4tvpf,False,False,[],You do enough time with LAPD to be vested and get a pension?,,,1619262102,{},gvo8cp5,False,t3_mxhl69,False,False,t1_gvo7y3e,/r/AMA/comments/mxhl69/i_resigned_from_lapd_this_week_after_11_years_of/gvo8cp5/,1619268269,2,True,False,AMA,t5_2r4eo,,0,[],,
[],,Alarmed_Package8495,,,[],,,,text,t2_bqfbiyoe,False,False,[],"Truthfully, like 50% of the people I work with should not be cops. However, there are a lot of bad people out there. I was split between the division that handles sex offenders and patrol.",,,1619262086,{},gvo8b8m,True,t3_mxhl69,False,False,t1_gvo7i93,/r/AMA/comments/mxhl69/i_resigned_from_lapd_this_week_after_11_years_of/gvo8b8m/,1619268254,4,True,False,AMA,t5_2r4eo,,0,[],,
[],,Alarmed_Package8495,,,[],,,,text,t2_bqfbiyoe,False,False,[],That and others. The job is not what it was a few years ago.,,,1619262006,{},gvo83bl,True,t3_mxhl69,False,True,t1_gvo7dlq,/r/AMA/comments/mxhl69/i_resigned_from_lapd_this_week_after_11_years_of/gvo83bl/,1619268177,2,True,False,AMA,t5_2r4eo,,0,[],,
[],,Alarmed_Package8495,,,[],,,,text,t2_bqfbiyoe,False,False,[],"I took a job as an executive assistant with a large financial firm. Basically, I'm now a glorified secretary.",,,1619261953,{},gvo7y3e,True,t3_mxhl69,False,False,t1_gvo787q,/r/AMA/comments/mxhl69/i_resigned_from_lapd_this_week_after_11_years_of/gvo7y3e/,1619268124,5,True,False,AMA,t5_2r4eo,,0,[],,
[],,bayan963,,,[],,,,text,t2_27pdee6c,False,False,[],"Wa alaykum assalam :)
It's going well al hamdullah, but I feel like it's moving really fast! 

How is yours going?",,,1619261943,{},gvo7x2r,True,t3_mx9hdk,False,True,t1_gvnf2xq,/r/AMA/comments/mx9hdk/im_a_religious_muslim_female_and_an_arab_ama/gvo7x2r/,1619268115,1,True,False,AMA,t5_2r4eo,,0,[],,
[],,cnnispoison,,,[],,,,text,t2_a2s93r0p,False,False,[],How can it be a knife fight when only one person has a knife?,,,1619261883,{},gvo7r4h,False,t3_mxdvni,False,False,t3_mxdvni,/r/AMA/comments/mxdvni/i_never_been_in_a_knife_fight_ama/gvo7r4h/,1619268057,1,True,False,AMA,t5_2r4eo,,0,[],,
[],,Jinchuuriikiii,,,[],,,,text,t2_2erpx5nh,False,False,[],Do you think ACAB or was there actually nice people on the force with you?,,,1619261783,{},gvo7i93,False,t3_mxhl69,False,True,t3_mxhl69,/r/AMA/comments/mxhl69/i_resigned_from_lapd_this_week_after_11_years_of/gvo7i93/,1619267966,2,True,False,AMA,t5_2r4eo,,0,[],,
[],,Lazy-Guidance1910,,,[],,,,text,t2_a5jmk0fp,False,False,[],Yes. Digital Transactions  increased that time. Today digital transaction have overtaken cash transactions.,,,1619261761,{},gvo7glp,True,t3_mx2ljw,False,True,t1_gvo5re5,/r/AMA/comments/mx2ljw/i_work_in_a_bank_in_rural_india_ama/gvo7glp/,1619267947,2,True,False,AMA,t5_2r4eo,,0,[],,
[],,cnnispoison,,,[],,,,text,t2_a2s93r0p,False,False,[],"What current events are you referring to?

The way cops are being treated by the media and lefties?",,,1619261702,{},gvo7dlq,False,t3_mxhl69,False,True,t3_mxhl69,/r/AMA/comments/mxhl69/i_resigned_from_lapd_this_week_after_11_years_of/gvo7dlq/,1619267908,-2,True,False,AMA,t5_2r4eo,,0,[],,
[],,SpectralMalcontent,,,[],,,,text,t2_55yb8sw,False,False,[],"How are your standards for men vs. with women? For me, I'm much much pickier when it comes to guys.",,,1619261664,{},gvo7bwr,False,t3_mxai2y,False,True,t3_mxai2y,/r/AMA/comments/mxai2y/i_am_a_bisexual_top_ama/gvo7bwr/,1619267885,1,True,False,AMA,t5_2r4eo,,0,[],,
[],,thizzy85,,,[],,,,text,t2_4tvpf,False,False,[],What you gonna do?,,,1619261578,{},gvo787q,False,t3_mxhl69,False,False,t3_mxhl69,/r/AMA/comments/mxhl69/i_resigned_from_lapd_this_week_after_11_years_of/gvo787q/,1619267836,3,True,False,AMA,t5_2r4eo,,0,[],,
[],,nitrogen_onoxide,,,[],,,,text,t2_7k8718o7,False,False,[],How to last longer for a man?,,,1619261552,{},gvo76rc,False,t3_mxan9q,False,True,t3_mxan9q,/r/AMA/comments/mxan9q/im_a_sex_education_teacher_and_i_know_you_all/gvo76rc/,1619267818,1,True,False,AMA,t5_2r4eo,,0,[],,
[],,Caffine_rush,,,[],,,,text,t2_d2ha9,False,False,[],Southern,,,1619261523,{},gvo7491,True,t3_mxgbtr,False,True,t1_gvo6nzu,/r/AMA/comments/mxgbtr/i_used_to_work_for_greggs/gvo7491/,1619267792,1,True,False,AMA,t5_2r4eo,,0,[],,
[],,mamadof210,,,[],,,,text,t2_2tqi2657,False,False,[],Just wanted to thank you ! Also you forgot this 👑,,,1619261485,{},gvo70nh,False,t3_mxan9q,False,False,t3_mxan9q,/r/AMA/comments/mxan9q/im_a_sex_education_teacher_and_i_know_you_all/gvo70nh/,1619267759,1,True,False,AMA,t5_2r4eo,,0,[],,
[],,RealJG123,,,[],,,,text,t2_45zm3m9t,False,False,[],"What is your reaction to people saying ""AUTISTICS ARE ZOMBIES""?",,,1619261439,{},gvo6w1s,False,t3_mxe82h,False,False,t3_mxe82h,/r/AMA/comments/mxe82h/im_autistic_ama/gvo6w1s/,1619267713,1,True,False,AMA,t5_2r4eo,,0,[],,
[],,RealJG123,,,[],,,,text,t2_45zm3m9t,False,False,[],Huh?,,,1619261414,{},gvo6tk4,False,t3_mxfka7,False,True,t3_mxfka7,/r/AMA/comments/mxfka7/8a500hd2ao80rb12ch_ama/gvo6tk4/,1619267688,1,True,False,AMA,t5_2r4eo,,0,[],,
[],,RealJG123,,,[],,,,text,t2_45zm3m9t,False,False,[],In the southern half of England or the northern half?,,,1619261357,{},gvo6nzu,False,t3_mxgbtr,False,False,t3_mxgbtr,/r/AMA/comments/mxgbtr/i_used_to_work_for_greggs/gvo6nzu/,1619267630,1,True,False,AMA,t5_2r4eo,,0,[],,
[],,Unfair_Shelter_5713,,,[],,,,text,t2_93c499br,False,False,[],Being Sick for a short time period doesn’t really hurt me While the lockdown last year was really bad because I couldn’t meet anyone.,,,1619261317,{},gvo6k4u,True,t3_mxh8no,False,False,t1_gvo5sg4,/r/AMA/comments/mxh8no/im_an_extrovert_ama/gvo6k4u/,1619267591,1,True,False,AMA,t5_2r4eo,,0,[],,
[],,pantshole,,,[],,,,text,t2_40l0jxzz,False,False,[],"So this may be more of a medical question but I feel like my brain and body have been held hostage by my PMS symptoms to a somewhat extreme degree. The symptoms aren’t consistent but often will have a very noticeable effect on my life. People will notice a visible change in how I appear- tired, more pale than usual, dark circles under my eyes- and how I behave- absent-minded, sluggish, irritable. Sometimes all I want to do is sleep and/or eat, other cycles like right now I’ll experience insomnia and/or loss of appetite. I know these things can be standard, I’m not describing it well enough to make it sound like a real issue. However, I have too many stories to recount of times when my PMS symptoms contributed to poor judgment or me doing or saying something foolish that has a noticeable effect on my work or home life. I’ve never been pregnant or had kids but it almost reminds me of how “pregnancy brain” is described.
I’m looking forward to getting health insurance soon so I can go to an ob/gyn for the first time in over a decade. My suspicion is these hormonal fluctuations are going a bit too far but I really don’t know. Is there a way to help regulate this? I started taking a women’s multi-vitamin a year ago and have noticed that’s helped a little bit. I also don’t use any sort of women’s birth control like the pill or an implant, etc. How standard are these symptoms? Am I potentially experiencing more extreme hormonal fluctuations that could contribute to these noticeable physical and behavioral changes? Am I just stuck with this until menopause? Oh god.... menopause fml. It never ends!!",,,1619261316,{},gvo6k0b,False,t3_mxan9q,False,True,t3_mxan9q,/r/AMA/comments/mxan9q/im_a_sex_education_teacher_and_i_know_you_all/gvo6k0b/,1619267590,1,True,False,AMA,t5_2r4eo,,0,[],,
[],,GABETHEBEST,,,[],,,,text,t2_1jx1cyyc,False,False,[],"Im a guy and can cum 3 times consecutively, the arousal doesn't go away that much, but it does get harder to cum each time, 3rd time is hard difficulty lol. Do some people have to rest?",,,1619261237,{},gvo6cd3,False,t3_mxan9q,False,False,t1_gvnevjz,/r/AMA/comments/mxan9q/im_a_sex_education_teacher_and_i_know_you_all/gvo6cd3/,1619267510,1,True,False,AMA,t5_2r4eo,,0,[],,
[],,esor_rose,,,[],,,,text,t2_2z4wwep6,False,False,[],"If I was planning on getting an IUD, how long should I wait to have sex after it is put in?",,,1619261209,{},gvo69lb,False,t3_mxan9q,False,True,t3_mxan9q,/r/AMA/comments/mxan9q/im_a_sex_education_teacher_and_i_know_you_all/gvo69lb/,1619267479,1,True,False,AMA,t5_2r4eo,,0,[],,
[],,waiting_for_Falkor,,,[],,,,text,t2_4dvmhbdw,False,False,[],Please do! And best of luck mate.,,,1619261089,{},gvo5xrp,False,t3_mwsfw8,False,True,t1_gvns8ea,/r/AMA/comments/mwsfw8/in_30_minutes_i_will_have_my_spinal_fluid/gvo5xrp/,1619267357,2,True,False,AMA,t5_2r4eo,,0,[],,
[],,Tralan,,,[],,,,text,t2_40y8h,False,False,[],"When two gay men have sex, how do they know whose penis will open up and accept the other's penis?",,,1619261087,{},gvo5xjq,False,t3_mxan9q,False,True,t3_mxan9q,/r/AMA/comments/mxan9q/im_a_sex_education_teacher_and_i_know_you_all/gvo5xjq/,1619267355,1,True,False,AMA,t5_2r4eo,,0,[],,
[],,pearllovespink,,,[],,,,text,t2_5oayeqkv,False,False,[],My period doesn’t last as long as it used to and I’m only in my 20’s. Should I be concerned?,,,1619261081,{},gvo5wx9,False,t3_mxan9q,False,False,t3_mxan9q,/r/AMA/comments/mxan9q/im_a_sex_education_teacher_and_i_know_you_all/gvo5wx9/,1619267348,1,True,False,AMA,t5_2r4eo,,0,[],,
[],,Bakhmal,,,[],,,,text,t2_3zhtviq2,False,False,[],"It is true that the longer your sex session, the larger the baby will be?",,,1619261075,{},gvo5wd9,False,t3_mxan9q,False,True,t3_mxan9q,/r/AMA/comments/mxan9q/im_a_sex_education_teacher_and_i_know_you_all/gvo5wd9/,1619267343,1,True,False,AMA,t5_2r4eo,,0,[],,
[],,Problematic_Luke,,,[],,,,text,t2_7ylpi3r3,False,False,[],How do you feel then you sick and have to stay home? And what do you think about last year lockdown?,,,1619261036,{},gvo5sg4,False,t3_mxh8no,False,True,t3_mxh8no,/r/AMA/comments/mxh8no/im_an_extrovert_ama/gvo5sg4/,1619267304,1,True,False,AMA,t5_2r4eo,,0,[],,
[],,mamadof210,,,[],,,,text,t2_2tqi2657,False,False,[],#WHAT ?,,,1619261032,{},gvo5s04,False,t3_mxan9q,False,False,t1_gvndv5t,/r/AMA/comments/mxan9q/im_a_sex_education_teacher_and_i_know_you_all/gvo5s04/,1619267299,1,True,False,AMA,t5_2r4eo,,0,[],,
[],,digitalwriternow,,,[],,,,text,t2_4t2cqpe4,False,False,[],But I heard it made rural people and other poor people more willing to pay with debit cards. True or not?,,,1619261026,{},gvo5re5,False,t3_mx2ljw,False,True,t1_gvo35mw,/r/AMA/comments/mx2ljw/i_work_in_a_bank_in_rural_india_ama/gvo5re5/,1619267293,1,True,False,AMA,t5_2r4eo,,0,[],,
[],,Unfair_Shelter_5713,,,[],,,,text,t2_93c499br,False,False,[],No,,,1619260939,{},gvo5j4t,True,t3_mxh8no,False,False,t1_gvo4pzz,/r/AMA/comments/mxh8no/im_an_extrovert_ama/gvo5j4t/,1619267206,1,True,False,AMA,t5_2r4eo,,0,[],,
