all_awardings,associated_award,author,author_flair_background_color,author_flair_css_class,author_flair_richtext,author_flair_template_id,author_flair_text,author_flair_text_color,author_flair_type,author_fullname,author_patreon_flair,author_premium,awarders,body,collapsed_because_crowd_control,comment_type,created_utc,gildings,id,is_submitter,link_id,locked,no_follow,parent_id,permalink,retrieved_on,score,send_replies,stickied,subreddit,subreddit_id,top_awarded_type,total_awards_received,treatment_tags,distinguished
[],,AgronLovesSteel,,,[],,,,text,t2_68gsl4ib,False,False,[],Omg sooo good just finished! Gotta have some food and make another 😋,,,1619304805,{},gvrcgqn,True,t3_mxukth,False,True,t1_gvrccgy,/r/AMA/comments/mxukth/im_a_drunk_25_year_old_female_ama/gvrcgqn/,1619321265,1,True,False,AMA,t5_2r4eo,,0,[],
[],,Adventurous-Mess9304,,,[],,,,text,t2_8x6i6s4f,False,False,[],Great answer,,,1619304780,{},gvrcf1t,False,t3_mxnfsk,False,True,t1_gvqnjl0,/r/AMA/comments/mxnfsk/im_a_cop_ama/gvrcf1t/,1619321240,2,True,False,AMA,t5_2r4eo,,0,[],
[],,ab901,,,[],,,,text,t2_6cyel9fk,False,False,[],thank you for serving and protecting!,,,1619304749,{},gvrcd04,False,t3_mxnfsk,False,True,t3_mxnfsk,/r/AMA/comments/mxnfsk/im_a_cop_ama/gvrcd04/,1619321210,1,True,False,AMA,t5_2r4eo,,0,[],
[],,[deleted],,,,,,dark,,,,,[],[deleted],,,1619304748,{},gvrccvg,False,t3_mxtiyc,False,True,t1_gvr7920,/r/AMA/comments/mxtiyc/i_dated_a_male_porn_actor_for_two_years_ama/gvrccvg/,1619321208,1,True,False,AMA,t5_2r4eo,,0,[],
[],,pardo92,,,[],,,,text,t2_uckdfgu,False,False,[],Im sure they brighten the place up :) hows the drink?,,,1619304741,{},gvrccgy,False,t3_mxukth,False,True,t1_gvrc8ir,/r/AMA/comments/mxukth/im_a_drunk_25_year_old_female_ama/gvrccgy/,1619321201,1,True,False,AMA,t5_2r4eo,,0,[],
[],,strawberrycreampie,,,[],,,,text,t2_7vozh,False,False,[],"yes, i would have needed the gun. im much too weak of a person to kill myself in any other way.",,,1619304719,{},gvrcaz0,True,t3_mxi3xq,False,True,t1_gvoquax,/r/AMA/comments/mxi3xq/4_years_ago_i_asked_the_gun_shop_owner_if_the_gun/gvrcaz0/,1619321179,1,True,False,AMA,t5_2r4eo,,0,[],
[],,YeastyP1ssFlaps,,,[],,,,text,t2_p6j8g,False,False,[],Would you ever date another male pornstar?,,,1619304717,{},gvrcaud,False,t3_mxtiyc,False,False,t3_mxtiyc,/r/AMA/comments/mxtiyc/i_dated_a_male_porn_actor_for_two_years_ama/gvrcaud/,1619321177,1,True,False,AMA,t5_2r4eo,,0,[],
[],,Blue-Corn,,,[],,,,text,t2_37jima4f,False,False,[],"People react to a stress test in different ways. I dont think it would come up, but who knows. I would sugest just being honest in the future.",,,1619304687,{},gvrc8so,True,t3_mxnfsk,False,False,t1_gvqybkk,/r/AMA/comments/mxnfsk/im_a_cop_ama/gvrc8so/,1619321146,13,True,False,AMA,t5_2r4eo,,0,[],
[],,AgronLovesSteel,,,[],,,,text,t2_68gsl4ib,False,False,[],I painted some cute little clothespins and glued magnets in the back to put them on the fridge! Its nice to have cute things around the house!,,,1619304683,{},gvrc8ir,True,t3_mxukth,False,True,t1_gvrc281,/r/AMA/comments/mxukth/im_a_drunk_25_year_old_female_ama/gvrc8ir/,1619321142,1,True,False,AMA,t5_2r4eo,,0,[],
[],,DrRedditMemes,,,[],,,,text,t2_4e43qexg,False,False,[],"Oh my, are you ok?",,,1619304677,{},gvrc84p,False,t3_mxt25f,False,True,t1_gvrb8c1,/r/AMA/comments/mxt25f/i_was_groomed_online_by_a_27_year_old_woman_when/gvrc84p/,1619321136,2,True,False,AMA,t5_2r4eo,,0,[],
[],,YeastyP1ssFlaps,,,[],,,,text,t2_p6j8g,False,False,[],Nice. Did they DP you?,,,1619304653,{},gvrc6gs,False,t3_mxtiyc,False,False,t1_gvraueg,/r/AMA/comments/mxtiyc/i_dated_a_male_porn_actor_for_two_years_ama/gvrc6gs/,1619321110,2,True,False,AMA,t5_2r4eo,,0,[],
[],,TheCoonKid,,,[],,,,text,t2_bppydac2,False,False,[],1. I am not hating on anyone. 2. You need help. What you are saying makes you sound mentaly challanged.,,,1619304642,{},gvrc5sq,True,t3_mwteum,False,True,t1_gvr8wbf,/r/AMA/comments/mwteum/i_know_what_white_supremacists_accualy_think_and/gvrc5sq/,1619321100,1,True,False,AMA,t5_2r4eo,,0,[],
[],,YeastyP1ssFlaps,,,[],,,,text,t2_p6j8g,False,False,[],That’s a very impressive list. What are your limits?,,,1619304624,{},gvrc4jf,False,t3_mxtiyc,False,True,t1_gvrarjf,/r/AMA/comments/mxtiyc/i_dated_a_male_porn_actor_for_two_years_ama/gvrc4jf/,1619321080,1,True,False,AMA,t5_2r4eo,,0,[],
[],,strawberrycreampie,,,[],,,,text,t2_7vozh,False,False,[],"from my research during my suicidal time, if you dont shoot the right part of your brain, youll just choke on your own blood in a slow painful death. i will omit the right part of the brain to destroy from this post. additionally, ive heard too many stories of people trying to commit suicide with, say, a .22 and they straight up dont die. i just wanted the job done right.",,,1619304616,{},gvrc3zn,True,t3_mxi3xq,False,False,t1_gvor6hs,/r/AMA/comments/mxi3xq/4_years_ago_i_asked_the_gun_shop_owner_if_the_gun/gvrc3zn/,1619321072,1,True,False,AMA,t5_2r4eo,,0,[],
[],,pardo92,,,[],,,,text,t2_uckdfgu,False,False,[],"I get that, I'm doing some spray paint pieces for birthday gifts this year, it's been nice. Working on any cool stuff now?",,,1619304590,{},gvrc281,False,t3_mxukth,False,True,t1_gvrbu5k,/r/AMA/comments/mxukth/im_a_drunk_25_year_old_female_ama/gvrc281/,1619321044,2,True,False,AMA,t5_2r4eo,,0,[],
[],,Blue-Corn,,,[],,,,text,t2_37jima4f,False,False,[],Unspeakable things,,,1619304578,{},gvrc1d7,True,t3_mxnfsk,False,False,t1_gvqz12c,/r/AMA/comments/mxnfsk/im_a_cop_ama/gvrc1d7/,1619321032,19,True,False,AMA,t5_2r4eo,,0,[],
[],,AgronLovesSteel,,,[],,,,text,t2_68gsl4ib,False,False,[],Awww thank you that is super super nice :),,,1619304551,{},gvrbzkz,True,t3_mxukth,False,True,t1_gvrbwjr,/r/AMA/comments/mxukth/im_a_drunk_25_year_old_female_ama/gvrbzkz/,1619321004,1,True,False,AMA,t5_2r4eo,,0,[],
[],,WorkForFood_,,,[],,,,text,t2_bja2zppl,False,False,[],The ladies figure skaters always had the nicest butts.,,,1619304548,{},gvrbzd7,False,t3_mxan9q,False,True,t1_gvok2qy,/r/AMA/comments/mxan9q/im_a_sex_education_teacher_and_i_know_you_all/gvrbzd7/,1619320999,1,True,False,AMA,t5_2r4eo,,0,[],
[],,h2jp,,,[],,,,text,t2_8efu2upu,False,False,[],monaco?,,,1619304533,{},gvrbyd3,False,t3_mxpus8,False,True,t3_mxpus8,/r/AMA/comments/mxpus8/i_have_been_to_a_shit_ton_a_countries_ama/gvrbyd3/,1619320984,1,True,False,AMA,t5_2r4eo,,0,[],
[],,P3runaama,,,[],,,,text,t2_pcuwjbd,False,False,[],Well I'm at least gonna follow for more. Gl on work and art!,,,1619304505,{},gvrbwjr,False,t3_mxukth,False,True,t1_gvrb9g3,/r/AMA/comments/mxukth/im_a_drunk_25_year_old_female_ama/gvrbwjr/,1619320956,1,True,False,AMA,t5_2r4eo,,0,[],
[],,[deleted],,,,,,dark,,,,,[],[deleted],,,1619304502,{},gvrbwat,False,t3_mxtxel,False,True,t1_gvr98o3,/r/AMA/comments/mxtxel/i_live_in_a_state_where_beastiality_is_completely/gvrbwat/,1619320952,1,True,False,AMA,t5_2r4eo,,0,[],
[],,AgronLovesSteel,,,[],,,,text,t2_68gsl4ib,False,False,[],They are just so different its hard to compare! When I'm trying to relax definitely pain but I loveeee doing digital cause its more versatile!,,,1619304469,{},gvrbu5k,True,t3_mxukth,False,True,t1_gvrbm7y,/r/AMA/comments/mxukth/im_a_drunk_25_year_old_female_ama/gvrbu5k/,1619320920,1,True,False,AMA,t5_2r4eo,,0,[],
[],,pardo92,,,[],,,,text,t2_uckdfgu,False,False,[],"Very cool, I've spent a lot of time with ink and acrylic paint. Just recently started getting more digital work. Which do you prefer?",,,1619304351,{},gvrbm7y,False,t3_mxukth,False,True,t1_gvrbfzr,/r/AMA/comments/mxukth/im_a_drunk_25_year_old_female_ama/gvrbm7y/,1619320801,2,True,False,AMA,t5_2r4eo,,0,[],
[],,AgronLovesSteel,,,[],,,,text,t2_68gsl4ib,False,False,[],He is a cutie! Fire type has always been the coolest type to me! Who is your favorite legendary?,,,1619304336,{},gvrbl7r,True,t3_mxukth,False,False,t3_mxukth,/r/AMA/comments/mxukth/im_a_drunk_25_year_old_female_ama/gvrbl7r/,1619320786,1,True,False,AMA,t5_2r4eo,,0,[],
[],,sp3fix,,,[],,,,text,t2_7uisl8,False,False,[],"I recently read ""Talking to Strangers"" by Malcom Gladwell and he makes the case that the type of ""Active policing"" that is taught to cops is the main reason why so much stuff are going wrong in policing these days. That ""active policing"" was never meant to be applied at such a large scale and should be restricted to very small, extremely high risks sector. 

By constantly being in ""active policing"" mode, cops are way too likely to make mistakes because they have to abandon most ""natural"" instincts that usually rule our interactions as human. They have to be extremely suspicious of everything and constantly assume the worst.

What are your thoughts on all of that? Have you been taught to be overly suspicious? Do you feel like it's ""worth it"" overall?",,,1619304327,{},gvrbko3,False,t3_mxnfsk,False,True,t3_mxnfsk,/r/AMA/comments/mxnfsk/im_a_cop_ama/gvrbko3/,1619320778,1,True,False,AMA,t5_2r4eo,,0,[],
[],,The_Hamster98,,,[],,,,text,t2_73cg15rh,False,False,[],"Agree, but I think the discussion of how we think we would feel can say a lot about ourselves by itself, like I’m pretty sure I would need tremendous amounts of therapy and time to learn to live with the trauma, I can’t even hurt someone’s feelings without a guilt trip, even if I do not like them at all, is safe to say it wouldn’t just fly by me like nothing",,,1619304306,{},gvrbj8z,False,t3_mxsy99,False,True,t1_gvr4oqw,/r/AMA/comments/mxsy99/i_score_highly_for_both_primary_and_secondary/gvrbj8z/,1619320757,1,True,False,AMA,t5_2r4eo,,0,[],
[],,DankMemescope,,,[],,,,text,t2_4pvv88w0,False,False,[],Yes,,,1619304302,{},gvrbixb,True,t3_mxc926,False,True,t1_gvrbehk,/r/AMA/comments/mxc926/i_use_light_mode_everything_even_the_windows/gvrbixb/,1619320752,1,True,False,AMA,t5_2r4eo,,0,[],
[],,SirSoaplo,,,[],,,,text,t2_6nfakup0,False,False,[],"I have 3 questions  


1. What's your rank?  

2. Does your PD have different divisions(like homicide, narcotics, etc).  If so, which division do you work in?  

3. Why did you decide to become a cop  


Thank you for your service and for this interesting look into a cops mind :)",,,1619304289,{},gvrbi0x,False,t3_mxnfsk,False,False,t3_mxnfsk,/r/AMA/comments/mxnfsk/im_a_cop_ama/gvrbi0x/,1619320739,5,True,False,AMA,t5_2r4eo,,0,[],
[],,Shadyside77,,,[],,,,text,t2_4kohmqg6,False,False,[],It is my belief there isn't much discrimination in policing if you put holds for all relevant facts. Is that true?,,,1619304286,{},gvrbhw3,False,t3_mxnfsk,False,True,t3_mxnfsk,/r/AMA/comments/mxnfsk/im_a_cop_ama/gvrbhw3/,1619320737,1,True,False,AMA,t5_2r4eo,,0,[],
[],,AgronLovesSteel,,,[],,,,text,t2_68gsl4ib,False,False,[],Not so far in my life,,,1619304273,{},gvrbh07,True,t3_mxukth,False,True,t1_gvrb8bl,/r/AMA/comments/mxukth/im_a_drunk_25_year_old_female_ama/gvrbh07/,1619320723,2,True,False,AMA,t5_2r4eo,,0,[],
[],,AgronLovesSteel,,,[],,,,text,t2_68gsl4ib,False,False,[],"I used to watch it growing up so it has a special spot in my heart! 
Painting is my favorite medium cause I love to just start a canvas and see where it end up! I also do like doing some digital too!",,,1619304258,{},gvrbfzr,True,t3_mxukth,False,True,t1_gvrb4a9,/r/AMA/comments/mxukth/im_a_drunk_25_year_old_female_ama/gvrbfzr/,1619320708,1,True,False,AMA,t5_2r4eo,,0,[],
[],,Yesjrw,,,[],,,,text,t2_5go0lvqz,False,False,[],Do you use white discord,,,1619304236,{},gvrbehk,False,t3_mxc926,False,True,t1_gvrba6d,/r/AMA/comments/mxc926/i_use_light_mode_everything_even_the_windows/gvrbehk/,1619320685,1,True,False,AMA,t5_2r4eo,,0,[],
[],,DaDankFox,,,[],,,,text,t2_81ic66m,False,False,[],Good man. Also it's a broth,,,1619304177,{},gvrbago,False,t3_mxnfsk,False,False,t1_gvr6epw,/r/AMA/comments/mxnfsk/im_a_cop_ama/gvrbago/,1619320622,4,True,False,AMA,t5_2r4eo,,0,[],
[],,DankMemescope,,,[],,,,text,t2_4pvv88w0,False,False,[],"Well, I don't spend all day staring at my avatar.",,,1619304172,{},gvrba6d,True,t3_mxc926,False,True,t1_gvrb42a,/r/AMA/comments/mxc926/i_use_light_mode_everything_even_the_windows/gvrba6d/,1619320619,1,True,False,AMA,t5_2r4eo,,0,[],
[],,AgronLovesSteel,,,[],,,,text,t2_68gsl4ib,False,False,[],"I honestly was kinda depressed durring the winter but I'm starting to do more art, none digital yet though!",,,1619304161,{},gvrb9g3,True,t3_mxukth,False,True,t1_gvraxst,/r/AMA/comments/mxukth/im_a_drunk_25_year_old_female_ama/gvrb9g3/,1619320608,1,True,False,AMA,t5_2r4eo,,0,[],
[],,Blue-Corn,,,[],,,,text,t2_37jima4f,False,False,[],That’s what I carry. Backup is a 43x,,,1619304155,{},gvrb928,True,t3_mxnfsk,False,True,t1_gvr1kcw,/r/AMA/comments/mxnfsk/im_a_cop_ama/gvrb928/,1619320602,2,True,False,AMA,t5_2r4eo,,0,[],
[],,Ok-Sympathy4041,,,[],,,,text,t2_9e7tfsz4,False,False,[],Why do so many men claim to have such large dicks when the evidence is just not there? Virtually all studies place the averege at around 5.4 inches yet I constantly see dudes talk about thier 8 or 9 inch dong.,,,1619304153,{},gvrb8w8,False,t3_mxan9q,False,True,t3_mxan9q,/r/AMA/comments/mxan9q/im_a_sex_education_teacher_and_i_know_you_all/gvrb8w8/,1619320599,1,True,False,AMA,t5_2r4eo,,0,[],
[],,pardo92,,,[],,,,text,t2_uckdfgu,False,False,[],Fellow fire type Charmander! I just love that guy so much!!,,,1619304151,{},gvrb8rl,False,t3_mxukth,False,True,t1_gvrb24p,/r/AMA/comments/mxukth/im_a_drunk_25_year_old_female_ama/gvrb8rl/,1619320598,1,True,False,AMA,t5_2r4eo,,0,[],
[],,ggdoesthings,,,[],,,,text,t2_7o4qov0o,False,False,[],"we became friends on deviantart because she liked my art and i liked hers. i had spoken to adults online before and never had any bad experiences so i added her on discord. she was pretty normal and we had a good back and forth but she eventually became clingy, cruel, and incredibly inappropriate; she would call me her husband and tell me how much she loved me and had a crush on me. she manipulated my trust to get free art and get me to reciprocate the affection (if i didn’t she would say she was crying and i hurt her). i didn’t realize what was going on, so i didn’t block her, until she started harassing me on my twitter which is where i drew the line.",,,1619304144,{},gvrb8c1,True,t3_mxt25f,False,True,t1_gvr4o1t,/r/AMA/comments/mxt25f/i_was_groomed_online_by_a_27_year_old_woman_when/gvrb8c1/,1619320591,2,True,False,AMA,t5_2r4eo,,0,[],
[],,seekknowledgeskills,,,[],,,,text,t2_496arile,False,False,[],Have you ever been gangbanged?,,,1619304144,{},gvrb8bl,False,t3_mxukth,False,True,t3_mxukth,/r/AMA/comments/mxukth/im_a_drunk_25_year_old_female_ama/gvrb8bl/,1619320591,1,True,False,AMA,t5_2r4eo,,0,[],
[],,pommemiles,,,[],,,,text,t2_7wuy7aea,False,False,[],"Yeah there's still a difference, to be fair though the differences aren't really relevant in most situations. It's important for me to tell my doctors and potential partners that I'm transgender, but apart from that there's no reason to separate me from any other guy. 

Ah yeah, the sports debate is a really tricky one. It's not something I can comment on from a personal standpoint because I think it's fairly obvious that trans men on testosterone shouldn't compete against women; so this issue doesn't impact me at all. But when it comes to trans women it really depends on when they started taking oestrogen and how much oestrogen has impacted their muscle mass",,,1619304138,{},gvrb7wu,True,t3_mxotst,False,True,t1_gvr86v9,/r/AMA/comments/mxotst/im_a_transgender_man_female_to_male_ama/gvrb7wu/,1619320585,1,True,False,AMA,t5_2r4eo,,0,[],
[],,pardo92,,,[],,,,text,t2_uckdfgu,False,False,[],"Very cool, what's your art medium? Adam Sandler is great in that movie!",,,1619304086,{},gvrb4a9,False,t3_mxukth,False,True,t1_gvrasr2,/r/AMA/comments/mxukth/im_a_drunk_25_year_old_female_ama/gvrb4a9/,1619320532,2,True,False,AMA,t5_2r4eo,,0,[],
[],,Yesjrw,,,[],,,,text,t2_5go0lvqz,False,False,[],Also I’m surprised your avatar has so much black then,,,1619304082,{},gvrb42a,False,t3_mxc926,False,False,t1_gvra7x3,/r/AMA/comments/mxc926/i_use_light_mode_everything_even_the_windows/gvrb42a/,1619320528,2,True,False,AMA,t5_2r4eo,,0,[],
[],,AgronLovesSteel,,,[],,,,text,t2_68gsl4ib,False,False,[],If I could only choose from starters torchic! If I could choose any pokemon i would choose aron 100%! What about you!,,,1619304054,{},gvrb24p,True,t3_mxukth,False,True,t1_gvrav0j,/r/AMA/comments/mxukth/im_a_drunk_25_year_old_female_ama/gvrb24p/,1619320500,1,True,False,AMA,t5_2r4eo,,0,[],
[],,The_Hamster98,,,[],,,,text,t2_73cg15rh,False,False,[],Thanks for the answer!,,,1619304026,{},gvrb08b,False,t3_mxsy99,False,True,t1_gvr560z,/r/AMA/comments/mxsy99/i_score_highly_for_both_primary_and_secondary/gvrb08b/,1619320473,1,True,False,AMA,t5_2r4eo,,0,[],
[],,Blue-Corn,,,[],,,,text,t2_37jima4f,False,False,[],"My town in next to a military base. So... no. Also no , your thin blue line sticker won’t either. And I don’t care if you’re the mayor, you’re not getting out of a dui. I hate drunk drivers.",,,1619304025,{},gvrb04o,True,t3_mxnfsk,False,False,t1_gvr1g7d,/r/AMA/comments/mxnfsk/im_a_cop_ama/gvrb04o/,1619320471,4,True,False,AMA,t5_2r4eo,,0,[],
[],,P3runaama,,,[],,,,text,t2_pcuwjbd,False,False,[],Checked your profile and def not shitty! Why haven't you posted any drawings in 11 months tho?,,,1619303991,{},gvraxst,False,t3_mxukth,False,False,t1_gvrac6v,/r/AMA/comments/mxukth/im_a_drunk_25_year_old_female_ama/gvraxst/,1619320436,2,True,False,AMA,t5_2r4eo,,0,[],
[],,deaftwoshoes,,,[],,,,text,t2_4e050yao,False,False,[],"Honestly, well said. I was at work, this AMA should never have happened",,,1619303970,{},gvrawdt,False,t3_mxhcg7,False,False,t1_gvop4vu,/r/AMA/comments/mxhcg7/i_worked_behind_the_scenes_at_a_festival_ama/gvrawdt/,1619320413,1,True,False,AMA,t5_2r4eo,,0,[],
[],,di_polino,,,[],,,,text,t2_2o8tfqdx,False,False,[],Italy,,,1619303964,{},gvravys,False,t3_mxtxel,False,True,t1_gvr8nnw,/r/AMA/comments/mxtxel/i_live_in_a_state_where_beastiality_is_completely/gvravys/,1619320407,1,True,False,AMA,t5_2r4eo,,0,[],
[],,FeelingDesigner,,,[],,,,text,t2_3ezuz67u,False,False,[],What’s that?,,,1619303963,{},gvravvg,False,t3_mxtahp,False,True,t3_mxtahp,/r/AMA/comments/mxtahp/ive_been_a_hikikomori_for_the_past_10ish_years_ama/gvravvg/,1619320405,1,True,False,AMA,t5_2r4eo,,0,[],
[],,scottshilala,,,[],,,,text,t2_390wqwwt,False,False,[],FUCK YEAH!!!,,,1619303959,{},gvravm1,False,t3_mxnfsk,False,False,t1_gvqnjl0,/r/AMA/comments/mxnfsk/im_a_cop_ama/gvravm1/,1619320402,8,True,False,AMA,t5_2r4eo,,0,[],
[],,eumemics,,,[],,,,text,t2_agg0vag2,False,False,[],sorry for my typo!! it slipped my eyesight somehow,,,1619303959,{},gvravlb,False,t3_mxunhl,False,True,t3_mxunhl,/r/AMA/comments/mxunhl/i_have_founded_founded_several_intentional/gvravlb/,1619320401,1,True,False,AMA,t5_2r4eo,,0,[],
[],,pardo92,,,[],,,,text,t2_uckdfgu,False,False,[],Who is your starter pokemon? If you could have any!,,,1619303951,{},gvrav0j,False,t3_mxukth,False,False,t3_mxukth,/r/AMA/comments/mxukth/im_a_drunk_25_year_old_female_ama/gvrav0j/,1619320392,1,True,False,AMA,t5_2r4eo,,0,[],
[],,Lady__Mai,,,[],,,,text,t2_5utjke16,False,False,[],"No, I haven’t. But I have had a threesome with one of his male colleagues.",,,1619303942,{},gvraueg,True,t3_mxtiyc,False,True,t1_gvr9zto,/r/AMA/comments/mxtiyc/i_dated_a_male_porn_actor_for_two_years_ama/gvraueg/,1619320382,1,True,False,AMA,t5_2r4eo,,0,[],
[],,missingn_0,,,[],,,,text,t2_16pnaa,False,False,[],"Sometimes I feel like that but it's a feeling that last some minutes. I know that I'm just doing my jobs.
I hate this job because I'm not doing anything good for the people but right now there's no much more I can do.",,,1619303938,{},gvrau4t,True,t3_mxre7g,False,False,t1_gvraidh,/r/AMA/comments/mxre7g/im_a_online_casino_dealer_croupier_ama/gvrau4t/,1619320378,2,True,False,AMA,t5_2r4eo,,0,[],
[],,xkcd-Hyphen-bot,,,[],,,,text,t2_b2dzbo25,False,False,[],"Weird ass-movies

[xkcd: Hyphen](https://xkcd.com/37/)

---

^^Beep ^^boop, ^^I'm ^^a ^^bot. ^^- ^^[FAQ](https://pastebin.com/raw/vyWra3ns)",,,1619303930,{},gvratk8,False,t3_mxukth,False,True,t1_gvrasr2,/r/AMA/comments/mxukth/im_a_drunk_25_year_old_female_ama/gvratk8/,1619320370,1,True,False,AMA,t5_2r4eo,,0,[],
[],,AgronLovesSteel,,,[],,,,text,t2_68gsl4ib,False,False,[],Watching weird ass movies and doing drunk art haha! Currently watch Big Daddy for some reason!,,,1619303919,{},gvrasr2,True,t3_mxukth,False,True,t1_gvraa2m,/r/AMA/comments/mxukth/im_a_drunk_25_year_old_female_ama/gvrasr2/,1619320356,1,True,False,AMA,t5_2r4eo,,0,[],
[],,Lady__Mai,,,[],,,,text,t2_5utjke16,False,False,[],"I think what he meant is that I’m a genuine enthusiast for sex. I enjoy having sex a great deal, I barely have any limits (only a handful) and I’m very fit and athletic and have great stamina. I can fuck for hours. I’m also a people pleaser and can take cock really good- deepthroat, deep anal, fisting, double penetration, you name it, I’ve done it. And with a smile. I’m not scared or intimidated by sex and I genuinely enjoy it.",,,1619303902,{},gvrarjf,True,t3_mxtiyc,False,True,t1_gvra35o,/r/AMA/comments/mxtiyc/i_dated_a_male_porn_actor_for_two_years_ama/gvrarjf/,1619320338,0,True,False,AMA,t5_2r4eo,,0,[],
[],,livinglavidalazy,,,[],,,,text,t2_ayx833l4,False,False,[],"Is it normal to feel very little physical arousal during sex at 5 months postpartum? I feel like I have no sex drive and have a hard time enjoying sex again. I also have a lot of difficulty self-lubricating. I get that hormones and lactation can be big factors, bit I have no idea what is normal and what not.",,,1619303895,{},gvrar28,False,t3_mxan9q,False,True,t3_mxan9q,/r/AMA/comments/mxan9q/im_a_sex_education_teacher_and_i_know_you_all/gvrar28/,1619320330,1,True,False,AMA,t5_2r4eo,,0,[],
[],,AgronLovesSteel,,,[],,,,text,t2_68gsl4ib,False,False,[],I'm just saying I wouldn't bet against them!,,,1619303848,{},gvranwe,True,t3_mxukth,False,True,t1_gvra93x,/r/AMA/comments/mxukth/im_a_drunk_25_year_old_female_ama/gvranwe/,1619320282,1,True,False,AMA,t5_2r4eo,,0,[],
[],,eumemics,,,[],,,,text,t2_agg0vag2,False,False,[],"its hard to get a perspective on it since I've been in it for so long! I would say its very much a thankless job, its a bit like parenting I suppose",,,1619303846,{},gvranqh,False,t3_mxunhl,False,True,t1_gvra7ss,/r/AMA/comments/mxunhl/i_have_founded_founded_several_intentional/gvranqh/,1619320279,1,True,False,AMA,t5_2r4eo,,0,[],
[],,AlabamaAmazonian,,,[],,,,text,t2_bqp4o9z7,False,False,[],"I order stuff from Amazon, too.  The point is that I think the warehouse conditions are above average, and that I think the marketplace is the part I have more issues with.",,,1619303840,{},gvranct,True,t3_mxrlrp,False,True,t1_gvrabnf,/r/AMA/comments/mxrlrp/hello_ive_worked_at_warehouses_my_entire_adult/gvranct/,1619320274,1,True,False,AMA,t5_2r4eo,,0,[],
[],,AgronLovesSteel,,,[],,,,text,t2_68gsl4ib,False,False,[],You can never make anyone happy! Secure your breathing mask first!,,,1619303805,{},gvral03,True,t3_mxukth,False,True,t1_gvra6bq,/r/AMA/comments/mxukth/im_a_drunk_25_year_old_female_ama/gvral03/,1619320240,1,True,False,AMA,t5_2r4eo,,0,[],
[],,Lady__Mai,,,[],,,,text,t2_5utjke16,False,False,[],I can’t disclose that. Reddit doesn’t allow it.,,,1619303779,{},gvraj7j,True,t3_mxtiyc,False,True,t1_gvra5zv,/r/AMA/comments/mxtiyc/i_dated_a_male_porn_actor_for_two_years_ama/gvraj7j/,1619320211,1,True,False,AMA,t5_2r4eo,,0,[],
[],,P3runaama,,,[],,,,text,t2_pcuwjbd,False,False,[],"Do you ever feel like a scammer or a ""bad guy"" in other ways? Why? Would you prefer other jobs that paid similar amounts?",,,1619303766,{},gvraidh,False,t3_mxre7g,False,True,t1_gvra10z,/r/AMA/comments/mxre7g/im_a_online_casino_dealer_croupier_ama/gvraidh/,1619320198,1,True,False,AMA,t5_2r4eo,,0,[],
[],,Lady__Mai,,,[],,,,text,t2_5utjke16,False,False,[],"No, sorry.",,,1619303759,{},gvrahxc,True,t3_mxtiyc,False,True,t1_gvr9wki,/r/AMA/comments/mxtiyc/i_dated_a_male_porn_actor_for_two_years_ama/gvrahxc/,1619320191,1,True,False,AMA,t5_2r4eo,,0,[],
[],,butter-cake-blue,,,[],,,,text,t2_4f6usw7o,False,False,[],"Do you think the police officer in the Ma’Khia Bryant shooting had other options besides shooting her 5 times?  Or in any similar situation - does police training teach alternatives like tasing or shooting in the leg or something?  Anything other than shooting to kill?  There is no judgement behind this question, btw, I’m truly just curious.",,,1619303757,{},gvrahqe,False,t3_mxnfsk,False,True,t3_mxnfsk,/r/AMA/comments/mxnfsk/im_a_cop_ama/gvrahqe/,1619320188,1,True,False,AMA,t5_2r4eo,,0,[],
[],,AgronLovesSteel,,,[],,,,text,t2_68gsl4ib,False,False,[],Probably  r/pokemon cause I'm nerdy like that haha,,,1619303756,{},gvrahpo,True,t3_mxukth,False,True,t1_gvrabv9,/r/AMA/comments/mxukth/im_a_drunk_25_year_old_female_ama/gvrahpo/,1619320188,1,True,False,AMA,t5_2r4eo,,0,[],
[],,Classic-Marketing-81,,,[],,,,text,t2_83rdt9hv,False,False,[],How about the left media stop trying there best to make BLM riot and burn down businesses,,,1619303677,{},gvraca7,False,t3_mxnfsk,False,False,t1_gvq9q7l,/r/AMA/comments/mxnfsk/im_a_cop_ama/gvraca7/,1619320105,-4,True,False,AMA,t5_2r4eo,,0,[],
[],,AgronLovesSteel,,,[],,,,text,t2_68gsl4ib,False,False,[],"Well drink, but only on the weekends! Durring the week I have been doing a lot of art!! Honestly its so relaxing to create something even if it looks shitty!",,,1619303675,{},gvrac6v,True,t3_mxukth,False,True,t1_gvra0he,/r/AMA/comments/mxukth/im_a_drunk_25_year_old_female_ama/gvrac6v/,1619320105,1,True,False,AMA,t5_2r4eo,,0,[],
[],,buhbrinapokes,,,[],,,,text,t2_ibv5xy5,False,False,[],I think he meant he's never had to testify against a fellow officer.,,,1619303673,{},gvrac0r,False,t3_mxnfsk,False,False,t1_gvqtgz5,/r/AMA/comments/mxnfsk/im_a_cop_ama/gvrac0r/,1619320102,5,True,False,AMA,t5_2r4eo,,0,[],
