all_awardings,associated_award,author,author_flair_background_color,author_flair_css_class,author_flair_richtext,author_flair_template_id,author_flair_text,author_flair_text_color,author_flair_type,author_fullname,author_patreon_flair,author_premium,awarders,body,collapsed_because_crowd_control,comment_type,created_utc,gildings,id,is_submitter,link_id,locked,no_follow,parent_id,permalink,retrieved_on,score,send_replies,stickied,subreddit,subreddit_id,top_awarded_type,total_awards_received,treatment_tags,distinguished
[],,pommemiles,,,[],,,,text,t2_7wuy7aea,False,False,[],"It really depends on the person, the average is around 1.5 to 2 inches. I've seen very few guys have 3-4 inches but that's the equivalent of a natal male with a 10 inch porn dick 

They can get fairly girthy, and they have a visible head, shaft and foreskin. They often look similar to a micropenis",,,1619293262,{},gvqq1bi,True,t3_mxotst,False,True,t1_gvqpoh4,/r/AMA/comments/mxotst/im_a_transgender_man_female_to_male_ama/gvqq1bi/,1619309160,1,True,False,AMA,t5_2r4eo,,0,[],
[],,Blue-Corn,,,[],,,,text,t2_37jima4f,False,False,[],Three times. Every time was to humanly put a deer down after being hit by a car.,,,1619293232,{},gvqpz8w,True,t3_mxnfsk,False,False,t1_gvqmk6e,/r/AMA/comments/mxnfsk/im_a_cop_ama/gvqpz8w/,1619309127,10,True,False,AMA,t5_2r4eo,,0,[],
[],,ExtraDip412,,,[],,,,text,t2_3v6htj77,False,False,[],How do people behave with you after the Floyd murder?,,,1619293207,{},gvqpxhm,False,t3_mxnfsk,False,False,t3_mxnfsk,/r/AMA/comments/mxnfsk/im_a_cop_ama/gvqpxhm/,1619309099,6,True,False,AMA,t5_2r4eo,,0,[],
[],,TarumK,,,[],,,,text,t2_gnizisp,False,False,[],Why do you disagree with speeding laws? Do you just think the limits are too low?,,,1619293204,{},gvqpxaq,False,t3_mxnfsk,False,False,t1_gvqbpmz,/r/AMA/comments/mxnfsk/im_a_cop_ama/gvqpxaq/,1619309096,9,True,False,AMA,t5_2r4eo,,0,[],
[],,Threeminusme,,,[],,,,text,t2_633skne2,False,False,[],"I’m not american and in my country police is there to help people, like actually help people, it’s its main function. Why in America people say that police is not there to help you, it is here to punish you and it doesn’t serve people, it serves the state? Every time I hear it it makes me go 🤯 inside.",,,1619293199,{},gvqpwww,False,t3_mxnfsk,False,True,t3_mxnfsk,/r/AMA/comments/mxnfsk/im_a_cop_ama/gvqpwww/,1619309091,0,True,False,AMA,t5_2r4eo,,0,[],
[],,Blue-Corn,,,[],,,,text,t2_37jima4f,False,False,[],Blue,,,1619293190,{},gvqpwb0,True,t3_mxnfsk,False,False,t1_gvqnawb,/r/AMA/comments/mxnfsk/im_a_cop_ama/gvqpwb0/,1619309082,5,True,False,AMA,t5_2r4eo,,0,[],
[],,Blue-Corn,,,[],,,,text,t2_37jima4f,False,False,[],Not really. It’s just noise.,,,1619293182,{},gvqpvpx,True,t3_mxnfsk,False,False,t1_gvqlgtz,/r/AMA/comments/mxnfsk/im_a_cop_ama/gvqpvpx/,1619309073,14,True,False,AMA,t5_2r4eo,,0,[],
[],,bhhbhhbhhbb,,,[],,,,text,t2_bkryfxj7,False,False,[],How old are you?,,,1619293173,{},gvqpv49,False,t3_mxpxjh,False,True,t3_mxpxjh,/r/AMA/comments/mxpxjh/im_an_american_football_player_think_nfl_and_im_a/gvqpv49/,1619309063,2,True,False,AMA,t5_2r4eo,,0,[],
[],,Lumina_Luminesce,,,[],,,,text,t2_2tjpucyx,False,False,[],"Fuck yea let's go, I know where he lives 😂😂",,,1619293165,{},gvqpuke,True,t3_mxpdo0,False,True,t1_gvqpsq2,/r/AMA/comments/mxpdo0/i_dated_an_incel_ama/gvqpuke/,1619309054,2,True,False,AMA,t5_2r4eo,,0,[],
[],,pommemiles,,,[],,,,text,t2_7wuy7aea,False,False,[],I think you deserve the opportunity to lmao,,,1619293138,{},gvqpsq2,False,t3_mxpdo0,False,True,t1_gvqpm5u,/r/AMA/comments/mxpdo0/i_dated_an_incel_ama/gvqpsq2/,1619309026,2,True,False,AMA,t5_2r4eo,,0,[],
[],,Neel_LifeCoach,,,[],,,,text,t2_aatxzc51,False,False,[],"Hi, this is a very nice questions. If you practice a good routine for about 21 days, it becomes imprinted on your subconscious, thus acts as a natural occurrence. 

To make it for 30 days, you got to be serious and sincere in that goal. Therefore whether you are willing at times to do it or times not, you have decided nevertheless you would complete the process. In case you find it hard to persist, then may   be you have to review your objective. and phase it out in smaller steps. 

In general , this would be the rule. I hope I have answered your query. if you need further clarification, let me know. Wishing you all the best. Cheers Neel.",,,1619293124,{},gvqprpd,True,t3_mxkl13,False,True,t1_gvpzkg3,/r/AMA/comments/mxkl13/i_am_wellness_coach_ama_about_being_better_in/gvqprpd/,1619309010,1,True,False,AMA,t5_2r4eo,,0,[],
[],,deedboi,,,[],,,,text,t2_4t0dkmc5,False,False,[],What is your opinion on ACAB?,,,1619293117,{},gvqpr7g,False,t3_mxnfsk,False,True,t3_mxnfsk,/r/AMA/comments/mxnfsk/im_a_cop_ama/gvqpr7g/,1619309003,3,True,False,AMA,t5_2r4eo,,0,[],
[],,rja2391,,,[],,,,text,t2_1vjqcm7i,False,False,[],What kind of sacrifices does a cop have to make?,,,1619293112,{},gvqpquw,False,t3_mxnfsk,False,True,t3_mxnfsk,/r/AMA/comments/mxnfsk/im_a_cop_ama/gvqpquw/,1619308998,1,True,False,AMA,t5_2r4eo,,0,[],
[],,the_timezone_bot,,,[],,,,text,t2_3vultc71,False,True,[],"6am GMT happens when this comment is 10 hours and 21 minutes old.

You can find the live countdown here: https://countle.com/Q5mk5T12N

---

I'm a bot, if you want to send feedback, please comment below or send a PM.",,,1619293105,{},gvqpqcq,False,t3_mxr8n6,False,True,t3_mxr8n6,/r/AMA/comments/mxr8n6/im_trilingual_from_birth_and_can_speak_many_more/gvqpqcq/,1619308990,1,True,False,AMA,t5_2r4eo,,0,[],
[],,pommemiles,,,[],,,,text,t2_7wuy7aea,False,False,[],What situations require you to use guns rather than batons/tasers?,,,1619293099,{},gvqppy9,False,t3_mw32du,False,True,t3_mw32du,/r/AMA/comments/mw32du/british_police_afo_ama/gvqppy9/,1619308984,1,True,False,AMA,t5_2r4eo,,0,[],
[],,MorrisonsLament,,,[],,,,text,t2_22r3dlgw,False,True,[],"What was your worst day on the force and why? (sorry if this is morbid, I just wanted to cut to the chase)",,,1619293098,{},gvqppw9,False,t3_mxnfsk,False,True,t3_mxnfsk,/r/AMA/comments/mxnfsk/im_a_cop_ama/gvqppw9/,1619308984,1,True,False,AMA,t5_2r4eo,,0,[],
[],,botinator3000,,,[],,,,text,t2_aef94htf,False,False,[],"like the last person said, this isn’t something you can self-diagnose. and it’s suspicious how both of your alters were able to communicate on the same post at the same time?? weird.",,,1619293088,{},gvqpp5j,False,t3_mxjai5,False,True,t1_gvpw3gc,/r/AMA/comments/mxjai5/i_have_dissociative_identity_disorder_like/gvqpp5j/,1619308972,1,True,False,AMA,t5_2r4eo,,0,[],
[],,pellium6,,,[],,,,text,t2_88d8zcef,False,False,[],How much is it likely to grow?,,,1619293079,{},gvqpoh4,False,t3_mxotst,False,True,t1_gvqp2zj,/r/AMA/comments/mxotst/im_a_transgender_man_female_to_male_ama/gvqpoh4/,1619308962,1,True,False,AMA,t5_2r4eo,,0,[],
[],,botinator3000,,,[],,,,text,t2_aef94htf,False,False,[],agreed,,,1619293048,{},gvqpm9n,False,t3_mxjai5,False,True,t1_gvq53xg,/r/AMA/comments/mxjai5/i_have_dissociative_identity_disorder_like/gvqpm9n/,1619308927,1,True,False,AMA,t5_2r4eo,,0,[],
[],,Lumina_Luminesce,,,[],,,,text,t2_2tjpucyx,False,False,[],Oh my god can I kick his ass? That would be so therapeutic. For me 😂😂,,,1619293047,{},gvqpm5u,True,t3_mxpdo0,False,True,t1_gvqpaj7,/r/AMA/comments/mxpdo0/i_dated_an_incel_ama/gvqpm5u/,1619308926,2,True,False,AMA,t5_2r4eo,,0,[],
[],,Meta_Galactic,,,[],,,,text,t2_1oggh41m,False,False,[],"Right, but what is fraction childbirth referring to.  Does that just mean it's a painful birth?",,,1619293035,{},gvqpla6,False,t3_mxan9q,False,True,t1_gvq239d,/r/AMA/comments/mxan9q/im_a_sex_education_teacher_and_i_know_you_all/gvqpla6/,1619308912,1,True,False,AMA,t5_2r4eo,,0,[],
[],,aquariiandromedae,,,[],,,,text,t2_5m9rr28p,False,False,[],If you google there are plenty of short and long answers as well as researches.,,,1619293035,{},gvqpla3,True,t3_mwsfw8,False,True,t1_gvqh7dp,/r/AMA/comments/mwsfw8/in_30_minutes_i_will_have_my_spinal_fluid/gvqpla3/,1619308912,1,True,False,AMA,t5_2r4eo,,0,[],
[],,Lumina_Luminesce,,,[],,,,text,t2_2tjpucyx,False,False,[],He couldn't do any of that and didn't like me doing it either. He's emotionally repressed,,,1619293009,{},gvqpjh4,True,t3_mxpdo0,False,True,t1_gvqpavo,/r/AMA/comments/mxpdo0/i_dated_an_incel_ama/gvqpjh4/,1619308884,2,True,False,AMA,t5_2r4eo,,0,[],
[],,pekmezs,,,[],,,,text,t2_avsow5la,False,False,[],"Uh, donuts?",,,1619293002,{},gvqpiys,False,t3_mxnfsk,False,True,t3_mxnfsk,/r/AMA/comments/mxnfsk/im_a_cop_ama/gvqpiys/,1619308876,2,True,False,AMA,t5_2r4eo,,0,[],
[],,Squints1234567,,,[],,,,text,t2_3y1hwofy,False,True,[],"First off, thanks for your military service and what you do now for your community. 

It may have been asked, but what is your take on the “Blue Lives Matter” crowd? I wouldn’t mind sharing my thoughts with you (if your open to it), but want to hear from someone who wears the badge.",,,1619293001,{},gvqpiwt,False,t3_mxnfsk,False,True,t3_mxnfsk,/r/AMA/comments/mxnfsk/im_a_cop_ama/gvqpiwt/,1619308875,1,True,False,AMA,t5_2r4eo,,0,[],
[],,LeaguePuzzleheaded51,,,[],,,,text,t2_9yeoyns8,False,False,[],If you’re vaccinated then why do you care if other people get the vaccine?,,,1619292999,{},gvqpiqc,True,t3_mxogj3,False,True,t1_gvqntp5,/r/AMA/comments/mxogj3/im_not_getting_the_vaccine_ama/gvqpiqc/,1619308873,1,True,False,AMA,t5_2r4eo,,0,[],
[],,TAhornytourist,,,[],,,,text,t2_7oap6hvk,False,False,[],"Who emigrates, commonly? Entire families definitely, married men/women for some time, young people...",,,1619292992,{},gvqpi8d,False,t3_mxqaq2,False,True,t1_gvqp3db,/r/AMA/comments/mxqaq2/i_am_a_muslim_living_in_the_middle_east_ama/gvqpi8d/,1619308865,2,True,False,AMA,t5_2r4eo,,0,[],
[],,Reddit-Book-Bot,,,[],,,,text,t2_7hrja4bn,False,False,[],"Beep. Boop. I'm a robot.
Here's a copy of 

###[Quran](https://snewd.com/ebooks/quran/)

Was I a good bot? | [info](https://www.reddit.com/user/Reddit-Book-Bot/) | [More Books](https://old.reddit.com/user/Reddit-Book-Bot/comments/i15x1d/full_list_of_books_and_commands/)",,,1619292988,{},gvqphzv,False,t3_mxi5at,False,True,t1_gvqph36,/r/AMA/comments/mxi5at/im_a_muslim_with_pretty_good_knowledge_of_my/gvqphzv/,1619308862,1,True,False,AMA,t5_2r4eo,,0,[],
[],,R0XG4MER,,,[],,,,text,t2_1j3fmcvw,False,False,[],"Allah knows the best for us and he put the best rules, they have never and will never be changed. There are 2 sources that we get our religion from are quran and sunnah. Anything else that's different than what's said in them is not accepted at all",,,1619292975,{},gvqph36,True,t3_mxi5at,False,True,t1_gvq7l7k,/r/AMA/comments/mxi5at/im_a_muslim_with_pretty_good_knowledge_of_my/gvqph36/,1619308846,1,True,False,AMA,t5_2r4eo,,0,[],
[],,Lance990,,,[],,,,text,t2_gn6ambm,False,False,[],What do you you think of the Daniel Shavers case where cops gave a man conflicting orders then still shot the man who was crawling and begging for his life?,,,1619292966,{},gvqpgg9,False,t3_mxnfsk,False,False,t3_mxnfsk,/r/AMA/comments/mxnfsk/im_a_cop_ama/gvqpgg9/,1619308835,14,True,False,AMA,t5_2r4eo,,0,[],
[],,Squints1234567,,,[],,,,text,t2_3y1hwofy,False,True,[],"I have a friend that served with me in the AF, and become a sheriff after he got out. 

In his community, the law enforcement officers started coaching sports and they saw a dramatic decrease in violent calls and behavior. 

I know that isn’t always obtainable, but it sounds like community involvement in and out of uniform have a big impact IMO. 

Makes it tough when some neighborhoods attribute the police showing up to something bad going on.",,,1619292928,{},gvqpdq9,False,t3_mxnfsk,False,False,t1_gvq9q7l,/r/AMA/comments/mxnfsk/im_a_cop_ama/gvqpdq9/,1619308793,65,True,False,AMA,t5_2r4eo,,0,[],
[],,Leatherwreck,,,[],,,,text,t2_2kcidjxx,False,False,[],"A dumbass misogynist.  To have a  a good relationship you need to be open, vulnerable, be yourself without fear.",,,1619292887,{},gvqpavo,False,t3_mxpdo0,False,True,t1_gvqo6z4,/r/AMA/comments/mxpdo0/i_dated_an_incel_ama/gvqpavo/,1619308751,2,True,False,AMA,t5_2r4eo,,0,[],
[],,pommemiles,,,[],,,,text,t2_7wuy7aea,False,False,[],"Jesus, sounds like the guy could do with a kick up the arse and some therapy",,,1619292882,{},gvqpaj7,False,t3_mxpdo0,False,True,t1_gvqophb,/r/AMA/comments/mxpdo0/i_dated_an_incel_ama/gvqpaj7/,1619308745,2,True,False,AMA,t5_2r4eo,,0,[],
[],,olderthanbefore,,,[],,,,text,t2_4wt5uuew,False,False,[],Which city are you living in now? Will you try to go for further studies elsewhere/abroad?,,,1619292865,{},gvqp9c9,False,t3_mxqaq2,False,True,t1_gvqmkxy,/r/AMA/comments/mxqaq2/i_am_a_muslim_living_in_the_middle_east_ama/gvqp9c9/,1619308728,2,True,False,AMA,t5_2r4eo,,0,[],
[],,amthealmighty,,,[],,,,text,t2_7jb999ox,False,False,[],Does anal sex hurt,,,1619292842,{},gvqp7qi,False,t3_mxan9q,False,False,t3_mxan9q,/r/AMA/comments/mxan9q/im_a_sex_education_teacher_and_i_know_you_all/gvqp7qi/,1619308705,1,True,False,AMA,t5_2r4eo,,0,[],
[],,Swingingpedipalps,,,[],,,,text,t2_b867dwnp,False,True,[],What makes you want to study film? Like what is your vision? 🙂,,,1619292806,{},gvqp571,False,t3_mxoybj,False,True,t3_mxoybj,/r/AMA/comments/mxoybj/i_turn_18_on_the_26th_ama/gvqp571/,1619308667,2,True,False,AMA,t5_2r4eo,,0,[],
[],,Real_Space_Captain,,,[],,,,text,t2_2vy7016r,False,False,[],"My was raised in NYC (her family was originally from Italy/Boston) and my dad was raised in the south, mainly Virginia. She was Catholic and he was baptist. But politically they both shift back and forth, neither is democratic or republican, so that wasn’t much of an issue. Socially wise they are both the same now, my mom was raised with a socially liberal view due to some of her parents/grandparents’ history while my dad learned more once attending college and moving to the city.

They did both attend top universities and are extremely intelligent, so they have that similar background.",,,1619292798,{},gvqp4kv,True,t3_mxprz0,False,True,t1_gvqnn1r,/r/AMA/comments/mxprz0/my_mom_was_the_classic_cliche_of_a_rich_girl_who/gvqp4kv/,1619308659,2,True,False,AMA,t5_2r4eo,,0,[],
[],,ColdHooves,,,[],,,,text,t2_l8pd5,False,False,[],What are your thoughts on bodycamera data being publicly accessible?,,,1619292794,{},gvqp4bq,False,t3_mxnfsk,False,True,t3_mxnfsk,/r/AMA/comments/mxnfsk/im_a_cop_ama/gvqp4bq/,1619308655,1,True,False,AMA,t5_2r4eo,,0,[],
[],,mister_brian,,,[],,,,text,t2_9uii7,False,False,[],What’s the hardest part of your everyday job?,,,1619292794,{},gvqp4ap,False,t3_mxnfsk,False,True,t3_mxnfsk,/r/AMA/comments/mxnfsk/im_a_cop_ama/gvqp4ap/,1619308654,1,True,False,AMA,t5_2r4eo,,0,[],
[],,sakura_the_potato,,,[],,,,text,t2_6cxzbiky,False,False,[],"hmm, no where specific, Maybe Saudi Arabia is comon for arabs to emigrate to bc other countries kinda poor",,,1619292780,{},gvqp3db,True,t3_mxqaq2,False,True,t1_gvqodeh,/r/AMA/comments/mxqaq2/i_am_a_muslim_living_in_the_middle_east_ama/gvqp3db/,1619308640,2,True,False,AMA,t5_2r4eo,,0,[],
[],,pommemiles,,,[],,,,text,t2_7wuy7aea,False,False,[],"Yes to both. In my case the sensitivity calmed down after a while, but it's very sensitive and actually painful while it's growing",,,1619292775,{},gvqp2zj,True,t3_mxotst,False,True,t1_gvqoon2,/r/AMA/comments/mxotst/im_a_transgender_man_female_to_male_ama/gvqp2zj/,1619308635,1,True,False,AMA,t5_2r4eo,,0,[],
[],,WayzeeMary,,,[],,,,text,t2_5qkbd5zj,False,False,[],I signed a release so that this detective could get a copy of an urgent care document. He wrote a report that contradicted what the doctor said. Detective said nothing was broken. Radiologist said three of my ribs were broken.,,,1619292775,{},gvqp2yg,False,t3_mxnfsk,False,True,t1_gvqo7cd,/r/AMA/comments/mxnfsk/im_a_cop_ama/gvqp2yg/,1619308634,3,True,False,AMA,t5_2r4eo,,0,[],
[],,Blue-Corn,,,[],,,,text,t2_37jima4f,False,False,[],All the damn time. Most of the time everything goes smoothly. Happy endings don’t make headlines though.,,,1619292756,{},gvqp1ma,True,t3_mxnfsk,False,False,t1_gvqmgwh,/r/AMA/comments/mxnfsk/im_a_cop_ama/gvqp1ma/,1619308615,7,True,False,AMA,t5_2r4eo,,0,[],
[],,ama_compiler_bot,,,[],,,,text,t2_o5h275o,False,False,[],"
Table of Questions and Answers. Original answer linked - Please upvote the original questions and answers.
***

Question | Answer | Link
---------|----------|----------|
How is nature over there? Do you like gardening? Do you have a garden?|Not really committed enough to take care of a garden. After killing a few plants i have given up now. But many people are really passionate about gardening especially with all these lockdowns|[Here](/r/AMA/comments/mx2203/tipsy_25f_indian_ama/gvlrqxi/)
do you hunt|Nope. Never have. I dont its legal here|[Here](/r/AMA/comments/mx2203/tipsy_25f_indian_ama/gvli2jw/)
Are your parents going to arrange a husband for you?|Definitely. They are looking out one for my elder sister right now.|[Here](/r/AMA/comments/mx2203/tipsy_25f_indian_ama/gvlj6iy/)
Is the covid situation in India as bad as western media portrays?|Unfortunately yes. Last couple of weeks have been really hard. With so many active cases and lack of facilities so many people have died.  There is complete lockdown in multiple states now, hoping the situation might get a but better in couple of weeks|[Here](/r/AMA/comments/mx2203/tipsy_25f_indian_ama/gvlr8is/)
[deleted]|Maybe sometimes (when my parents don’t allow me to do stuff i really want to) But i do think that all this freedom comes with its own responsibilities and negatives, no?|[Here](/r/AMA/comments/mx2203/tipsy_25f_indian_ama/gvls0lw/)
[deleted]|Ohh its the absolute best. I love weddings. Imagine a big party that lasts for 3-4 days with fun customs and dancing and enjoying while you are all dressed up with your friends and family. Weddings also have amazing food|[Here](/r/AMA/comments/mx2203/tipsy_25f_indian_ama/gvlt937/)
[deleted]|People dont pay dowry per se. Its like lets say the girls parents give her some gift as a part of wedding and rhe guys parents also do the same. Since here you are living with the guys parents ultimately everything is going to their house.  But there are worse cases where the guys family demand certain gifts. That still exists.  The guy i marry is not getting anything other than me :p|[Here](/r/AMA/comments/mx2203/tipsy_25f_indian_ama/gvlvrxk/)
[deleted]|Ohh yeah. A lot of times. Once you are out of the house no one really know where you are going or with whom. As long as you reach back home on time|[Here](/r/AMA/comments/mx2203/tipsy_25f_indian_ama/gvlwm60/)
[deleted]|If you have to come back home by 9 every single day then there is nothing too wild that you can do. Sorry to disappoint|[Here](/r/AMA/comments/mx2203/tipsy_25f_indian_ama/gvlxcnw/)
[deleted]|I am really short so heels for life!|[Here](/r/AMA/comments/mx2203/tipsy_25f_indian_ama/gvlxp5v/)
You like bollywood of kpop more?|Bollywood|[Here](/r/AMA/comments/mx2203/tipsy_25f_indian_ama/gvq9qno/)

---
[Source] (https://github.com/johnsliao/ama_compiler)",,,1619292738,{},gvqp0b1,False,t3_mx2203,False,True,t3_mx2203,/r/AMA/comments/mx2203/tipsy_25f_indian_ama/gvqp0b1/,1619308595,1,True,False,AMA,t5_2r4eo,,0,[],
[],,that-achadia,,,[],,,,text,t2_62g9z2ki,False,False,[],How old are you now? Do you wish to pursue acting again?,,,1619292723,{},gvqoz9v,False,t3_mxqhzo,False,True,t3_mxqhzo,/r/AMA/comments/mxqhzo/my_twin_and_i_were_baby_actors_growing_up_and/gvqoz9v/,1619308579,1,True,False,AMA,t5_2r4eo,,0,[],
[],,Blue-Corn,,,[],,,,text,t2_37jima4f,False,False,[],"I don’t think I have any good answers. If I did I probably would make more money. I think the training is good, but we need more of it. Better outside programs. Better pay to attract good people. I don’t know. I’m not that high up to think about how to fix the world. I just focus on my little slice of it all.",,,1619292719,{},gvqoz0o,True,t3_mxnfsk,False,False,t1_gvqk9a2,/r/AMA/comments/mxnfsk/im_a_cop_ama/gvqoz0o/,1619308575,47,True,False,AMA,t5_2r4eo,,0,[],
[],,TAhornytourist,,,[],,,,text,t2_7oap6hvk,False,False,[],"Completely fine, don't worry!

I think Greek guys are very attractive too!

Do you usually travel alone, with relatives or with friends?",,,1619292703,{},gvqoxw3,False,t3_mxpus8,False,True,t1_gvqofzb,/r/AMA/comments/mxpus8/i_have_been_to_a_shit_ton_a_countries_ama/gvqoxw3/,1619308558,1,True,False,AMA,t5_2r4eo,,0,[],
[],,Spiritual-Chameleon,,,[],,,,text,t2_5ezdvehh,False,False,[],I saw an opinion piece in the [New York Times](https://www.nytimes.com/2021/04/15/opinion/police-daunte-wright-traffic-stops.html) that technology should be used instead of police for a good number of routine traffic stops (not all). I'm not even sure I entirely agree with the premise (people have revolted against traffic cameras) but it is an interesting idea that seems worth exploring. What is your opinion?,,,1619292698,{},gvqoxi7,False,t3_mxnfsk,False,True,t3_mxnfsk,/r/AMA/comments/mxnfsk/im_a_cop_ama/gvqoxi7/,1619308553,1,True,False,AMA,t5_2r4eo,,0,[],
[],,Takafraka,,,[],,,,text,t2_omc58,False,False,[],How come people online say the police need more training and it’s only 12 weeks? Is it different state to state?,,,1619292674,{},gvqovpt,False,t3_mxnfsk,False,True,t1_gvq9yxi,/r/AMA/comments/mxnfsk/im_a_cop_ama/gvqovpt/,1619308527,3,True,False,AMA,t5_2r4eo,,0,[],
[],,TheLego27,,,[],,,,text,t2_4dmfzcoe,False,False,[],"as far as i know, i do not have one yet",,,1619292625,{},gvqos7z,True,t3_mxo218,False,True,t1_gvqloaw,/r/AMA/comments/mxo218/i_will_answer_all_your_questions_100_honestly_ama/gvqos7z/,1619308474,1,True,False,AMA,t5_2r4eo,,0,[],
[],,Blue-Corn,,,[],,,,text,t2_37jima4f,False,False,[],"Guy yelling gibberish and “gun” in a hotel room with the door locked.

Almost getting hit by a car while directing traffic.

Shots fired from inside a house over my head when I’m watching the back door.",,,1619292604,{},gvqoqs1,True,t3_mxnfsk,False,False,t1_gvqk384,/r/AMA/comments/mxnfsk/im_a_cop_ama/gvqoqs1/,1619308453,79,True,False,AMA,t5_2r4eo,,0,[],
[],,Lumina_Luminesce,,,[],,,,text,t2_2tjpucyx,False,False,[],"Exactly! The saddest part is he had potential. He's attractive, he's athletic but his attitude suck and he barely grooms. Shower? Never met her. I would've gladly stayed with him if he just wasn't so god damn insufferable and rude",,,1619292586,{},gvqophb,True,t3_mxpdo0,False,True,t1_gvqoi6d,/r/AMA/comments/mxpdo0/i_dated_an_incel_ama/gvqophb/,1619308434,2,True,False,AMA,t5_2r4eo,,0,[],
[],,[deleted],,,,,,dark,,,,,[],[deleted],,,1619292576,{},gvqoorv,False,t3_mxan9q,False,True,t1_gvnhctz,/r/AMA/comments/mxan9q/im_a_sex_education_teacher_and_i_know_you_all/gvqoorv/,1619308424,1,True,False,AMA,t5_2r4eo,,0,[],
[],,pellium6,,,[],,,,text,t2_88d8zcef,False,False,[],Is the 'T dick' super sensitive and thicker?,,,1619292574,{},gvqoon2,False,t3_mxotst,False,True,t3_mxotst,/r/AMA/comments/mxotst/im_a_transgender_man_female_to_male_ama/gvqoon2/,1619308422,1,True,False,AMA,t5_2r4eo,,0,[],
[],,Caspiasx,,,[],,,,text,t2_phygxuh,False,False,[],its only illegal if u get caught right,,,1619292569,{},gvqoo7f,False,t3_mxnfsk,False,True,t3_mxnfsk,/r/AMA/comments/mxnfsk/im_a_cop_ama/gvqoo7f/,1619308415,-1,True,False,AMA,t5_2r4eo,,0,[],
[],,theQueerExtrovert,,,[],,,,text,t2_b4pc6efz,False,False,[],"could be, imagining it like a subservient and the receiving one. the bottom would prefer to out out the top etc etc",,,1619292500,{},gvqoj8y,True,t3_mxai2y,False,True,t1_gvqnle7,/r/AMA/comments/mxai2y/i_am_a_bisexual_top_ama/gvqoj8y/,1619308341,1,True,False,AMA,t5_2r4eo,,0,[],
[],,pommemiles,,,[],,,,text,t2_7wuy7aea,False,False,[],"Oh dear god. He sounds like a piece of shit, you deserve a lot better than that 

I can't stand the whole incel mentality honestly. 99% of these guys just have terrible personalities and want to blame anyone but themselves",,,1619292485,{},gvqoi6d,False,t3_mxpdo0,False,True,t1_gvqo220,/r/AMA/comments/mxpdo0/i_dated_an_incel_ama/gvqoi6d/,1619308325,2,True,False,AMA,t5_2r4eo,,0,[],
[],,Blue-Corn,,,[],,,,text,t2_37jima4f,False,False,[],Are the feds taking over? That’s some 1984 shit. I don’t know if I’m down for a big brother scenario.,,,1619292481,{},gvqohwg,True,t3_mxnfsk,False,False,t1_gvqjyuu,/r/AMA/comments/mxnfsk/im_a_cop_ama/gvqohwg/,1619308321,7,True,False,AMA,t5_2r4eo,,0,[],
[],,justanothermcrfan,,,[],,,,text,t2_kgx3b,False,False,[],More masturbation related but is reading porn just as bad for your mind as watching it?,,,1619292467,{},gvqogxm,False,t3_mxan9q,False,True,t3_mxan9q,/r/AMA/comments/mxan9q/im_a_sex_education_teacher_and_i_know_you_all/gvqogxm/,1619308306,1,True,False,AMA,t5_2r4eo,,0,[],
[],,PoliceThrowaway78,,,[],,,,text,t2_azokx94z,False,False,[],"We should not ""always"" back the blue. Sometimes the blue are wrong. Sincerely, Member of The Blue",,,1619292461,{},gvqogil,False,t3_mxnfsk,False,False,t1_gvqm0cn,/r/AMA/comments/mxnfsk/im_a_cop_ama/gvqogil/,1619308300,15,True,False,AMA,t5_2r4eo,,0,[],
[],,_G_r_a_y_a_m_,,,[],,,,text,t2_bqn5dfvd,False,False,[],I don't want to talk about my love life if that's alright. It's a hard question and honestly young people from all over the world are beautiful but I'd say Greece if i had to pick one,,,1619292454,{},gvqofzb,True,t3_mxpus8,False,True,t1_gvqo5sv,/r/AMA/comments/mxpus8/i_have_been_to_a_shit_ton_a_countries_ama/gvqofzb/,1619308292,2,True,False,AMA,t5_2r4eo,,0,[],
[],,ijustwannabrowseit,,,[],,,,text,t2_bqhele2v,False,False,[],"How organic we talking, I've seen everything from Japanese knotweed to just about every dead animal in the UK",,,1619292452,{},gvqofvv,True,t3_mxkxb3,False,True,t1_gvql8qr,/r/AMA/comments/mxkxb3/i_work_for_a_open_to_public_household_waste/gvqofvv/,1619308291,1,True,False,AMA,t5_2r4eo,,0,[],
[],,McBoeingBusA172MAX,,,[],,,,text,t2_ait6fu6m,False,False,[],What's the max youd let someone go over the speed limit before you pull them over,,,1619292440,{},gvqof26,False,t3_mxnfsk,False,False,t3_mxnfsk,/r/AMA/comments/mxnfsk/im_a_cop_ama/gvqof26/,1619308278,1,True,False,AMA,t5_2r4eo,,0,[],
