all_awardings,associated_award,author,author_flair_background_color,author_flair_css_class,author_flair_richtext,author_flair_template_id,author_flair_text,author_flair_text_color,author_flair_type,author_fullname,author_patreon_flair,author_premium,awarders,body,collapsed_because_crowd_control,comment_type,created_utc,gildings,id,is_submitter,link_id,locked,no_follow,parent_id,permalink,retrieved_on,score,send_replies,stickied,subreddit,subreddit_id,top_awarded_type,total_awards_received,treatment_tags,author_cakeday,distinguished
[],,arrowfuckinghead,,,[],,,,text,t2_a7t99yu2,False,True,[],"It was real AND drinking lots of water can help someone squirt.

Everything we put in our bodies affects our ejaculation consistency, smell, taste.",,,1619244207,{},gvnkkqv,True,t3_mxan9q,False,False,t1_gvnk76f,/r/AMA/comments/mxan9q/im_a_sex_education_teacher_and_i_know_you_all/gvnkkqv/,1619257309,13,True,False,AMA,t5_2r4eo,,0,[],,
[],,Medz86,,,[],,,,text,t2_fslvrjd,False,False,[],A business partner?,,,1619244197,{},gvnkkae,False,t3_mxcv7c,False,True,t3_mxcv7c,/r/AMA/comments/mxcv7c/i_just_broke_up_with_my_partner_but_feel_like/gvnkkae/,1619257303,1,True,False,AMA,t5_2r4eo,,0,[],,
[],,arrowfuckinghead,,,[],,,,text,t2_a7t99yu2,False,True,[],"If you get sore too often, you can potentially do nerve damage. The penis is really a skin balloon full of blood, so you don’t want to be too harsh to it!",,,1619244166,{},gvnkj31,True,t3_mxan9q,False,False,t1_gvnk7jy,/r/AMA/comments/mxan9q/im_a_sex_education_teacher_and_i_know_you_all/gvnkj31/,1619257287,2,True,False,AMA,t5_2r4eo,,0,[],,
[],,arrowfuckinghead,,,[],,,,text,t2_a7t99yu2,False,True,[],"Hi! My first question would be, when you say “could not” does that mean it hurt too much?

You may have had a more sensitive or thick hymen. They vary so much and can be ruptured by sitting in a certain position, so that’s normal. 

But don’t discount a yeast infection! That could make your vagina so sore, painful and sensitive.",,,1619244127,{},gvnkhbq,True,t3_mxan9q,False,False,t1_gvnk93h,/r/AMA/comments/mxan9q/im_a_sex_education_teacher_and_i_know_you_all/gvnkhbq/,1619257263,16,True,False,AMA,t5_2r4eo,,0,[],,
[],,Chance_Deal9156,,,[],,,,text,t2_9xbxf7ls,False,False,[],"What you're best advice for incels
The no hateful kind.",,,1619244022,{},gvnkcu0,False,t3_mxan9q,False,True,t3_mxan9q,/r/AMA/comments/mxan9q/im_a_sex_education_teacher_and_i_know_you_all/gvnkcu0/,1619257200,2,True,False,AMA,t5_2r4eo,,0,[],,
[],,[deleted],,,,,,dark,,,,,[],[deleted],,,1619243980,{},gvnkb0w,False,t3_mxan9q,False,False,t1_gvnk5x3,/r/AMA/comments/mxan9q/im_a_sex_education_teacher_and_i_know_you_all/gvnkb0w/,1619257176,4,True,False,AMA,t5_2r4eo,,0,[],,
[],,[deleted],,,,,,dark,,,,,[],[deleted],,,1619243971,{},gvnkams,False,t3_mxan9q,False,True,t3_mxan9q,/r/AMA/comments/mxan9q/im_a_sex_education_teacher_and_i_know_you_all/gvnkams/,1619257171,1,True,False,AMA,t5_2r4eo,,0,[],,
[],,arrowfuckinghead,,,[],,,,text,t2_a7t99yu2,False,True,[],I’ve never heard that!,,,1619243957,{},gvnka1l,True,t3_mxan9q,False,True,t1_gvnjqxg,/r/AMA/comments/mxan9q/im_a_sex_education_teacher_and_i_know_you_all/gvnka1l/,1619257163,3,True,False,AMA,t5_2r4eo,,0,[],,
[],,crybabymoon,,,[],,,,text,t2_3zon01xs,False,False,[],"I used to have this problem when my vagina just wouldn't let anything enter. I could not use tampons, and my ex boyfriend wasn't able to penetrate me either (even his fingers), even when I felt super turned on.

I went to the doctor's. She examined me, said she couldn't find anything and it was just a yeast infection. I treated it, and still no penetration possible and still a lot of pain and discomfort.

Later on, a few months into another relationship with a different partner, poof! My vagina ""opened up"" and I was able to have penetrative sex with my current boyfriend. After that I could also freely use tampons. I was flabbergasted at the sudden change, but so happy because it finally made me feel normal!

Any idea how this is possible? I have read about vaginismus but I have never read about it suddenly disappearing, like my case.",,,1619243936,{},gvnk93h,False,t3_mxan9q,False,False,t3_mxan9q,/r/AMA/comments/mxan9q/im_a_sex_education_teacher_and_i_know_you_all/gvnk93h/,1619257150,16,True,False,AMA,t5_2r4eo,,0,[],,
[],,aquariiandromedae,,,[],,,,text,t2_5m9rr28p,False,False,[],Sure 😊 yes I’ve been in several studies but often smaller ones and been paid in movie tickets or gift cards or very little money 100-1000 Swedish crones.,,,1619243917,{},gvnk89y,True,t3_mwsfw8,False,True,t1_gvnhpsd,/r/AMA/comments/mwsfw8/in_30_minutes_i_will_have_my_spinal_fluid/gvnk89y/,1619257138,3,True,False,AMA,t5_2r4eo,,0,[],,
[],,MeaningfulPlatitudes,,,[],,,,text,t2_3ut31v0d,False,False,[],In that vocation you’ll never make a killing.,,,1619243900,{},gvnk7kl,False,t3_mx2qlb,False,True,t3_mx2qlb,/r/AMA/comments/mx2qlb/im_a_holocaust_and_genocide_studies_major_ama/gvnk7kl/,1619257128,1,True,False,AMA,t5_2r4eo,,0,[],,
[],,Confused__man,,,[],,,,text,t2_9ftehwdg,False,False,[],Its generally bed or some soft flat surface. I agree sometimes it gets really sore!!,,,1619243900,{},gvnk7jy,False,t3_mxan9q,False,True,t1_gvnjwqz,/r/AMA/comments/mxan9q/im_a_sex_education_teacher_and_i_know_you_all/gvnk7jy/,1619257128,3,True,False,AMA,t5_2r4eo,,0,[],,
[],,AlarmedDuck42,,,[],,,,text,t2_37ktjmxt,False,False,[],Let’s say one has “squirted” during an orgasm before and it wasn’t intentional. Was it real? or just because one had drank a lot of water?,,,1619243891,{},gvnk76f,False,t3_mxan9q,False,False,t1_gvn4bo9,/r/AMA/comments/mxan9q/im_a_sex_education_teacher_and_i_know_you_all/gvnk76f/,1619257123,7,True,False,AMA,t5_2r4eo,,0,[],,
[],,[deleted],,,,,,dark,,,,,[],[deleted],,,1619243862,{},gvnk5xq,False,t3_mxan9q,False,False,t1_gvnk02d,/r/AMA/comments/mxan9q/im_a_sex_education_teacher_and_i_know_you_all/gvnk5xq/,1619257107,5,True,False,AMA,t5_2r4eo,,0,[],,
[],,arrowfuckinghead,,,[],,,,text,t2_a7t99yu2,False,True,[],"Everyone should try it. Sharing energy and bodies through a deep connection is paramount for sexual pleasure.

Nowadays we sell people fast, hard sex like everyone like that — and they do not. Tantric sex is about connecting and pleasing your partner by being in touch with their body and how it responds to yours.",,,1619243861,{},gvnk5x3,True,t3_mxan9q,False,False,t1_gvnjgad,/r/AMA/comments/mxan9q/im_a_sex_education_teacher_and_i_know_you_all/gvnk5x3/,1619257107,20,True,False,AMA,t5_2r4eo,,0,[],,
[],,CALAZ1986,,,[],,,,text,t2_4cygxg1t,False,False,[],What can guys do to last longer?,,,1619243820,{},gvnk44i,False,t3_mxan9q,False,False,t3_mxan9q,/r/AMA/comments/mxan9q/im_a_sex_education_teacher_and_i_know_you_all/gvnk44i/,1619257082,6,True,False,AMA,t5_2r4eo,,0,[],,
[],,Uolak,,,[],,,,text,t2_10m6lzgi,False,False,[],Spoken like a true connoisseur,,,1619243749,{},gvnk12c,False,t3_mxan9q,False,True,t1_gvnjyox,/r/AMA/comments/mxan9q/im_a_sex_education_teacher_and_i_know_you_all/gvnk12c/,1619257041,3,True,False,AMA,t5_2r4eo,,0,[],,
[],,Clay_2000lbs,,,[],,,,text,t2_414xnw5e,False,False,[],"Thank you, stranger :)",,,1619243747,{},gvnk0zv,False,t3_mxan9q,False,True,t1_gvnhb3r,/r/AMA/comments/mxan9q/im_a_sex_education_teacher_and_i_know_you_all/gvnk0zv/,1619257041,2,True,False,AMA,t5_2r4eo,,0,[],,
[],,arrowfuckinghead,,,[],,,,text,t2_a7t99yu2,False,True,[],Yes! It’s complicated! 💕,,,1619243725,{},gvnk02d,True,t3_mxan9q,False,False,t1_gvnjehd,/r/AMA/comments/mxan9q/im_a_sex_education_teacher_and_i_know_you_all/gvnk02d/,1619257028,6,True,False,AMA,t5_2r4eo,,0,[],,
[],,[deleted],,,,,,dark,,,,,[],[deleted],,,1619243714,{},gvnjzkc,False,t3_mx5g2u,False,True,t1_gvm4go7,/r/AMA/comments/mx5g2u/i_am_clem_the_author_of_island_eyes_a_book_that/gvnjzkc/,1619257020,1,True,False,AMA,t5_2r4eo,,0,[],,
[],,angelictrauma,,,[],,,,text,t2_7r4bsl7k,False,False,[],not at all,,,1619243707,{},gvnjz9f,True,t3_mwo0q2,False,True,t1_gvmj7rr,/r/AMA/comments/mwo0q2/im_in_love_with_my_childhood_abuser_a_sex_worker/gvnjz9f/,1619257017,1,True,False,AMA,t5_2r4eo,,0,[],,
[],,arrowfuckinghead,,,[],,,,text,t2_a7t99yu2,False,True,[],Xvideos. PornHub is the TikTok of porn. Everything is being hand fed and shoveled to the users.,,,1619243694,{},gvnjyox,True,t3_mxan9q,False,False,t1_gvnj9wl,/r/AMA/comments/mxan9q/im_a_sex_education_teacher_and_i_know_you_all/gvnjyox/,1619257009,5,True,False,AMA,t5_2r4eo,,0,[],,
[],,[deleted],,,,,,dark,,,,,[],[deleted],,,1619243685,{},gvnjyav,False,t3_mxan9q,False,True,t3_mxan9q,/r/AMA/comments/mxan9q/im_a_sex_education_teacher_and_i_know_you_all/gvnjyav/,1619257003,1,True,False,AMA,t5_2r4eo,,0,[],,
[],,arrowfuckinghead,,,[],,,,text,t2_a7t99yu2,False,True,[],"Interesting! This is what is casually “dry humbling” it sounds. You are stimulated by the bed or whatever you are lying down on? 

Future relationships can be affected by excessive amounts of anything. If you masturbate and only want to have sex with the bed, then that could affect relationships.

But masturbating, as long as it doesn’t hurt you to do so, would not result in health issues. Vigorous movements might make you sore or pop a joint, so be careful in that’s way!",,,1619243649,{},gvnjwqz,True,t3_mxan9q,False,True,t1_gvnj1fw,/r/AMA/comments/mxan9q/im_a_sex_education_teacher_and_i_know_you_all/gvnjwqz/,1619256982,3,True,False,AMA,t5_2r4eo,,0,[],,
[],,[deleted],,,,,,dark,,,,,[],[deleted],,,1619243642,{},gvnjwfk,False,t3_mxan9q,False,True,t3_mxan9q,/r/AMA/comments/mxan9q/im_a_sex_education_teacher_and_i_know_you_all/gvnjwfk/,1619256977,-1,True,False,AMA,t5_2r4eo,,0,[],,
[],,Some_Orchid917,,,[],,,,text,t2_ab78lx9b,False,False,[],What are the most unique misconceptions about pregnancy that you have heard?,,,1619243634,{},gvnjw2k,False,t3_mxan9q,False,False,t1_gvnf2kh,/r/AMA/comments/mxan9q/im_a_sex_education_teacher_and_i_know_you_all/gvnjw2k/,1619256973,7,True,False,AMA,t5_2r4eo,,0,[],,
[],,Lazy-Guidance1910,,,[],,,,text,t2_a5jmk0fp,False,False,[],Thanks,,,1619243632,{},gvnjw0j,True,t3_mx2ljw,False,True,t1_gvnhuhs,/r/AMA/comments/mx2ljw/i_work_in_a_bank_in_rural_india_ama/gvnjw0j/,1619256972,1,True,False,AMA,t5_2r4eo,,0,[],,
[],,[deleted],,,,,,dark,,,,,[],[deleted],,,1619243628,{},gvnjvue,False,t3_mxan9q,False,True,t3_mxan9q,/r/AMA/comments/mxan9q/im_a_sex_education_teacher_and_i_know_you_all/gvnjvue/,1619256969,-1,True,False,AMA,t5_2r4eo,,0,[],,
[],,Lazy-Guidance1910,,,[],,,,text,t2_a5jmk0fp,False,False,[],IAS,,,1619243594,{},gvnjueq,True,t3_mx2ljw,False,True,t1_gvnhuhs,/r/AMA/comments/mx2ljw/i_work_in_a_bank_in_rural_india_ama/gvnjueq/,1619256949,2,True,False,AMA,t5_2r4eo,,0,[],,
[],,Discochickens,,,[],,,,text,t2_ib0as,False,False,[],Lol sigh. Really? In your extremely limited experience you think that’s the only way to test for a RESPIRATORY virus? (Think hard for a minute),,,1619243564,{},gvnjt4n,False,t3_mwsfw8,False,True,t1_gvly0sv,/r/AMA/comments/mwsfw8/in_30_minutes_i_will_have_my_spinal_fluid/gvnjt4n/,1619256932,1,True,False,AMA,t5_2r4eo,,0,[],,
[],,[deleted],,,,,,dark,,,,,[],[deleted],,,1619243555,{},gvnjsqd,False,t3_mxan9q,False,True,t1_gvnjist,/r/AMA/comments/mxan9q/im_a_sex_education_teacher_and_i_know_you_all/gvnjsqd/,1619256926,1,True,False,AMA,t5_2r4eo,,0,[],,
[],,Lazy-Guidance1910,,,[],,,,text,t2_a5jmk0fp,False,False,[],28,,,1619243555,{},gvnjsq1,True,t3_mx2ljw,False,True,t1_gvnii15,/r/AMA/comments/mx2ljw/i_work_in_a_bank_in_rural_india_ama/gvnjsq1/,1619256926,1,True,False,AMA,t5_2r4eo,,0,[],,
[],,[deleted],,,,,,dark,,,,,[],[deleted],,,1619243540,{},gvnjs40,False,t3_mxan9q,False,True,t1_gvnjmbi,/r/AMA/comments/mxan9q/im_a_sex_education_teacher_and_i_know_you_all/gvnjs40/,1619256918,1,True,False,AMA,t5_2r4eo,,0,[],,
[],,[deleted],,,,,,dark,,,,,[],[deleted],,,1619243520,{},gvnjr79,False,t3_mxan9q,False,False,t1_gvnjprd,/r/AMA/comments/mxan9q/im_a_sex_education_teacher_and_i_know_you_all/gvnjr79/,1619256906,4,True,False,AMA,t5_2r4eo,,0,[],,
[],,gamebow1,,,[],,,,text,t2_jmtdo6q,False,False,[],What time does the bell go ? (It happens in every sex ed class and you know it lmao),,,1619243514,{},gvnjqxg,False,t3_mxan9q,False,True,t3_mxan9q,/r/AMA/comments/mxan9q/im_a_sex_education_teacher_and_i_know_you_all/gvnjqxg/,1619256902,0,True,False,AMA,t5_2r4eo,,0,[],,
[],,Shinespark7,,,[],,,,text,t2_1q382gv7,False,False,[],What's your perception of what things were like in the 80's or 90's?,,,1619243510,{},gvnjqsk,False,t3_mxdb7g,False,True,t3_mxdb7g,/r/AMA/comments/mxdb7g/i_just_turned_16_ama/gvnjqsk/,1619256900,2,True,False,AMA,t5_2r4eo,,0,[],,
[],,arrowfuckinghead,,,[],,,,text,t2_a7t99yu2,False,True,[],"You can, of course, tell her that you like feet and want to try something. You cannot convince her to like it. She might not want to try it, and you’ll have to accept that she wouldn’t want to do so. 

But you could approach it as “hey, I saw something that turned me on, would you try it with me?”",,,1619243487,{},gvnjprd,True,t3_mxan9q,False,False,t1_gvnio61,/r/AMA/comments/mxan9q/im_a_sex_education_teacher_and_i_know_you_all/gvnjprd/,1619256886,10,True,False,AMA,t5_2r4eo,,0,[],,
[],,arrowfuckinghead,,,[],,,,text,t2_a7t99yu2,False,True,[],"Bacteria will pass regardless. Mouths and genitals have bacteria in them. If neither partner has an STI and then nobody cheats, then you won’t give each other an STI.

However, if one partner contracts an STI from sharing needles (drugs usually) then they could give their partner than STI sexually.",,,1619243409,{},gvnjmbi,True,t3_mxan9q,False,True,t1_gvnimaj,/r/AMA/comments/mxan9q/im_a_sex_education_teacher_and_i_know_you_all/gvnjmbi/,1619256839,3,True,False,AMA,t5_2r4eo,,0,[],,
[],,upstairspizza,,,[],,,,text,t2_303tkfi9,False,False,[],How to sex?,,,1619243369,{},gvnjkjg,False,t3_mxan9q,False,True,t3_mxan9q,/r/AMA/comments/mxan9q/im_a_sex_education_teacher_and_i_know_you_all/gvnjkjg/,1619256814,0,True,False,AMA,t5_2r4eo,,0,[],,
[],,Repulsive-Ad1330,,,[],,,,text,t2_8ccvwddk,False,False,[],"There are non-latex condoms available at most drug stores. Less variety, but widely available, feel the same. 

On a more personal note have used the regular latex as well. Surprisingly don't have much of a reaction passed maybe a lil redness and itchiness, but I just shower if I use one and its fine. For some reason that area south doesn't seem to react as much as other skin.",,,1619243357,{},gvnjk0w,True,t3_mwkyz2,False,True,t1_gvnc7js,/r/AMA/comments/mwkyz2/i_am_allergic_to_latex_milk_tree_nuts_shellfish/gvnjk0w/,1619256806,1,True,False,AMA,t5_2r4eo,,0,[],,
[],,arrowfuckinghead,,,[],,,,text,t2_a7t99yu2,False,True,[],"For Google or porn sites, look up “amateur” or “porn for women” — that’s how it is tagged!",,,1619243329,{},gvnjist,True,t3_mxan9q,False,False,t1_gvnigkl,/r/AMA/comments/mxan9q/im_a_sex_education_teacher_and_i_know_you_all/gvnjist/,1619256790,6,True,False,AMA,t5_2r4eo,,0,[],,
[],,[deleted],,,,,,dark,,,,,[],[deleted],,,1619243290,{},gvnjh5d,False,t3_mxan9q,False,True,t3_mxan9q,/r/AMA/comments/mxan9q/im_a_sex_education_teacher_and_i_know_you_all/gvnjh5d/,1619256768,-1,True,False,AMA,t5_2r4eo,,0,[],,
[],,arrowfuckinghead,,,[],,,,text,t2_a7t99yu2,False,True,[],"This is not awkward at all! Most women on the planet don’t really know what their period is....so don’t worry!

Females, generally, have a regular cycle of about 28-32 days. During this cycle, here’s what happens: 

(1) The ovaries — which contain all of a female’s eggs, we are born with all of our eggs — will release a matured egg.

(2) That matured egg might have met with a sperm from ejaculation, but since it was not fertilized, the egg will fall through the uterus and actually out through the vagina. (Eggs are microscopic and we can’t see them!)

(3) While that egg was maturing, the uterus lining was building up with nutrients and blood, because that lining would be what a fertilized egg would need to survive as it develops into an embryo. 

(4) The egg falls through and the body realizes it doesn’t need that lining, so the uterus contracts and sheds its lining — that’s what period blood is, the shed lining of the uterus.

(5) Then the cycle starts again — 2 weeks of the egg maturing... a window of time when it is released (peak fertility/ovulation) and then the week when the body starts over, shedding the lining.",,,1619243275,{},gvnjghe,True,t3_mxan9q,False,False,t1_gvnhr3q,/r/AMA/comments/mxan9q/im_a_sex_education_teacher_and_i_know_you_all/gvnjghe/,1619256759,8,True,False,AMA,t5_2r4eo,,0,[],,
[],,rihon31042,,,[],,,,text,t2_bju1fjtq,False,False,[],"Do you know where the come from? Frustration?  Curiosity? Hopelessness? Phantasy? Need for attention? 
  
And what has so far been your most successful way of putting those thoughts away ?

'Suicidal thoughts' are a broad term, and not all of such thoughts are equally alarming.",,,1619243272,{},gvnjgc7,False,t3_mxd5aa,False,True,t3_mxd5aa,/r/AMA/comments/mxd5aa/suicidal_thoughts_passively_enter_my_mind/gvnjgc7/,1619256757,1,True,False,AMA,t5_2r4eo,,0,[],,
[],,[deleted],,,,,,dark,,,,,[],[deleted],,,1619243271,{},gvnjgad,False,t3_mxan9q,False,False,t3_mxan9q,/r/AMA/comments/mxan9q/im_a_sex_education_teacher_and_i_know_you_all/gvnjgad/,1619256756,14,True,False,AMA,t5_2r4eo,,0,[],,
[],,[deleted],,,,,,dark,,,,,[],[deleted],,,1619243230,{},gvnjehd,False,t3_mxan9q,False,False,t1_gvnj002,/r/AMA/comments/mxan9q/im_a_sex_education_teacher_and_i_know_you_all/gvnjehd/,1619256732,5,True,False,AMA,t5_2r4eo,,0,[],,
[],,Uolak,,,[],,,,text,t2_10m6lzgi,False,False,[],xvideos or pornhub,,,1619243128,{},gvnj9wl,False,t3_mxan9q,False,True,t3_mxan9q,/r/AMA/comments/mxan9q/im_a_sex_education_teacher_and_i_know_you_all/gvnj9wl/,1619256670,1,True,False,AMA,t5_2r4eo,,0,[],,
[],,alwaystired1233,,,[],,,,text,t2_55ljemri,False,False,[],Lol I’m sure it’ll happen and yea of course. Good luck with PD.,,,1619242979,{},gvnj3de,True,t3_mwtie9,False,True,t1_gvnd8gm,/r/AMA/comments/mwtie9/i_stabbed_someone_in_self_defense_at_a_party_when/gvnj3de/,1619256581,1,True,False,AMA,t5_2r4eo,,0,[],,
[],,rihon31042,,,[],,,,text,t2_bju1fjtq,False,False,[],Number of good friends in your life? And: Have a Happy Birthday!,,,1619242954,{},gvnj28i,False,t3_mxdb7g,False,False,t3_mxdb7g,/r/AMA/comments/mxdb7g/i_just_turned_16_ama/gvnj28i/,1619256566,3,True,False,AMA,t5_2r4eo,,0,[],,
[],,Confused__man,,,[],,,,text,t2_9ftehwdg,False,False,[],I have a habit of masturbating by lying down on my stomach and making my body move vigorously up and down. I get aroused by this and this is how I have always masturbated. Will this affect my sex life in future? Will this affect my health in any way?,,,1619242937,{},gvnj1fw,False,t3_mxan9q,False,True,t3_mxan9q,/r/AMA/comments/mxan9q/im_a_sex_education_teacher_and_i_know_you_all/gvnj1fw/,1619256555,3,True,False,AMA,t5_2r4eo,,0,[],,
[],,arrowfuckinghead,,,[],,,,text,t2_a7t99yu2,False,True,[],"Pregnancy happens after semen is ejaculated into the vagina (no condom, no birth control):

(1) The semen contains 300 million (give or take) sperm and those sperm are going to travel through the cervix, which is a portal to the uterus above the vagina. 

(2) Once through the cervix, the sperm will swim magnetically, almost, to the Fallopian tubes where they will look for a mature egg that has been released from the ovaries.

(3) The sperm that have survived at this point (they die along the way, it’s a tough journey) will gather around the egg and try to get the egg to meet with them. The egg and sperm kind of choose each other (fertilization), one sperm gets in most of the time and there’s one egg most of the time (if more than one sperm make it or more than one egg is present, you get twins and triplets).

(3) The fertilized egg will find its way down from the Fallopian tube and head towards the uterus. 

**all of the aforementioned steps can take up to 3 days to happen. Sperm survive in the uterus and Fallopian tubes for quite some time 

(4) The fertilized egg (zygote) must then implant on the uterus wall —&gt; that is pregnancy. 

Someone is not pregnant until implantation. It takes the body weeks to know a zygote has implanted. That’s why you can’t take a pregnancy test until weeks after unprotected sex.",,,1619242904,{},gvnj002,True,t3_mxan9q,False,False,t1_gvnhml5,/r/AMA/comments/mxan9q/im_a_sex_education_teacher_and_i_know_you_all/gvnj002/,1619256536,32,True,False,AMA,t5_2r4eo,,0,[],,
[],,Yesjrw,,,[],,,,text,t2_5go0lvqz,False,False,[],"Mary Jane, marijuana",,,1619242847,{},gvnixei,False,t3_mx525w,False,True,t1_gvmb4oe,/r/AMA/comments/mx525w/high_on_mary_in_a_roof_top_cold_breeze_ama/gvnixei/,1619256500,2,True,False,AMA,t5_2r4eo,,0,[],,
[],,Agent47isyourdad,,,[],,,,text,t2_9ycsgfvf,False,False,[],My breakfast is soon and i don't feel hungry but i'm going to eat it because i need to pass my meal check,,,1619242792,{},gvniuzm,True,t3_mx530w,False,True,t1_gvnimbs,/r/AMA/comments/mx530w/im_in_a_mental_hospital_and_its_time_for_bed_ama/gvniuzm/,1619256468,2,True,False,AMA,t5_2r4eo,,0,[],,
[],,Yesjrw,,,[],,,,text,t2_5go0lvqz,False,False,[],Are u a masochist?,,,1619242777,{},gvniub3,False,t3_mxc926,False,True,t3_mxc926,/r/AMA/comments/mxc926/i_use_light_mode_everything_even_the_windows/gvniub3/,1619256457,1,True,False,AMA,t5_2r4eo,,0,[],,
[],,rihon31042,,,[],,,,text,t2_bju1fjtq,False,False,[],"I'm glad you found your way, but I understand. I m a generally empathetic person (I think) but I have a hard time grasping the impact of various bad childhoods because I was lucky to personally have had the opposite. But I do have people in my circles and loved ones with different background and I can see the fallout every now and then.",,,1619242750,{},gvnit3b,False,t3_mwrwtm,False,True,t1_gvlri65,/r/AMA/comments/mwrwtm/im_the_product_of_an_affair_between_my_dad_and/gvnit3b/,1619256440,2,True,False,AMA,t5_2r4eo,,0,[],,
[],,Troll_More,,,[],,,,text,t2_adte7ily,False,False,[],"you consume the cum and it makes you die inside
i am the cum",,,1619242729,{},gvnis8m,True,t3_mx97t7,False,True,t1_gvn9u3j,/r/AMA/comments/mx97t7/i_am_cum_ama/gvnis8m/,1619256429,1,True,False,AMA,t5_2r4eo,,0,[],,
[],,bear_toes,,,[],,,,text,t2_4b7ffbbg,False,False,[],"Thank you. I suppose every relationship is sort of a crapshoot. If it works it works, if it doesn't... Well, it is what it is.

She was also unhappy but did not necessarily want things to end. I have been in a relationship previously that started down this path. Ended up being very on again off again over a few years. Felt more co-dependent than anything, and got quite toxic. I don't want to do that again, and I wouldn't want to subject her to that.

I don't not want her in my life. She's a great person. Maybe we can be in each other's life in a healthy way some day - whatever form of relationship that ends up being.",,,1619242711,{},gvnirfz,True,t3_mxcv7c,False,True,t1_gvnhd47,/r/AMA/comments/mxcv7c/i_just_broke_up_with_my_partner_but_feel_like/gvnirfz/,1619256417,1,True,False,AMA,t5_2r4eo,,0,[],,
[],,[deleted],,,,,,dark,,,,,[],[deleted],,,1619242642,{},gvnioba,False,t3_mxdb7g,False,True,t3_mxdb7g,/r/AMA/comments/mxdb7g/i_just_turned_16_ama/gvnioba/,1619256373,1,True,False,AMA,t5_2r4eo,,0,[],,
[],,[deleted],,,,,,dark,,,,,[],[deleted],,,1619242639,{},gvnio61,False,t3_mxan9q,False,True,t1_gvni6kp,/r/AMA/comments/mxan9q/im_a_sex_education_teacher_and_i_know_you_all/gvnio61/,1619256371,4,True,False,AMA,t5_2r4eo,,0,[],,
[],,[deleted],,,,,,dark,,,,,[],[removed],,,1619242625,{},gvninhs,False,t3_mx2203,False,True,t3_mx2203,/r/AMA/comments/mx2203/tipsy_25f_indian_ama/gvninhs/,1619256362,1,True,False,AMA,t5_2r4eo,,0,[],,
[],,superbloggity,,,[],,,,text,t2_m03sk5n,False,True,[],"I think that just the Anesthesia alone takes a bit to recover from. And those painkillers.... Oh wow. Most surgeries I've had, it takes a few weeks just to recover from the drugs involved.",,,1619242620,{},gvninaq,False,t3_mxan9q,False,True,t1_gvnh17v,/r/AMA/comments/mxan9q/im_a_sex_education_teacher_and_i_know_you_all/gvninaq/,1619256359,2,True,False,AMA,t5_2r4eo,,0,[],,
[],,chemeli8,,,[],,,,text,t2_1129o0hv,False,False,[],"i spent three times in a mental hospital and the worst was how boring it was. at least you have internet, i didn’t.",,,1619242600,{},gvnimbs,False,t3_mx530w,False,True,t3_mx530w,/r/AMA/comments/mx530w/im_in_a_mental_hospital_and_its_time_for_bed_ama/gvnimbs/,1619256346,2,True,False,AMA,t5_2r4eo,,0,[],,
[],,[deleted],,,,,,dark,,,,,[],[deleted],,,1619242599,{},gvnimaj,False,t3_mxan9q,False,True,t1_gvni85l,/r/AMA/comments/mxan9q/im_a_sex_education_teacher_and_i_know_you_all/gvnimaj/,1619256345,2,True,False,AMA,t5_2r4eo,,0,[],,
[],,[deleted],,,,,,dark,,,,,[],[deleted],,,1619242555,{},gvnikaa,False,t3_mxan9q,False,True,t1_gvnifla,/r/AMA/comments/mxan9q/im_a_sex_education_teacher_and_i_know_you_all/gvnikaa/,1619256319,1,True,False,AMA,t5_2r4eo,,0,[],,
[],,digitalwriternow,,,[],,,,text,t2_4t2cqpe4,False,False,[],How old are you?,,,1619242507,{},gvnii15,False,t3_mx2ljw,False,True,t3_mx2ljw,/r/AMA/comments/mx2ljw/i_work_in_a_bank_in_rural_india_ama/gvnii15/,1619256287,1,True,False,AMA,t5_2r4eo,,0,[],,
[],,rja2391,,,[],,,,text,t2_1vjqcm7i,False,False,[],Thank you for your advice again. Let me see what I can do about it. Your replies have been helpful.,,,1619242483,{},gvnigvr,False,t3_mxan9q,False,False,t1_gvnhwa7,/r/AMA/comments/mxan9q/im_a_sex_education_teacher_and_i_know_you_all/gvnigvr/,1619256270,4,True,False,AMA,t5_2r4eo,,0,[],,
[],,[deleted],,,,,,dark,,,,,[],[deleted],,,1619242476,{},gvnigkl,False,t3_mxan9q,False,False,t1_gvniagj,/r/AMA/comments/mxan9q/im_a_sex_education_teacher_and_i_know_you_all/gvnigkl/,1619256266,4,True,False,AMA,t5_2r4eo,,0,[],,
